学校名称,办学层次,学校性质,学校类别,主管部门,所在省份,所在城市,创建时间,学校地址,学校官网,学校简称,曾用名,占地面积（亩）,985工程,211工程
上海民远职业技术学院,专科（高职）,民办,财经类,上海市教委,上海,上海市,1998,上海市浦东新区唐陆路3892号,http://www.shmy.edu.cn,民远学院,,120,2,2
上海工商外国语职业学院,专科（高职）,民办,语言类,上海市教委,上海,上海市,2001,上海市浦东新区惠南镇观海路505号,https://www.sicfl.edu.cn/,上海工商外国语学院,,320,2,2
广西体育高等专科学校,专科（高职）,公办,体育类,广西壮族自治区,广西,南宁市,1956,广西壮族自治区南宁市公园路2号,http://www.gxtznn.com/,,,131,2,2
广西科技师范学院,普通本科,公办,师范类,广西壮族自治区,广西,来宾市,1958,广西壮族自治区来宾市兴宾区铁北大道966号,https://www.gxstnu.edu.cn/,"广西科师,GXSTNU",柳州师范高等专科学校,1617,2,2
桂林师范高等专科学校,专科（高职）,公办,师范类,广西壮族自治区,广西,桂林市,1938,广西壮族自治区桂林市临桂区飞虎路9号,http://www.glnc.edu.cn,桂林师专,,1096,2,2
桂林航天工业学院,普通本科,公办,理工类,广西壮族自治区,广西,桂林市,1979,广西壮族自治区桂林市金鸡路2号,http://www.guat.edu.cn,桂航,桂林航天工业高等专科学校,1031,2,2
桂林旅游学院,普通本科,公办,财经类,广西壮族自治区,广西,桂林市,1985,广西壮族自治区桂林市雁山区良丰路26号,http://www.gltu.edu.cn/,桂林旅院,桂林旅游高等专科学校,1885,2,2
广西警察学院,普通本科,公办,政法类,广西壮族自治区,广西,南宁市,1950,广西壮族自治区南宁市长湖路6号,http://www.gxjcxy.com/,"广西警院,GXPC",广西警官高等专科学校,1750,2,2
广西机电职业技术学院,专科（高职）,公办,理工类,广西壮族自治区,广西,南宁市,1958,广西壮族自治区南宁市大学东路101号,http://www.gxcme.edu.cn/,广西机电,,776,2,2
南宁职业技术学院,专科（高职）,公办,综合类,广西壮族自治区,广西,南宁市,1984,广西壮族自治区南宁市大学西路169号,https://www.nncvt.edu.cn/,南宁职院,,1783,2,2
广西水利电力职业技术学院,专科（高职）,公办,理工类,广西壮族自治区,广西,南宁市,1956,"长堽校区：广西壮族自治区南宁市长堽路99号,里建校区：广西壮族自治区南宁市东盟经济开发区长岗大道98号,大沙田校区：广西壮族自治区南宁市五象大道104号",http://www.gxsdxy.cn,,,1100,2,2
广西职业技术学院,专科（高职）,公办,农林类,广西壮族自治区,广西,南宁市,1965,广西壮族自治区南宁市江南区明阳大道19号,http://www.gxzjy.edu.cn/,,,943,2,2
柳州职业技术学院,专科（高职）,公办,综合类,广西壮族自治区,广西,柳州市,1972,"社湾校区：广西壮族自治区柳州市鱼峰区社湾路28号,官塘校区：广西壮族自治区柳州市鱼峰区官塘大道16号",http://www.lzzy.net/,"柳职,柳职院",,1109,2,2
广西生态工程职业技术学院,专科（高职）,公办,农林类,广西壮族自治区,广西,柳州市,1956,广西壮族自治区柳州市柳北区君武路168号,http://www.gxstzy.cn,广西生态学院,,18000,2,2
广西交通职业技术学院,专科（高职）,公办,理工类,广西壮族自治区,广西,南宁市,1958,广西壮族自治区南宁市园湖北路12号,http://www.gxjzy.com/JZYWEB/index.php,"广西交职院,GXCOC",,1400,2,2
广西工业职业技术学院,专科（高职）,公办,理工类,广西壮族自治区,广西,南宁市,1958,广西壮族自治区南宁市秀灵路37号,http://www.gxic.net,广西工业学院,,2000,2,2
广西国际商务职业技术学院,专科（高职）,公办,财经类,广西壮族自治区,广西,南宁市,1965,广西壮族自治区南宁市大学东路168号,http://www.gxibvc.net/,广西国商学院,,1800,2,2
广西农业职业技术大学,普通本科,公办,农林类,广西壮族自治区,广西,南宁市,1942,广西壮族自治区南宁市大学东路176号,https://www.gxnzd.edu.cn/,广西农职大,"广西大学行健文理学院,广西农业职业技术学院",3850,2,2
柳州铁道职业技术学院,专科（高职）,公办,理工类,广西壮族自治区,广西,柳州市,1956,广西壮族自治区柳州市鱼峰区官塘大道文苑路2号,http://www.ltzy.edu.cn/,柳铁职院,柳州运输职业技术学院,1000,2,2
广西建设职业技术学院,专科（高职）,公办,理工类,广西壮族自治区,广西,南宁市,1958,广西壮族自治区南宁市西乡塘区罗文大道33号,http://www.gxjsxy.cn,广西建院,,1818,2,2
北海职业学院,专科（高职）,公办,综合类,广西壮族自治区,广西,北海市,1977,广西壮族自治区北海市海城区西藏路,http://www.bhzyxy.net,,,299,2,2
广西经贸职业技术学院,专科（高职）,公办,财经类,广西壮族自治区,广西,南宁市,1963,广西壮族自治区南宁市青秀区青山路14号,https://www.gxjmxy.edu.cn/,广西经贸学院,,172,2,2
广西工商职业技术学院,专科（高职）,公办,财经类,广西壮族自治区,广西,南宁市,1953,"鹏飞校区：广西壮族自治区南宁市鹏飞路15号,中尧校区：广西壮族自治区南宁市鹏飞路15号,武鸣校区：广西壮族自治区南宁市武鸣区红岭大道588号",http://www.gxgsxy.com,,,1500,2,2
广西电力职业技术学院,专科（高职）,公办,理工类,广西壮族自治区,广西,南宁市,1979,"校本部：广西壮族自治区南宁市科园大道39号,五象校区：广西壮族自治区南宁市玉洞大道109号",http://www.gxdlxy.com/,广西电力,,285,2,2
柳州城市职业学院,专科（高职）,公办,综合类,广西壮族自治区,广西,柳州市,1940,广西壮族自治区柳州市鱼峰区官塘大道文苑路1号,http://www.lcvc.edu.cn/,柳城职,,1003,2,2
百色职业学院,专科（高职）,公办,理工类,广西壮族自治区,广西,百色市,2006,广西壮族自治区百色市城东路群来坡巷161号,https://www.gxbszy.cn/,百色职院,,172,2,2
广西英华国际职业学院,专科（高职）,民办,综合类,广西壮族自治区教育厅,广西,钦州市,2005,广西壮族自治区钦州市南珠西大街188号,http://www.tic-gx.com,,,225,2,2
广西城市职业大学,普通本科,民办,综合类,广西壮族自治区教育厅,广西,崇左市,2005,广西壮族自治区南宁市空港经济区同正大道655号,http://www.gxcvuedu.com/,广西城院,广西城市职业学院,3348,2,2
广西工程职业学院,专科（高职）,民办,理工类,广西壮族自治区教育厅,广西,百色市,2006,广西壮族自治区百色市平果县大学城大学路1号,http://www.gxgcedu.com/,,,1770,2,2
北海艺术设计学院,普通本科,民办,艺术类,广西壮族自治区教育厅,广西,北海市,2000,广西壮族自治区北海市新世纪大道1号,http://www.sszss.com,北艺,北海艺术设计职业学院,1363,2,2
桂林山水职业学院,专科（高职）,民办,综合类,广西壮族自治区教育厅,广西,桂林市,2003,广西壮族自治区桂林市临桂新区人民路318号,http://www.glsszyxy.com/,山水职院,,0,2,2
广西演艺职业学院,专科（高职）,民办,艺术类,广西壮族自治区教育厅,广西,南宁市,2004,广西壮族自治区南宁市江南区明阳工业区明阳四路10号,http://www.gxart.cn,广西演职院,,1398,2,2
南宁学院,普通本科,民办,理工类,广西壮族自治区教育厅,广西,南宁市,1985,广西壮族自治区南宁市龙亭路8号,https://www.nnxy.edu.cn/,,邕江大学,1128,2,2
浙江警察学院,普通本科,公办,政法类,浙江省,浙江,杭州市,1949,浙江省杭州市滨江区滨文路555号,http://www.zjjcxy.cn/,"浙警院,浙江警院",,861,2,2
武警海警学院,普通本科,公办,政法类,公安部,浙江,宁波市,1983,浙江省宁波市北仑区小港红联振兴西路205号,,公安海警高等专科学校,公安海警学院,500,2,2
浙江药科职业大学,普通本科,公办,医药类,浙江省,浙江,宁波市,1965,"鄭州校区:浙江省宁波市鄞县大道东段888号,奉化校区:浙江省宁波市奉化区四明路666号",http://www.zjpc.net.cn/,浙药,"浙江海洋大学东海科学技术学院,浙江医药高等专科学校",933,2,2
杭州医学院,普通本科,公办,医药类,浙江省,浙江,杭州市,1925,浙江省杭州市滨江区滨文路481号,http://www.hmc.edu.cn/,杭医,浙江医学高等专科学校,754,2,2
宁波职业技术学院,专科（高职）,公办,综合类,浙江省,浙江,宁波市,1999,浙江省宁波市经济技术开发区庐山东路388号,http://www.nbpt.edu.cn/,宁职院,,0,2,2
温州职业技术学院,专科（高职）,公办,综合类,浙江省,浙江,温州市,1965,浙江省温州市茶山高教园区（温州大学城）,http://www.wzvtc.cn/,温职院,,1300,2,2
浙江交通职业技术学院,专科（高职）,公办,理工类,浙江省,浙江,杭州市,1958,浙江省杭州市莫干山路1515号,http://www.zjvtit.edu.cn/,浙交院,,605,2,2
金华职业技术学院,专科（高职）,公办,综合类,浙江省,浙江,金华市,1994,浙江省金华市海棠西路888号,https://www.jhc.cn/,金职院,,2346,2,2
宁波城市职业技术学院,专科（高职）,公办,综合类,浙江省,浙江,宁波市,1992,浙江省宁波市高教园区学府路9号,http://www.nbcc.cn/,"宁城院,NBCC",,420,2,2
浙江同济科技职业学院,专科（高职）,公办,理工类,浙江省,浙江,杭州市,1962,浙江省杭州市萧山区宁围街道耕文路418号,http://www.zjtongji.edu.cn/,,,1137,2,2
浙江工贸职业技术学院,专科（高职）,公办,综合类,浙江省,浙江,温州市,1960,"府东路校区：浙江省温州市鹿城区府东路717号,瓯江口校区：浙江省温州市瓯江口产业集聚区雁云路301号",http://www.zjitc.net/,"浙工贸,ZJITC",,1090,2,2
浙江艺术职业学院,专科（高职）,公办,艺术类,浙江省,浙江,杭州市,1999,浙江省杭州市滨江区滨文路518号,http://www.zj-art.com/,浙艺,,230,2,2
浙江经济职业技术学院,专科（高职）,公办,财经类,浙江省,浙江,杭州市,1978,浙江省杭州经济技术开发区学正街66号,http://www.zjtie.edu.cn/,"浙经院,ZJTIE",,577,2,2
浙江旅游职业学院,专科（高职）,公办,其他,浙江省,浙江,杭州市,1983,"浙江省杭州市萧山高教园区,浙江省杭州市淳安县文昌镇千岛湖校区",https://www.tourzj.edu.cn/,浙旅职院,,1080,2,2
浙江警官职业学院,专科（高职）,公办,政法类,浙江省,浙江,杭州市,1982,浙江省杭州市下沙高教园区二号大街,http://www.zjjy.com.cn/,,,524,2,2
浙江工业职业技术学院,专科（高职）,公办,综合类,浙江省,浙江,绍兴市,1979,浙江省绍兴市镜湖新区曲屯路151号,http://www.zjipc.com/,浙工院,,912,2,2
杭州职业技术学院,专科（高职）,公办,综合类,浙江省,浙江,杭州市,2002,浙江省杭州市下沙高教园区学源街68号,http://www.hzvtc.edu.cn/,"杭职院,HZVTC",,1000,2,2
嘉兴职业技术学院,专科（高职）,公办,综合类,浙江省,浙江,嘉兴市,1950,浙江省嘉兴市桐乡大道547号,http://www.jxvtc.edu.cn/default.html,嘉职院,,1187,2,2
衢州职业技术学院,专科（高职）,公办,综合类,浙江省,浙江,衢州市,2002,浙江省衢州市柯城区白云街道江源路18号,http://www.qzct.net/,衢职院,,387,2,2
丽水职业技术学院,专科（高职）,公办,综合类,浙江省,浙江,丽水市,1910,浙江省丽水市莲都区中山街北357号,http://www.lszjy.com/,丽职,,505,2,2
义乌工商职业技术学院,专科（高职）,公办,综合类,浙江省,浙江,金华市,1993,浙江省义乌市学院路2号,https://www.ywicc.edu.cn/,义乌工商学院,,1000,2,2
浙江纺织服装职业技术学院,专科（高职）,公办,理工类,浙江省,浙江,宁波市,1979,浙江省宁波市江北区风华路495号,http://www.zjff.edu.cn/,宁波纺织服装职业技术学院,,530,2,2
浙江邮电职业技术学院,专科（高职）,公办,理工类,浙江省,浙江,绍兴市,1958,浙江省绍兴市滨海新城开元东路88号,http://www.zptc.cn/,浙邮院,,500,2,2
宁波卫生职业技术学院,专科（高职）,公办,医药类,浙江省,浙江,宁波市,1925,浙江省宁波市高教园区（南区）学府路51号,http://www.nbchs.net/,宁卫院,宁波天一职业技术学院,359,2,2
台州科技职业学院,专科（高职）,公办,综合类,浙江省,浙江,台州市,1921,浙江省台州市黄岩区嘉木路288号,https://www.tzvcst.edu.cn/,,,525,2,2
浙江国际海运职业技术学院,专科（高职）,公办,综合类,浙江省,浙江,舟山市,2006,浙江省舟山市临城新区海天大道268号,http://www.zimc.cn/,浙海职院,,600,2,2
浙江体育职业技术学院,专科（高职）,公办,体育类,浙江省,浙江,杭州市,2004,浙江省杭州市萧山区萧山高教园区弘慧路,http://www.zjcs.net.cn/,,,707,2,2
浙江树人学院,普通本科,民办,综合类,浙江省教育厅,浙江,杭州市,1984,浙江省杭州市拱墅区树人路8号,http://www.zjsru.edu.cn/,,,1230,2,2
绍兴职业技术学院,专科（高职）,民办,理工类,浙江省教育厅,浙江,绍兴市,1999,浙江省绍兴市越城区山阴路526号,http://www.sxvtc.com/,绍职院,,512,2,2
浙江育英职业技术学院,专科（高职）,民办,财经类,浙江省教育厅,浙江,杭州市,1998,浙江省杭州市经济技术开发区（下沙高教园区）4号大街16号,http://www.zjyyc.com/,育英学院,,0,2,2
浙江广厦建设职业技术大学,普通本科,民办,理工类,浙江省教育厅,浙江,金华市,1985,浙江省东阳市广福东街1号,http://www.guangshaxy.com/,广厦学院,浙江广厦建设职业技术学院,1000,2,2
浙江长征职业技术学院,专科（高职）,民办,综合类,浙江省教育厅,浙江,杭州市,2004,浙江省杭州市西湖区小和山高教园区留和路525号,http://www.zjczxy.cn/,浙江长征学院,,0,2,2
杭州万向职业技术学院,专科（高职）,民办,综合类,浙江省教育厅,浙江,杭州市,1950,"2号校区：浙江省杭州市西湖区花蒋路3号,1号校区：浙江省杭州市西湖区西溪路896号",http://www.wxpoly.cn/,,,262,2,2
嘉兴南洋职业技术学院,专科（高职）,民办,综合类,浙江省教育厅,浙江,嘉兴市,2002,浙江省嘉兴市大德路999号,http://www.jxnyc.net/,,,580,2,2
浙江东方职业技术学院,专科（高职）,民办,综合类,浙江省教育厅,浙江,温州市,1994,浙江省温州市经济技术开发区金海三道433号,http://www.zjdfp.edu.cn/,,,1000,2,2
蚌埠学院,普通本科,公办,理工类,安徽省,安徽,蚌埠市,1978,安徽省蚌埠市曹山路1866号,https://www.bbc.edu.cn/,蚌院,,1128,2,2
池州学院,普通本科,公办,综合类,安徽省,安徽,池州市,1977,安徽省池州市教育园区,http://www.czu.edu.cn/,池院,,2000,2,2
合肥师范学院,普通本科,公办,师范类,安徽省,安徽,合肥市,1955,"三孝口校区：安徽省合肥市金寨路327号,锦绣校区：安徽省合肥市经济技术开发区莲花路1688号",http://www.hfnu.edu.cn,合师院,,1295,2,2
安徽中医药高等专科学校,专科（高职）,公办,医药类,安徽省,安徽,芜湖市,1960,安徽省芜湖市乌霞山西路18号,http://www.ahzyygz.edu.cn/,安徽中医药高专,,413,2,2
马鞍山师范高等专科学校,专科（高职）,公办,师范类,安徽省,安徽,马鞍山市,1958,安徽省马鞍山市雨山区湖西中路85号,https://www.massz.edu.cn/,马鞍山师专,,281,2,2
安庆医药高等专科学校,专科（高职）,公办,医药类,安徽省,安徽,安庆市,1943,安徽省安庆市集贤北路1588号,http://www.aqmc.edu.cn/,安庆医专,,0,2,2
安徽职业技术学院,专科（高职）,公办,综合类,安徽省,安徽,合肥市,1958,安徽省合肥市新站区文忠路2600号,https://www.uta.edu.cn/,"安徽职院,安职院,安徽职业",,2011,2,2
淮北职业技术学院,专科（高职）,公办,综合类,安徽省,安徽,淮北市,1970,安徽省淮北市相阳路146号（东区）,http://www.hbtc.edu.cn/,淮北职院,,1000,2,2
芜湖职业技术学院,专科（高职）,公办,理工类,安徽省,安徽,芜湖市,1983,"南校区：安徽省芜湖市城南高校园区文津西路201号,北校区：安徽省芜湖市银湖北路62号",http://www.whit.edu.cn/,芜湖职院,,2400,2,2
淮南联合大学,专科（高职）,公办,综合类,安徽省,安徽,淮南市,1984,安徽省淮南市田家庵区洞山西路,http://www.hnuu.edu.cn,淮南联大,,803,2,2
安徽商贸职业技术学院,专科（高职）,公办,财经类,安徽省,安徽,芜湖市,1903,安徽省芜湖市弋江区文昌西路24号,http://www.abc.edu.cn/,,,674,2,2
安徽水利水电职业技术学院,专科（高职）,公办,理工类,安徽省,安徽,合肥市,1952,安徽省合肥市东门合马路18号,https://www.ahsdxy.edu.cn/,安徽水院,,1241,2,2
阜阳职业技术学院,专科（高职）,公办,理工类,安徽省,安徽,阜阳市,1956,安徽省阜阳市阜南路465号,http://www.fyvtc.edu.cn/,阜职,阜阳教育学院,1030,2,2
铜陵职业技术学院,专科（高职）,公办,理工类,安徽省,安徽,铜陵市,1958,安徽省铜陵市翠湖四路2689号,http://www.tlpt.edu.cn/,铜陵职院,,1051,2,2
安徽警官职业学院,专科（高职）,公办,政法类,安徽省,安徽,合肥市,2000,"西校区：安徽省合肥市蜀山区清溪路78号,东校区：安徽省合肥市蜀山区清溪路13号",http://www.ahjgxy.edu.cn/,安徽警院,,395,2,2
淮南职业技术学院,专科（高职）,公办,理工类,安徽省,安徽,淮南市,2000,安徽省淮南市洞山林场路1号,http://www.hnvtc.edu.cn/,淮南职院,,1100,2,2
安徽工业经济职业技术学院,专科（高职）,公办,财经类,安徽省,安徽,合肥市,1979,安徽省合肥市梁园路1号,http://www.ahiec.edu.cn/,"工业经济学院,安工院,AHIEC",安徽省工业经济职工大学,531,2,2
合肥通用职业技术学院,专科（高职）,公办,理工类,安徽省,安徽,合肥市,2000,安徽省合肥市长江西路888号,http://www.hftyxy.com/,,,440,2,2
安徽工贸职业技术学院,专科（高职）,公办,理工类,安徽省,安徽,淮南市,1988,安徽省淮南市国庆西路199号,http://www.ahgmedu.cn/,安工贸,,1200,2,2
宿州职业技术学院,专科（高职）,公办,综合类,安徽省,安徽,宿州市,1950,安徽省宿州市宿符路,http://www.szzy.edu.cn/,宿州职业学院,,960,2,2
六安职业技术学院,专科（高职）,公办,理工类,安徽省,安徽,六安市,2001,安徽省六安市正阳路1号,http://www.lvtc.edu.cn/,六安职院,,1500,2,2
安徽电子信息职业技术学院,专科（高职）,公办,理工类,安徽省,安徽,蚌埠市,2001,安徽省蚌埠市大学园区曹山路1000号,http://www.ahdy.edu.cn/,安徽电子学院,,849,2,2
安徽交通职业技术学院,专科（高职）,公办,理工类,安徽省,安徽,合肥市,1956,"（北区）安徽省合肥市太湖东路22号,（南区）安徽省合肥市青年路114号",http://www.acvtc.edu.cn/,"安徽交通学院,安徽交院,安交院",,300,2,2
安徽体育运动职业技术学院,专科（高职）,公办,体育类,安徽省,安徽,合肥市,1954,安徽省合肥市包河区花园大道595号,http://www.ahty.edu.cn/,安徽体院,,700,2,2
合肥职业技术学院,专科（高职）,公办,综合类,安徽省,安徽,合肥市,2002,"合肥汇心湖校区：安徽省合肥市新站区关井路与烈山路交汇处,巢湖鼓山校区：安徽省合肥市巢湖市姥山南路",http://www.htc.edu.cn/,合肥职院,巢湖职业技术学院,1220,2,2
滁州职业技术学院,专科（高职）,公办,综合类,安徽省,安徽,滁州市,2000,龙蟠校区：安徽省滁州市丰乐大道2188号,https://www.chzc.edu.cn/,滁州职院,,743,2,2
池州职业技术学院,专科（高职）,公办,理工类,安徽省,安徽,池州市,2002,安徽省池州市建设西路389号,http://www.czvtc.edu.cn/,池职院,,770,2,2
宣城职业技术学院,专科（高职）,公办,理工类,安徽省,安徽,宣城市,2002,安徽省宣城市薰化路698号,https://www.xcvtc.edu.cn/,宣城职院,,1360,2,2
安徽广播影视职业技术学院,专科（高职）,公办,艺术类,安徽省,安徽,合肥市,1960,安徽省合肥市新站区高教城文忠路与学府路交口,http://www.amtc.edu.cn/,安广院,,619,2,2
安徽电气工程职业技术学院,专科（高职）,公办,理工类,安徽省,安徽,合肥市,2003,安徽省合肥市包河区包河大道56号,http://www.aepu.com.cn/,皖电院,,175,2,2
安徽冶金科技职业学院,专科（高职）,公办,理工类,安徽省,安徽,马鞍山市,1983,安徽省马鞍山市湖西南路555号,https://www.avcmt.edu.cn/,安冶学院,,330,2,2
安徽城市管理职业学院,专科（高职）,公办,综合类,安徽省,安徽,合肥市,1981,"磨店校区：安徽省合肥市新站区淮海大道300号,经开校区：安徽省合肥市经济技术开发区耕云路158号",http://www.cua.edu.cn,安徽城管学院,,563,2,2
安徽机电职业技术学院,专科（高职）,公办,理工类,安徽省,安徽,芜湖市,1935,安徽省芜湖市高校园区文津西路16号,http://www.ahcme.edu.cn,安机电,皖南区芜湖工业学校,1049,2,2
安徽工商职业学院,专科（高职）,公办,财经类,安徽省,安徽,合肥市,1950,"双凤校区：安徽省合肥市双凤经济开发区金宁路北16号,庐阳校区：安徽省合肥市砀山路233号",http://www.ahbvc.edu.cn,,,450,2,2
安徽中澳科技职业学院,专科（高职）,公办,理工类,安徽省,安徽,合肥市,1979,安徽省合肥市濉溪路312号,http://www.acac.edu.cn/,安徽中澳学院,,224,2,2
亳州职业技术学院,专科（高职）,公办,理工类,安徽省,安徽,亳州市,1987,安徽省亳州市药都路1625号,http://www.bzy.edu.cn/,亳职,,481,2,2
安徽国防科技职业学院,专科（高职）,公办,理工类,安徽省,安徽,六安市,1974,安徽省六安市梅山中路56号,https://www.acdt.edu.cn/,安徽国防职院,安徽省国防科技工业学校,330,2,2
安庆职业技术学院,专科（高职）,公办,综合类,安徽省,安徽,安庆市,2003,安徽省安庆市天柱山东路99号,https://www.aqvtc.edu.cn/,安庆职院,,744,2,2
安徽艺术职业学院,专科（高职）,公办,艺术类,安徽省,安徽,合肥市,1956,"宣城路校区：安徽省合肥市宣城路16号,丹霞路校区：安徽省合肥市经济技术开发区丹霞路8号",http://www.artah.cn,安艺,,170,2,2
安徽财贸职业学院,专科（高职）,公办,财经类,安徽省,安徽,合肥市,1964,安徽省合肥市翡翠路900号（轨道交通3号线幸福坝站）,https://www.afc.edu.cn/,AFTVC,,900,2,2
安徽国际商务职业学院,专科（高职）,公办,财经类,安徽省,安徽,合肥市,1980,安徽省合肥市双凤开发区魏武路001号,,安商院,,520,2,2
安徽林业职业技术学院,专科（高职）,公办,农林类,安徽省,安徽,合肥市,1952,安徽省合肥市玉兰大道99号,http://www.ahlyxy.edu.cn/,安徽林业学院,,400,2,2
安徽审计职业学院,专科（高职）,公办,财经类,安徽省,安徽,合肥市,1984,"方兴校区：安徽省合肥市经济技术开发区方兴大道509号,包河校区：安徽省合肥市东流路9号",http://www.ahsjxy.edu.cn/,安审,,353,2,2
安徽新闻出版职业技术学院,专科（高职）,公办,综合类,安徽省,安徽,合肥市,1999,安徽省合肥市经济技术开发区繁华大道220号（明珠广场东1公里）,http://www.ahcbxy.edu.cn/,版院,,173,2,2
安徽邮电职业技术学院,专科（高职）,公办,理工类,安徽省,安徽,合肥市,1948,安徽省合肥市蜀山区潜山路382号,http://www.ahptc.cn/cn,"安邮,AHPTC",,160,2,2
安徽工业职业技术学院,专科（高职）,公办,理工类,安徽省,安徽,铜陵市,1984,安徽省铜陵市长江西路274号,http://www.ahip.cn,安职院,,760,2,2
安徽三联学院,普通本科,民办,理工类,安徽省教育厅,安徽,合肥市,1997,"主校区：安徽省合肥市经济技术开发区合安路47号,亿华校区：安徽省合肥市东华大道100号（护理学院）",https://www.slu.edu.cn/,三联学院,,780,2,2
安徽新华学院,普通本科,民办,综合类,安徽省教育厅,安徽,合肥市,2000,安徽省合肥市高新区望江西路555号,http://www.axhu.edu.cn,新华学院,,1500,2,2
民办万博科技职业学院,专科（高职）,民办,综合类,安徽省教育厅,安徽,合肥市,2000,安徽省合肥市高新技术产业开发区创业西路1号,http://www.wbc.edu.cn,万博学院,万博科技职业学院,800,2,2
合肥共达职业技术学院,专科（高职）,民办,理工类,安徽省教育厅,安徽,合肥市,2007,"九顶山路校区：安徽省合肥市新站高新技术产业开发区九顶山路68号,六安路校区：安徽省合肥市庐阳区六安路269号",http://www.hfgdxy.cn/,共达学院,,500,2,2
安徽绿海商务职业学院,专科（高职）,民办,财经类,安徽省教育厅,安徽,合肥市,2007,安徽省合肥市经济技术开发区合安路68号,http://www.lhub.cn/ ,绿海学院,,360,2,2
民办合肥经济技术职业学院,专科（高职）,民办,综合类,安徽省教育厅,安徽,合肥市,2001,安徽省合肥市环湖东路中段360号,http://www.hfet.com,合经院,合肥经济技术职业学院,189,2,2
民办合肥财经职业学院,专科（高职）,民办,财经类,安徽省教育厅,安徽,合肥市,2006,方兴校区：安徽省合肥市经济技术开发区大学城汤口路中段,http://www.hfcfe.edu.cn/,,合肥财经职业学院,841,2,2
