学校名称,办学层次,学校性质,学校类别,主管部门,所在省份,所在城市,创建时间,学校地址,学校官网,学校简称,曾用名,占地面积（亩）,985工程,211工程
梧州职业学院,专科（高职）,公办,综合类,广西壮族自治区,广西,梧州市,2008,广西壮族自治区梧州市三龙大道88号,http://www.wzzyedu.com,梧职院,,408,2,2
广西理工职业技术学院,专科（高职）,民办,理工类,广西壮族自治区教育厅,广西,崇左市,1978,广西壮族自治区崇左市壶兴路339-1号,http://www.gxlgxy.com,,,1358,2,2
广西经济职业学院,专科（高职）,民办,财经类,广西壮族自治区教育厅,广西,南宁市,2008,广西壮族自治区南宁市东盟经济技术开发区（武鸣区里建）教育路2号,http://www.gxevc.com,广西经职院,,468,2,2
温州科技职业学院,专科（高职）,公办,农林类,浙江省,浙江,温州市,1950,浙江省温州市六虹桥路1000号,http://www.wzvcst.cn/,,,1700,2,2
杭州科技职业技术学院,专科（高职）,公办,综合类,浙江省,浙江,杭州市,1978,浙江省杭州市富阳高科路198号,http://www.hzpt.edu.cn/,杭科院,,900,2,2
浙大城市学院,普通本科,公办,综合类,浙江省,浙江,杭州市,1999,浙江省杭州市湖州街51号,http://www.zucc.edu.cn/,浙大城市学院,浙江大学城市学院,1000,2,2
浙大宁波理工学院,普通本科,公办,理工类,浙江省,浙江,宁波市,2001,浙江省宁波市钱湖南路1号,https://www.nbt.edu.cn/,浙大宁理,浙江大学宁波理工学院,1116,2,2
浙江工业大学之江学院,普通本科,民办,理工类,浙江省教育厅,浙江,绍兴市,1999,浙江省绍兴市柯桥区越州大道958号,http://www.zzjc.edu.cn/,浙工大之江学院,,820,2,2
浙江师范大学行知学院,普通本科,民办,综合类,浙江省教育厅,浙江,金华市,1999,浙江省金华市二环北路3366号,http://www.zjxz.edu.cn/,浙师大行知学院,,800,2,2
宁波大学科学技术学院,普通本科,民办,综合类,浙江省教育厅,浙江,宁波市,1999,浙江省宁波市慈溪市白沙路街道文蔚路521号,http://www.ndky.edu.cn/,宁大科院,,1000,2,2
杭州电子科技大学信息工程学院,普通本科,民办,理工类,浙江省教育厅,浙江,杭州市,1999,浙江省杭州市临安区青山湖街道杭电路1号,http://www.hziee.edu.cn,杭电信工,,500,2,2
浙江理工大学科技与艺术学院,普通本科,民办,理工类,浙江省教育厅,浙江,绍兴市,1999,浙江省绍兴市上虞区滨海新城康阳大道58号,http://www.ky.zstu.edu.cn/,浙理工科艺学院,,550,2,2
浙江农林大学暨阳学院,普通本科,民办,农林类,浙江省教育厅,浙江,绍兴市,2000,浙江省绍兴市诸暨市浦阳路77号,http://www.zjyc.edu.cn/,浙江农林大学天目学院,"浙江农林大学天目学院,浙江林学院天目学院",543,2,2
温州医科大学仁济学院,普通本科,民办,医药类,浙江省教育厅,浙江,温州市,1999,"滨海校区：浙江省温州市洞头区北岙街道海韵大道669号,茶山校区：浙江省温州市茶山高教园区内,学院路校区：浙江省温州市鹿城区学院西路82号",http://rjxy.wmu.edu.cn/,,温州医学院仁济学院,515,2,2
浙江中医药大学滨江学院,普通本科,民办,医药类,浙江省教育厅,浙江,杭州市,2000,"富春校区：浙江省杭州市富阳区百川街260号,滨文校区：浙江省杭州市滨江区滨文路548号",,浙中医滨江学院,,500,2,2
杭州师范大学钱江学院,普通本科,民办,综合类,浙江省教育厅,浙江,杭州市,1999,浙江省杭州市江干区下沙高教园区学林街16号,http://www.huqc.edu.cn/,"杭师大钱江学院,钱江学院",,906,2,2
湖州学院,普通本科,公办,综合类,浙江省,浙江,湖州市,1999,浙江省湖州市学士路1号,https://www.zjhzu.edu.cn/,湖州师院求真,湖州师范学院求真学院,501,2,2
绍兴文理学院元培学院,普通本科,民办,综合类,浙江省教育厅,浙江,绍兴市,2000,浙江省绍兴市群贤中路2799号,http://www.ypc.edu.cn/,文理元培,,1100,2,2
温州理工学院,普通本科,公办,理工类,浙江省,浙江,温州市,2000,浙江省温州市茶山高教园区景观大道1号,https://www.wzut.edu.cn/,"瓯江学院,温州理工",温州大学瓯江学院,902,2,2
浙江工商大学杭州商学院,普通本科,民办,财经类,浙江省教育厅,浙江,杭州市,1999,"桐庐校区：浙江省杭州市桐庐环城南路66号,教工路校区：浙江省杭州市教工路149号",http://www.zjhzcc.edu.cn/,杭州商学院,,542,2,2
中国计量大学现代科技学院,普通本科,民办,理工类,浙江省教育厅,浙江,金华市,1999,"下沙校区：浙江省杭州市下沙高教园区学源街168号,义乌校区：浙江省义乌市大学路8号",https://www.ldxk.edu.cn/,中量大现科,,500,2,2
浙江财经大学东方学院,普通本科,民办,财经类,浙江省教育厅,浙江,嘉兴市,1999,浙江省海宁市连杭经济开发区高新区仰山路2号,http://www.zufedfc.edu.cn/,,浙江财经学院东方学院,938,2,2
嘉兴南湖学院,普通本科,公办,财经类,浙江省,浙江,嘉兴市,2003,浙江省嘉兴市南湖区越秀南路572号,https://www.jxnhu.edu.cn/,嘉兴学院南湖,嘉兴学院南湖学院,900,2,2
温州商学院,普通本科,民办,财经类,浙江省教育厅,浙江,温州市,1999,浙江省温州市茶山高教园区,http://www.wzbc.edu.cn/,温商院,温州大学城市学院,0,2,2
同济大学浙江学院,普通本科,民办,综合类,浙江省教育厅,浙江,嘉兴市,2008,浙江省嘉兴市商务大道168号,https://www.tjzj.edu.cn/cn/index/index.html,同济浙院,,830,2,2
上海财经大学浙江学院,普通本科,民办,财经类,浙江省教育厅,浙江,金华市,2008,浙江省金华市环城南路99号,http://www.shufe-zj.edu.cn/,上财浙院,,1005,2,2
宁波财经学院,普通本科,民办,财经类,浙江省教育厅,浙江,宁波市,2001,浙江省宁波市鄞州区学院路899号,http://www.nbdhyu.edu.cn/,宁财院,宁波大红鹰学院,1700,2,2
浙江越秀外国语学院,普通本科,民办,语言类,浙江省教育厅,浙江,绍兴市,1981,"稽山校区：浙江省绍兴市越城区会稽路428号,镜湖校区：浙江省绍兴市越城区群贤中路2801号",http://www.zyufl.edu.cn/,,,1300,2,2
浙江汽车职业技术学院,专科（高职）,民办,理工类,浙江省教育厅,浙江,台州市,1997,浙江省临海市城东曹家路,http://www.geely.edu.cn/,浙汽职院,,0,2,2
徽商职业学院,专科（高职）,公办,理工类,安徽省,安徽,合肥市,1965,"槽郢校区：安徽省合肥市槽郢路15号,紫蓬校区：安徽省合肥紫蓬山风景区",https://www.hsxy.edu.cn/,,安徽省物资学校,232,2,2
安徽大学江淮学院,普通本科,民办,综合类,安徽省教育厅,安徽,合肥市,2003,"史河路校区：安徽省合肥市史河路8号,泗州路校区：安徽省合肥市泗州路40号",http://jhxy.ahu.edu.cn/,江淮学院,,770,2,2
安徽师范大学皖江学院,普通本科,民办,师范类,安徽省教育厅,安徽,芜湖市,2005,安徽省芜湖市九华北路171号,http://wjcollege.ahnu.edu.cn/,皖江学院,,3300,2,2
合肥经济学院,普通本科,民办,财经类,安徽省教育厅,安徽,合肥市,2003,"高教基地校区：安徽省合肥市新站区学府路1号,大学城校区：安徽省合肥市经济技术开发区合安路218号",http://www.hfue.edu.cn/,"安徽农业大学经济技术学院,合肥经济",安徽农业大学经济技术学院,1200,2,2
安徽医科大学临床医学院,普通本科,民办,医药类,安徽省教育厅,安徽,合肥市,2003,安徽省合肥市蜀山区望江西路1166号,http://cc.ahmu.edu.cn/,安医大临床医学院,,1379,2,2
马鞍山学院,普通本科,民办,理工类,安徽省教育厅,安徽,马鞍山市,2003,安徽省马鞍山市当涂县姑孰镇黄池路8号,https://www.masu.edu.cn/,安工大工商,安徽工业大学工商学院,1016,2,2
蚌埠工商学院,普通本科,民办,财经类,安徽省教育厅,安徽,蚌埠市,2003,安徽省蚌埠市东海大道7100号,https://www.bctb.edu.cn/,,安徽财经大学商学院,1000,2,2
淮北理工学院,普通本科,民办,理工类,安徽省教育厅,安徽,淮北市,2003,安徽省淮北市杜集区高岳街道青年路8号,http://www.hblgxy.edu.cn/,淮师大信院,"淮北煤炭师范学院信息学院,淮北师范大学信息学院",1004,2,2
合肥城市学院,普通本科,民办,理工类,安徽省教育厅,安徽,合肥市,2003,安徽省合肥市黄麓科教园书香路1号,https://www.cuhf.edu.cn/,"安徽建筑大学城市建设学院,合肥城院,合肥城市","安徽建筑工业学院城市建设学院,安徽建筑大学城市建设学院",1000,2,2
安徽信息工程学院,普通本科,民办,理工类,安徽省教育厅,安徽,芜湖市,2003,"新芜校区：安徽省芜湖市新芜经济开发区永和路1号,文津校区：安徽省芜湖市文津西路8号",http://www.aiit.edu.cn,,安徽工程大学机电学院,1200,2,2
阜阳师范大学信息工程学院,普通本科,民办,综合类,安徽省教育厅,安徽,阜阳市,2003,安徽省阜阳市清河东路741号,http://cie.fynu.edu.cn/,,,555,2,2
皖江工学院,普通本科,民办,理工类,安徽省教育厅,安徽,马鞍山市,2008,"霍里山校区：安徽省马鞍山市霍里山大道333号,郑蒲港校区：安徽省马鞍山市郑蒲港新区河海中路666号",https://www.wjut.edu.cn/,,河海大学文天学院,1421,2,2
安徽矿业职业技术学院,专科（高职）,民办,理工类,安徽省教育厅,安徽,淮北市,1978,安徽省淮北市相山区鹰山中路22号,http://www.ahkyzy.edu.cn/,安徽矿院,,800,2,2
民办安徽旅游职业学院,专科（高职）,民办,其他,安徽省教育厅,安徽,阜阳市,2007,安徽省阜阳市颍上县城南新区南纬三路南侧,,安徽旅游学院,,500,2,2
合肥信息技术职业学院,专科（高职）,民办,理工类,安徽省教育厅,安徽,合肥市,2009,安徽省合肥市大学城九龙路115号（安徽大学新校区西门南500米）,http://www.hfitu.cn/,"合信院,HFITU",,852,2,2
民办合肥滨湖职业技术学院,专科（高职）,民办,理工类,安徽省教育厅,安徽,合肥市,2002,安徽省合肥市经济技术开发区方兴大道559号,http://www.hfbhxy.com,"合肥滨湖学院,滨湖学院",合肥滨湖职业技术学院,562,2,2
安徽现代信息工程职业学院,专科（高职）,民办,理工类,安徽省教育厅,安徽,淮南市,2008,安徽省淮南市寿县通淝路,http://www.ahmodern.cn,,,528,2,2
厦门工学院,普通本科,民办,理工类,福建省教育厅,福建,厦门市,2009,福建省厦门市集美区孙坂南路1251号,https://www.xit.edu.cn/,,华侨大学厦门工学院,1304,2,2
泉州轻工职业学院,专科（高职）,民办,综合类,福建省教育厅,福建,泉州市,2009,福建省泉州市晋江博览大道,http://www.qzqgxy.com,泉州轻工学院,,600,2,2
厦门安防科技职业学院,专科（高职）,民办,综合类,福建省教育厅,福建,厦门市,2004,福建省厦门市翔安区翔安南路3000号,http://www.xmafkj.com/,安防学院,,580,2,2
江西冶金职业技术学院,专科（高职）,公办,理工类,江西省,江西,新余市,1975,江西省新余市仙女湖名胜区,http://www.jxyjxy.com,江西冶金职院,,900,2,2
江西传媒职业学院,专科（高职）,公办,艺术类,江西省,江西,南昌市,1985,江西省南昌市蒋巷西大道266号,http://www.jxmvc.cn,江传,"江西新闻出版职业技术学院,江西传媒职业学院",400,2,2
南昌大学科学技术学院,普通本科,民办,综合类,江西省教育厅,江西,九江市,2001,"南昌校区：江西省南昌市北京东路339号 ,共青校区：江西省九江共青城市五四大道199号",http://www.ndkj.com.cn/,昌大科院,,1215,2,2
江西农业大学南昌商学院,普通本科,民办,综合类,江西省教育厅,江西,九江市,2001,江西省共青城市南湖新城青年大道79号,http://ncsxy.jxau.edu.cn/,,,700,2,2
江西师范大学科学技术学院,普通本科,民办,综合类,江西省教育厅,江西,九江市,2001,江西省共青城市青年大道78号,http://kjxy.jxnu.edu.cn/,,,800,2,2
南昌交通学院,普通本科,民办,理工类,江西省教育厅,江西,南昌市,2001,江西省南昌经济技术开发区黄家湖东路111号,https://www.ecjtuit.edu.cn/,"ECJTUIT,交大理工,南昌交通",华东交通大学理工学院,2800,2,2
赣南科技学院,普通本科,公办,理工类,江西省,江西,赣州市,2001,江西省赣州市章贡区客家大道156号,http://www.gnust.edu.cn,,江西理工大学应用科学学院,808,2,2
赣东学院,普通本科,公办,综合类,江西省,江西,抚州市,2002,江西省抚州市学府路56号,http://www.ecutcj.edu.cn,东华理工大学长江,东华理工大学长江学院,900,2,2
南昌航空大学科技学院,普通本科,民办,理工类,江西省教育厅,江西,九江市,2001,江西省南昌市赣江新区共青城市青年大道69号,http://kjxy.nchu.edu.cn/,昌航科院,,1000,2,2
南昌医学院,普通本科,公办,医药类,江西省,江西,南昌市,2001,"小蓝校区：江西省南昌市小蓝经济开发区汇仁大道689号,湾里校区：江西省南昌湾里梅岭大道1689号",http://www.ncmc.edu.cn/,"江中科院,江西中医科院","江西中医学院科技学院,江西中医药大学科技学院",906,2,2
江西财经大学现代经济管理学院,普通本科,民办,财经类,江西省教育厅,江西,九江市,2001,江西省共青城市青年大道59号,http://xjg.jxufe.edu.cn/,江财现经管,,700,2,2
赣南师范大学科技学院,普通本科,民办,师范类,江西省教育厅,江西,赣州市,2003,江西省赣州市章贡区红旗大道61号,http://www.gnnustc.com/,赣师大科院,赣南师范学院科技学院,400,2,2
景德镇艺术职业大学,普通本科,民办,艺术类,江西省教育厅,江西,景德镇市,2001,江西省景德镇市珠山区和谐大道向东至福佑路与红塔路相交处,http://www.jdzvua.edu.cn/,陶大科院,"景德镇陶瓷学院科技艺术学院,景德镇陶瓷大学科技艺术学院",1400,2,2
南昌应用技术师范学院,普通本科,民办,师范类,江西省教育厅,江西,南昌市,2001,江西省南昌市红谷滩新区明月山大道1599号,http://www.nncat.edu.cn/,"科师理工,南昌应用技术师范","江西科技师范学院理工学院,江西科技师范大学理工学院",592,2,2
南昌大学共青学院,普通本科,民办,综合类,江西省教育厅,江西,九江市,1985,江西省共青城市南湖大道465号,http://www.ndgy.cn/,南大共院,,1041,2,2
江西泰豪动漫职业学院,专科（高职）,民办,综合类,江西省教育厅,江西,南昌市,2008,江西省南昌市小蓝经开区汇仁大道1333号,http://www.thdm.edu.cn,泰豪动漫学院,,2200,2,2
江西新能源科技职业学院,专科（高职）,民办,综合类,江西省教育厅,江西,新余市,1995,江西省新余市高新技术产业园区渝东大道818号,http://www.tynxy.com/,,江西太阳能科技职业学院,800,2,2
江西枫林涉外经贸职业学院,专科（高职）,民办,财经类,江西省教育厅,江西,九江市,2003,江西省九江市云山经济技术开发区,http://www.jxfte.com/,"江西枫林学院,JFPCFET",,0,2,2
河南建筑职业技术学院,专科（高职）,公办,理工类,河南省,河南,郑州市,1956,河南省郑州市二七区工业路51号,http://www.hnjs.edu.cn,,,600,2,2
安阳职业技术学院,专科（高职）,公办,综合类,河南省,河南,安阳市,2009,河南省安阳市文峰区平原路461号,http://www.ayzy.cn/,安职,,1100,2,2
新乡职业技术学院,专科（高职）,公办,综合类,河南省,河南,新乡市,1883,河南省新乡市新乡经济技术开发区经三路6号,http://www.xxvtc.edu.cn/,新乡职院,,2450,2,2
驻马店职业技术学院,专科（高职）,公办,理工类,河南省,河南,驻马店市,2009,河南省驻马店市淮河大道西段,http://www.zmdvtc.cn/,,,600,2,2
安阳学院,普通本科,民办,综合类,河南省教育厅,河南,安阳市,2003,河南省安阳市中华路南段599号,http://www.ayrwedu.cn/,,安阳师范学院人文管理学院,2000,2,2
新乡工程学院,普通本科,民办,理工类,河南省教育厅,河南,新乡市,2003,河南省新乡市高新区新飞大道南段777号,http://www.xxgc.edu.cn,新科学院,河南科技学院新科学院,1500,2,2
郑州商学院,普通本科,民办,财经类,河南省教育厅,河南,郑州市,2004,河南省郑州市巩义市紫荆路136号,http://www.zbu.edu.cn/,,"河南财经学院成功学院,郑州成功财经学院",2300,2,2
郑州科技学院,普通本科,民办,理工类,河南省教育厅,河南,郑州市,1988,河南省郑州市二七区马寨工业园学院路1号,http://www.zit.edu.cn/,郑科院,,900,2,2
漯河食品职业学院,专科（高职）,民办,综合类,河南省教育厅,河南,漯河市,1997,河南省漯河市107国道和文明路交叉口,http://www.lsgx.com.cn/index.html,,,1000,2,2
郑州城市职业学院,专科（高职）,民办,综合类,河南省教育厅,河南,郑州市,2009,河南省郑州市新密市溱水路618号,http://www.zcu.edu.cn/,,,454,2,2
河南科技职业大学,普通本科,民办,理工类,河南省教育厅,河南,周口市,1981,河南省周口市川汇区文昌大道东段6号,https://www.havust.edu.cn/,河科职大,周口科技职业学院,1200,2,2
湖北工程职业学院,专科（高职）,公办,理工类,湖北省,湖北,黄石市,1964,湖北省黄石市团城山广州路9号,http://www.hbei.edu.cn/,,黄石职业技术学院,970,2,2
三峡旅游职业技术学院,专科（高职）,公办,综合类,湖北省,湖北,宜昌市,1976,湖北省宜昌市夷陵区汉宜大道205号（宜昌市职教园）,http://www.sxlyzy.com.cn,三旅,,810,2,2
武汉城市职业学院,专科（高职）,公办,综合类,湖北省,湖北,武汉市,1904,湖北省武汉市洪山区南李路127号,https://www.whcp.edu.cn/,武城院,,1100,2,2
武汉文理学院,普通本科,民办,综合类,湖北省教育厅,湖北,武汉市,2002,湖北省武汉市黄陂区武湖街胜海大道特一号,https://www.whwl.edu.cn/,武文理,江汉大学文理学院,964,2,2
湖北工程学院新技术学院,普通本科,民办,综合类,湖北省教育厅,湖北,孝感市,2003,湖北省孝感市学院路158号,http://www.hbeutc.cn/,湖工新院,孝感学院新技术学院,400,2,2
湖北恩施学院,普通本科,民办,综合类,湖北省教育厅,湖北,恩施土家族苗族自治州,2003,湖北省恩施市龙洞河路,https://www.hbesxy.edu.cn,湖北民族科技,"湖北民族学院科技学院,湖北民族大学科技学院",1240,2,2
武汉传媒学院,普通本科,民办,艺术类,湖北省教育厅,湖北,武汉市,2004,湖北省武汉市江夏区光谷大道122号,http://www.whmc.edu.cn,武传,华中师范大学武汉传媒学院,1051,2,2
湖南第一师范学院,普通本科,公办,师范类,湖南省,湖南,长沙市,1903,"城南书院校区：湖南省长沙市天心区书院路356号,东方红校区：湖南省长沙市岳麓区枫林三路1015号",http://www.hnfnu.edu.cn/,湖南第一师范学校,,1346,2,2
湖南生物机电职业技术学院,专科（高职）,公办,农林类,湖南省,湖南,长沙市,1903,湖南省长沙市芙蓉区隆平高科技园,https://www.hnbemc.edu.cn/,生物机电,,2470,2,2
湖南国防工业职业技术学院,专科（高职）,公办,理工类,湖南省,湖南,湘潭市,1962,湖南省湘潭市雨湖区楠竹山学院路1号,http://www.hngfxy.com/,,湖南科技工业职业技术学院,430,2,2
湖南师范大学树达学院,普通本科,民办,师范类,湖南省教育厅,湖南,长沙市,2001,湖南省长沙市岳麓区麓山南路桃花坪1号,http://sdw.hunnu.edu.cn/,树达学院,,210,2,2
湘潭理工学院,普通本科,民办,理工类,湖南省教育厅,湖南,湘潭市,2001,湖南省湘潭市雨湖区船行山路3号,http://xtit.edu.cn/,,"湖南商学院北津学院,湖南工商大学北津学院",1200,2,2
湖南农业大学东方科技学院,普通本科,民办,综合类,湖南省教育厅,湖南,长沙市,2002,湖南省长沙市芙蓉区人民东路,http://www.hnaues.com/,东方科技学院,,528,2,2
长沙理工大学城南学院,普通本科,民办,理工类,湖南省教育厅,湖南,长沙市,2003,湖南省长沙市天心区赤岭路45号,https://www.csust.edu.cn/cnxy/,城南学院,,1000,2,2
湖南科技大学潇湘学院,普通本科,民办,综合类,湖南省教育厅,湖南,湘潭市,2001,湖南省湘潭市雨湖区桃园路,http://xxxy.hnust.edu.cn/,潇湘学院,,688,2,2
湖南工业大学科技学院,普通本科,民办,综合类,湖南省教育厅,湖南,株洲市,2001,湖南省株洲市荷塘区文化路23号,http://kjxy.hut.edu.cn/,,,3854,2,2
湘潭大学兴湘学院,普通本科,民办,综合类,湖南省教育厅,湖南,湘潭市,2001,湖南省湘潭市雨湖区北二环路湘潭大学兴湘学院,https://xxxy.xtu.edu.cn/,兴湘学院,,3200,2,2
南华大学船山学院,普通本科,民办,综合类,湖南省教育厅,湖南,衡阳市,2001,"红湘校区：湖南省衡阳市常胜西路28号,雨母校区：湖南省衡阳市衡祁路228号",http://csxy.usc.edu.cn,南华船山,,1000,2,2
湖南文理学院芙蓉学院,普通本科,民办,综合类,湖南省教育厅,湖南,常德市,2002,湖南省常德市青年东路,http://fur.huas.edu.cn,芙蓉学院,,456,2,2
湖南理工学院南湖学院,普通本科,民办,理工类,湖南省教育厅,湖南,岳阳市,2003,湖南省岳阳市学院路439号,https://nh.hnist.cn/,,,506,2,2
吉首大学张家界学院,普通本科,民办,综合类,湖南省教育厅,湖南,张家界市,2002,湖南省张家界市永定区热水坑1号,https://zjj.jsu.edu.cn/,"吉大张院,张家界学院,张家界学院",,738,2,2
湖南工程学院应用技术学院,普通本科,民办,理工类,湖南省教育厅,湖南,湘潭市,2002,湖南省湘潭市书院路17号,http://hnieyy.hnie.edu.cn/,,,200,2,2
湖南中医药大学湘杏学院,普通本科,民办,医药类,湖南省教育厅,湖南,岳阳市,2002,湖南省岳阳市湘阴县金龙镇芙蓉北路湘阴段66号,http://xxxy.hnucm.edu.cn/,湘杏学院,,1393,2,2
衡阳师范学院南岳学院,普通本科,民办,师范类,湖南省教育厅,湖南,衡阳市,2002,湖南省衡阳市雁峰区黄白路165号,http://nyxy.hynu.cn/,衡阳师院南岳学院,,500,2,2
仲恺农业工程学院,普通本科,公办,农林类,广东省,广东,广州市,1927,"海珠校区：广东省广州市海珠区仲恺路501号,白云校区：广东省广州市白云区广新路388号",https://www.zhku.edu.cn/,仲恺农业技术学院,,1765,2,2
广州番禺职业技术学院,专科（高职）,公办,综合类,广东省,广东,广州市,1995,广东省广州市番禺区市良路1342号,http://www.gzpyp.edu.cn/,番职院,"番禺理工学院,番禺职业技术学院",2067,2,2
电子科技大学中山学院,普通本科,民办,理工类,广东省教育厅,广东,中山市,1986,广东省中山市石岐区学院路一号,http://www.zsc.edu.cn/,中山学院,,700,2,2
东莞城市学院,普通本科,民办,理工类,广东省教育厅,广东,东莞市,2004,广东省东莞市寮步镇文昌路1号,https://csxy.dgut.edu.cn/,,东莞理工学院城市学院,1228,2,2
湛江科技学院,普通本科,民办,综合类,广东省教育厅,广东,湛江市,1999,广东省湛江市麻章区学智路二号,https://www.zjkju.edu.cn/,"海大寸金,广海寸金,湛江科院",广东海洋大学寸金学院,1990,2,2
新疆职业大学,专科（高职）,公办,综合类,新疆维吾尔自治区,新疆,乌鲁木齐市,1962,新疆维吾尔自治区乌鲁木齐市北京北路1075号,https://www.xjvu.edu.cn/,新职大,,180,2,2
新疆理工学院,普通本科,公办,理工类,新疆维吾尔自治区,新疆,阿克苏地区,2015,新疆维吾尔自治区阿克苏市学府西路1号,http://www.xjistedu.cn/,新大科院,新疆大学科学技术学院,3000,2,2
新疆科技学院,普通本科,公办,财经类,新疆维吾尔自治区,新疆,巴音郭楞蒙古自治州,2004,新疆维吾尔自治区巴音郭楞蒙古自治州库尔勒市金河路360号,http://www.xjust.edu.cn/,,新疆财经大学商务学院,3070,2,2
新疆第二医学院,普通本科,公办,医药类,新疆维吾尔自治区,新疆,克拉玛依市,2003,新疆维吾尔自治区克拉玛依市胜利路12号,https://www.xjsmc.edu.cn/,,新疆医科大学厚博学院,1100,2,2
成都大学,普通本科,公办,综合类,四川省,四川,成都市,1978,四川省成都市成洛大道2025号,http://www.cdu.edu.cn,CDU,成都学院,2300,2,2
四川幼儿师范高等专科学校,专科（高职）,公办,师范类,四川省,四川,绵阳市,1917,"东校区：四川省江油市东山路北段100号,西校区：四川省江油市诗城路西段125号,绵阳校区：四川省绵阳市涪城区教育园区教育西路16号",http://www.scyesz.edu.cn/2018/,"四川幼专,川幼,四川幼儿师专",,970,2,2
成都理工大学工程技术学院,普通本科,民办,理工类,四川省教育厅,四川,乐山市,2000,四川省乐山市中区肖坝路222号,https://www.cdutetc.cn/,,,1100,2,2
四川传媒学院,普通本科,民办,综合类,四川省教育厅,四川,成都市,1997,四川省成都市高新西区团结学院路67号,http://www.scmc.edu.cn/,"川传,四川传媒大学",成都理工大学广播影视学院,2398,2,2
成都银杏酒店管理学院,普通本科,民办,财经类,四川省教育厅,四川,成都市,2002,四川省成都市郫都区红光广场路北二段60号,http://www.gingkoc.edu.cn/,银杏学院,"成都信息工程学院银杏酒店管理学院,成都信息工程大学银杏酒店管理学院",1000,2,2
