学校名称,办学层次,学校性质,学校类别,主管部门,所在省份,所在城市,创建时间,学校地址,学校官网,学校简称,曾用名,占地面积（亩）,985工程,211工程
南通大学,普通本科,公办,综合类,江苏省,江苏,南通市,1912,"江苏省南通市崇川区啬园路9号,江苏省南通市崇川区启秀路19号",http://www.ntu.edu.cn,通大,,3700,2,2
四川托普信息技术职业学院,专科（高职）,民办,理工类,四川省教育厅,四川,成都市,2000,四川省成都市高新区西区大道2000号,http://www.scetop.com/,四川托普职院,,606,2,2
四川职业技术学院,专科（高职）,公办,综合类,四川省,四川,遂宁市,1911,四川省遂宁市学府北路1号,http://www.scvtc.edu.cn/,"四川职业技术学校,川职院,四川职业学院",,1049,2,2
雅安职业技术学院,专科（高职）,公办,综合类,四川省,四川,雅安市,1951,四川省雅安经济开发区学道街659号,http://www.yazjy.com,雅职院,,830,2,2
达州职业技术学院,专科（高职）,公办,综合类,四川省,四川,达州市,1940,"徐家坝校区:四川省达州市通川区徐家坝路448号,韩家坝校区:四川省达州市通川区韩家坝犀牛大道书山路1号",http://www.dzvtc.edu.cn/,"达州职院,达职院",,1020,2,2
广安职业技术学院,专科（高职）,公办,综合类,四川省,四川,广安市,1906,四川省广安市广安区滨江东路98号,,广安职院,,1700,2,2
四川建筑职业技术学院,专科（高职）,公办,理工类,四川省,四川,德阳市,1956,"德阳校区：四川省德阳市嘉陵江西路4号,成都校区：四川省成都市青白江大道899号",https://www.scac.edu.cn/,"四川建院,德阳建院",,2129,2,2
南充职业技术学院,专科（高职）,公办,综合类,四川省,四川,南充市,1904,四川省南充市高坪区小龙宏发路94号,http://www.nczy.edu.cn/,南充职院,,1403,2,2
四川工程职业技术学院,专科（高职）,公办,理工类,四川省,四川,德阳市,1959,四川省德阳市泰山南路二段801号,https://www.scetc.edu.cn/,四川工程职院,西南重型机电学院,1257,2,2
四川航天职业技术学院,专科（高职）,公办,理工类,四川省,四川,成都市,1965,"四川省成都市龙泉驿区天生路155号,三星堆校区:四川省德阳市广汉市新平镇航天大道155号",http://www.scavc.com/,四川航天职院,,700,2,2
四川化工职业技术学院,专科（高职）,公办,理工类,四川省,四川,泸州市,1953,四川省泸州市纳溪区护国大道733号,http://www.sccc.edu.cn/,四川化工职院,,1198,2,2
四川文理学院,普通本科,公办,综合类,四川省,四川,达州市,1976,"莲湖校区:四川省达州市通川区塔石路中段519号,南坝校区:四川省达州市达川区南滨路三段406号",http://www.sasu.edu.cn/,四川文理,,1075,2,2
四川机电职业技术学院,专科（高职）,公办,理工类,四川省,四川,攀枝花市,1973,四川省攀枝花市东区马家田路65号,http://www.scemi.com/,四川机电职院,,800,2,2
四川交通职业技术学院,专科（高职）,公办,理工类,四川省,四川,成都市,1952,四川省成都市温江区柳台大道东段208号,http://www.svtcc.edu.cn/,四川交院,,1033,2,2
四川工业科技学院,普通本科,民办,综合类,四川省教育厅,四川,德阳市,1995,"罗江校区:四川省德阳市罗江大学路59号,绵竹校区:四川省德阳市绵竹新市经济开发区",http://www.scit.edu.cn/,四川工科院,"四川工业管理职业学院,四川警安职业学院",2245,2,2
四川水利职业技术学院,专科（高职）,公办,理工类,四川省,四川,成都市,1956,"崇州主校区：四川省成都市崇州市永和大道366号,都江堰老校区：四川省成都市都江堰市水校路88号",http://www.swcvc.edu.cn/,"川水职院,川水院",,900,2,2
四川司法警官职业学院,专科（高职）,公办,政法类,四川省,四川,德阳市,1982,四川省德阳市凯江路二段32号,http://www.sjpopc.edu.cn/,德阳警院,,375,2,2
四川信息职业技术学院,专科（高职）,公办,理工类,四川省,四川,广元市,1976,"雪峰校区：四川省广元市利州区学府路265号,东坝校区：四川省广元市利州区奔月路307号",http://www.scitc.com.cn/,川信职院,,520,2,2
四川邮电职业技术学院,专科（高职）,公办,理工类,四川省,四川,成都市,1956,四川省成都市锦江区静康路536号,http://www.sptpc.com,四川邮电职院,,0,2,2
襄阳职业技术学院,专科（高职）,公办,综合类,湖北省,湖北,襄阳市,1905,湖北省襄阳市襄城区隆中路18号,http://www.hbxytc.com/,襄樊职业技术学院,襄樊职业技术学院,1200,2,2
鄂州职业大学,专科（高职）,公办,综合类,湖北省,湖北,鄂州市,1984,湖北省鄂州市凤凰路78号,http://www.ezu.cn,鄂州大学,,1598,2,2
湖北职业技术学院,专科（高职）,公办,综合类,湖北省,湖北,孝感市,1951,湖北省孝感市玉泉路17号,http://www.hbvtc.edu.cn/,湖北职院,,1574,2,2
湖北中医药高等专科学校,专科（高职）,公办,医药类,湖北省,湖北,荆州市,2002,湖北省荆州市学苑路87号,http://www.hbzyy.org,湖北中医药高专,,735,2,2
黄冈职业技术学院,专科（高职）,公办,理工类,湖北省,湖北,黄冈市,1999,湖北省黄冈市黄州区南湖桃园街109号,http://www.hgpu.edu.cn,黄冈职院,,1200,2,2
武汉商学院,普通本科,公办,财经类,湖北省,湖北,武汉市,1963,湖北省武汉市武汉经济技术开发区东风大道816号,http://www.wbu.edu.cn,武商院,武汉商业服务学院,1320,2,2
武汉职业技术学院,专科（高职）,公办,综合类,湖北省,湖北,武汉市,1972,"关山校区：湖北省武汉市洪山区关山大道463号,光谷东校区：湖北省鄂州市葛店经济开发区创业大道25号",https://www.wtc.edu.cn/,"武职,武汉职业技术学校",,1580,2,2
汉江师范学院,普通本科,公办,师范类,湖北省,湖北,十堰市,1904,湖北省十堰市茅箭区北京南路18号,http://www.hjnu.edu.cn/,汉师,郧阳师范高等专科学校,1094,2,2
北京电子科技职业学院,专科（高职）,公办,理工类,北京市,北京,北京市,1958,北京市大兴区凉水河一街9号,https://www.bpi.edu.cn/,,,807,2,2
首都师范大学科德学院,普通本科,民办,艺术类,北京市教委,北京,北京市,2004,北京市大兴区榆垡镇榆祥路10号,http://www.kdcnu.com,"首师大科德学院,科德学院",,500,2,2
北京培黎职业学院,专科（高职）,民办,财经类,北京市教委,北京,北京市,1983,北京市海淀区双清路1号,http://www.bjpldx.edu.cn,培黎学院,北京培黎职业大学,736,2,2
北京科技职业学院,专科（高职）,民办,综合类,北京市教委,北京,北京市,1997,北京市昌平区沙河沙阳路18号,http://www.5aaa.com/,北科院,,2875,2,2
吉利学院,普通本科,民办,理工类,四川省教育厅,四川,成都市,1999,四川省成都市东部新区成简大道二段123号,http://cd.guc.edu.cn/,"吉利学院,吉利大学","北京吉利大学,北京吉利学院",2000,2,2
北京汇佳职业学院,专科（高职）,民办,综合类,北京市教委,北京,北京市,1984,北京市昌平区创新路20号,http://www.hju.net.cn,"汇佳,汇佳职业学院",,367,2,2
北京经贸职业学院,专科（高职）,民办,财经类,北京市教委,北京,北京市,1982,北京市房山区良乡长虹东路高教园区,http://www.csuedu.com,北经职贸,,158,2,2
北京科技经营管理学院,专科（高职）,民办,财经类,北京市教委,北京,北京市,1985,北京市昌平区沙河镇顺沙路6号院,http://www.jgy1985.cn/,北科经管,,120,2,2
中国地质大学（北京）,普通本科,公办,理工类,教育部,北京,北京市,1952,北京市海淀区学院路29号,https://www.cugb.edu.cn/,"北京中国地质大学,中国地质大学北京,CUGB",,789,2,1
华北电力大学,普通本科,公办,理工类,教育部,北京,北京市,1958,北京市昌平区回龙观北农路2号,http://www.ncepu.edu.cn,"华北电力,华电,NCEPU",华北电力大学(北京),1600,2,1
中国石油大学（北京）,普通本科,公办,理工类,教育部,北京,北京市,1953,北京市昌平区府学路18号,http://www.cup.edu.cn/,"中国石油大学北京,北京中国石油大学,石油大学北京,北京石油大学",,700,2,1
河南师范大学,普通本科,公办,师范类,河南省,河南,新乡市,1923,河南省新乡市建设东路46号,https://www.htu.edu.cn/,河南师大,,2093,2,2
安阳工学院,普通本科,公办,理工类,河南省,河南,安阳市,1983,河南省安阳市黄河大道西段,http://www.ayit.edu.cn,安工,,1580,2,2
天津医学高等专科学校,专科（高职）,公办,医药类,天津市,天津,天津市,1908,天津市河西区柳林路14号,http://www.tjyzh.cn/,天津医专,,600,2,2
天津电子信息职业技术学院,专科（高职）,公办,理工类,天津市,天津,天津市,1953,天津市海河教育园区雅深路4号,http://www.tjdz.net/,,,747,2,2
天津滨海职业学院,专科（高职）,公办,综合类,天津市,天津,天津市,1958,天津市滨海新区塘沽庐山道1101号,http://www.tjbpi.com/,天津滨海职院,,1000,2,2
天津渤海职业技术学院,专科（高职）,公办,综合类,天津市,天津,天津市,1958,天津市北辰区津榆公路508号,https://www.tjbhzy.com/,,,671,2,2
天津轻工职业技术学院,专科（高职）,公办,理工类,天津市,天津,天津市,2001,天津市海河教育园区雅观路1号,http://www.tjlivtc.edu.cn/,天津轻工学院,,866,2,2
天津公安警官职业学院,专科（高职）,公办,政法类,天津市,天津,天津市,1949,天津市西青区精武镇,,天津警院,,739,2,2
天津机电职业技术学院,专科（高职）,公办,理工类,天津市,天津,天津市,1958,天津市海河教育园区雅观路19号,https://www.suoyuan.com.cn/,天机职院,,593,2,2
天津现代职业技术学院,专科（高职）,公办,综合类,天津市,天津,天津市,2001,天津市海河教育园区雅观路3号,https://www.xdxy.com.cn/,天津现代,,800,2,2
天津市职业大学,专科（高职）,公办,综合类,天津市,天津,天津市,1978,"主校区：天津市北辰区洛河道2号,海河园校区：天津市海河教育园区雅观路21号",http://www.tjtc.edu.cn/,,天津职业大学,1500,2,2
天津交通职业学院,专科（高职）,公办,理工类,天津市,天津,天津市,1953,天津市西青区西青道269号,https://www.tttc.edu.cn/,天津交职院,,800,2,2
天津工业职业学院,专科（高职）,公办,理工类,天津市,天津,天津市,1981,天津市北辰区学海道38号,https://www.pctj.edu.cn/,,天津冶金职业技术学院,320,2,2
天津工艺美术职业学院,专科（高职）,公办,艺术类,天津市,天津,天津市,1959,"革新道校区：天津市河北区红星路革新道10号,建昌道校区：天津市河北区建昌道41号",http://www.gmtj.com/,,,110,2,2
天津城市职业学院,专科（高职）,公办,综合类,天津市,天津,天津市,1958,天津市河北区真理道27号,http://www.tjcsxy.cn,天津城市职院,,150,2,2
天津石油职业技术学院,专科（高职）,公办,理工类,天津市,天津,天津市,1976,天津市团泊洼,http://www.tjsyxy.com/,天津石油职院,,1447,2,2
南阳理工学院,普通本科,公办,理工类,河南省,河南,南阳市,1987,河南省南阳市长江路80号,http://www.nyist.edu.cn/,南阳理工,,1760,2,2
天津国土资源和房屋职业学院,专科（高职）,公办,综合类,天津市,天津,天津市,1973,天津市滨海新区大港学苑路600号,http://www.tjgfxy.com.cn/tjgfxy/,天津工商职业技术学院,,0,2,2
天津商务职业学院,专科（高职）,公办,财经类,天津市,天津,天津市,1955,"海河教育园校区：天津市海河教育园区雅观路23号,河东校区：天津市河东区六纬路82号,河西校区：天津市河西区白云山路",http://www.tcc1955.edu.cn/,天津商院,,750,2,2
天津艺术职业学院,专科（高职）,公办,艺术类,天津市,天津,天津市,2002,"天津市河东区娄山道27号,天津市南开区苍穹道8号",http://www.arttj.cn/,,,97,2,2
天津中德应用技术大学,普通本科,公办,理工类,天津市,天津,天津市,1985,天津市海河教育园区雅深路2号,https://www.tsguas.edu.cn/,天津中德,天津中德职业技术学院,1000,2,2
天津铁道职业技术学院,专科（高职）,公办,理工类,天津市,天津,天津市,1951,天津市河北区建昌道21号,http://www.tjtdxy.cn/,津铁院,,219,2,2
大连商务职业学院,专科（高职）,民办,财经类,辽宁省教育厅,辽宁,大连市,1997,辽宁省大连市甘井子区虹港路381号,,,,300,2,2
通辽职业学院,专科（高职）,公办,综合类,内蒙古自治区,内蒙古,通辽市,2004,内蒙古自治区通辽市经济技术开发区辽河大街东段,http://www.tlzyxy.com/,,,803,2,2
西安外事学院,普通本科,民办,综合类,陕西省教育厅,陕西,西安市,1992,陕西省西安市雁塔区鱼斗路18号,https://www.xaiu.edu.cn/,"西安外事,XAIU",,2400,2,2
西安思源学院,普通本科,民办,综合类,陕西省教育厅,陕西,西安市,1998,陕西省西安市东郊水安路28号,http://www.xasyu.cn/,西安思源职业学院,,1600,2,2
北京体育大学,普通本科,公办,体育类,国家体育总局,北京,北京市,1953,北京市海淀区信息路48号,https://www.bsu.edu.cn/,"北体,北体大,BSU",,1133,2,1
南昌工程学院,普通本科,公办,理工类,江西省,江西,南昌市,1958,"瑶湖校区：江西省南昌市高新技术开发区天祥大道289号,彭家桥校区：江西省南昌市青山湖区北京东路59号",http://www.nit.edu.cn,,江西水利电力学院,2047,2,2
南昌理工学院,普通本科,民办,综合类,江西省教育厅,江西,南昌市,1999,江西省南昌经济技术开发区英雄大道901号,http://www.nut.edu.cn/,南昌理工,江西航天科技职业学院,3000,2,2
江西科技学院,普通本科,民办,综合类,江西省教育厅,江西,南昌市,1994,江西省南昌市瑶湖高校园区紫阳大道115号,http://www.jxut.edu.cn/,"江西蓝天学院,江西科技大学",江西蓝天学院,2000,2,2
江西中医药高等专科学校,专科（高职）,公办,医药类,江西省,江西,抚州市,1958,"新校区：江西省抚州市文昌大道2766号,老校区：江西省抚州市赣东大道1111号",http://www.jxtcms.net,江西医专,,500,2,2
江西卫生职业学院,专科（高职）,公办,医药类,江西省,江西,南昌市,1955,江西省南昌市小蓝经济开发区汇仁大道689号,http://www.jxhlxy.com.cn/,江西卫院,江西护理职业技术学院,435,2,2
豫章师范学院,普通本科,公办,师范类,江西省,江西,南昌市,1908,江西省南昌市兴湾大道1999号,https://www.yuznu.edu.cn/html/,豫章师院,南昌师范高等专科学校,1000,2,2
河南中医药大学,普通本科,公办,医药类,河南省,河南,郑州市,1958,河南省郑州市郑东新区金水东路156号,https://www.hactcm.edu.cn/,河中医,河南中医学院,1565,2,2
江西警察学院,普通本科,公办,政法类,江西省,江西,南昌市,1951,江西省南昌市新建区梅岭大道1666号,http://www.jxga.edu.cn/,江西公安专科学校,,1933,2,2
首都经济贸易大学,普通本科,公办,财经类,北京市,北京,北京市,1956,"校本部：北京市丰台区花乡张家路口121号,红庙校区：北京市朝阳门外金台里2号",https://www.cueb.edu.cn/,"首都经贸大学,首经贸,首都经贸,首都经济贸易",,440,2,2
信阳师范学院,普通本科,公办,师范类,河南省,河南,信阳市,1975,河南省信阳市南湖路237号,http://www.xynu.edu.cn/,信阳师院,,2500,2,2
安阳师范学院,普通本科,公办,综合类,河南省,河南,安阳市,1908,河南省安阳市弦歌大道436号,http://www.aynu.edu.cn,"安阳师院,安阳师范",,1380,2,2
北京信息科技大学,普通本科,公办,理工类,北京市,北京,北京市,1937,北京市海淀区清河小营东路12号,https://www.bistu.edu.cn/,北信,北京机械工业学院,1700,2,2
平顶山学院,普通本科,公办,综合类,河南省,河南,平顶山市,1959,"湖滨校区：河南省平顶山市新城区未来路南段,崇文校区：河南省平顶山市新城区崇文路",http://www.pdsu.edu.cn/,平院,,2319,2,2
北京青年政治学院,专科（高职）,公办,语言类,北京市,北京,北京市,1956,北京市朝阳区花家地街9号,http://www.bjypc.edu.cn,北青院,,140,2,2
北京信息职业技术学院,专科（高职）,公办,理工类,北京市,北京,北京市,1954,"校本部：北京市朝阳区芳园西路5号,东校区：北京市朝阳区东坝红松园北里甲1号",http://www.bitc.edu.cn,北信学院,,350,2,2
河南科技学院,普通本科,公办,综合类,河南省,河南,新乡市,1939,河南省新乡市华兰大道东段90号,http://www.hist.edu.cn,河科院,,2021,2,2
黄淮学院,普通本科,公办,综合类,河南省,河南,驻马店市,1971,河南省驻马店市开源大道76号,http://www.huanghuai.edu.cn,,,2760,2,2
北京工业职业技术学院,专科（高职）,公办,理工类,北京市,北京,北京市,1956,北京市石景山区石门路368号,http://www.bgy.edu.cn,北工院,,360,2,2
铁道警察学院,普通本科,公办,政法类,公安部,河南,郑州市,1950,河南省郑州市农业路31号,http://www.rpc.edu.cn,铁道警院,铁道警官高等专科学校,931,2,2
北京经济技术职业学院,专科（高职）,民办,财经类,北京市教委,北京,北京市,2003,北京市东燕郊开发区北京经济技术职业学院,http://www.bibtedu.cn/,北经济,,340,2,2
萍乡学院,普通本科,公办,综合类,江西省,江西,萍乡市,1941,江西省萍乡市萍安北大道211号,http://www.pxc.jx.cn,,萍乡高等专科学校,1200,2,2
景德镇学院,普通本科,公办,综合类,江西省,江西,景德镇市,1977,江西省景德镇市浮梁县浮梁大道3号,http://www.jdzu.edu.cn,景院,景德镇高等专科学校,2025,2,2
漯河医学高等专科学校,专科（高职）,公办,医药类,河南省,河南,漯河市,1924,河南省漯河市源汇区大学路148号,http://www.lhmc.edu.cn/,漯河医专,漯河市卫生学校,1540,2,2
新余学院,普通本科,公办,综合类,江西省,江西,新余市,1985,江西省新余市高新区阳光大道2666号,http://www.xyc.edu.cn/,新余高等专科学校,新余高等专科学校,1950,2,2
九江职业技术学院,专科（高职）,公办,综合类,江西省,江西,九江市,1960,"十里校区：江西省九江市濂溪区十里大道1188号,濂溪校区：江西省九江市濂溪区前进东路881号",https://www.jvtc.jx.cn/,九江职院,,1500,2,2
河南工学院,普通本科,公办,理工类,河南省,河南,新乡市,1975,河南省新乡市平原路699号,https://www.hait.edu.cn/,,河南机电高等专科学校,1220,2,2
江西工业职业技术学院,专科（高职）,公办,综合类,江西省,江西,南昌市,1954,"瑶湖校区： 江西省南昌市高新区天祥大道388号,青山湖校区：江西省南昌市青山湖北大道1988号",http://www.jxgzy.cn/,"江西工职院,江西工业学院",,1309,2,2
九江职业大学,专科（高职）,公办,综合类,江西省,江西,九江市,1985,"濂溪校区：江西省九江市濂溪大道88号,鹤问湖校区：江西省九江市九瑞大道91号",https://www.jjvu.jx.cn/,JJVU,,1016,2,2
北京政法职业学院,专科（高职）,公办,政法类,北京市,北京,北京市,1982,北京市大兴区黄亦路（团河段）2号,http://www.bcpl.cn,北京政法职院,,536,2,2
北京财贸职业学院,专科（高职）,公办,财经类,北京市,北京,北京市,1958,"校本部：北京市通州区北关大街88号,涿州校区：河北省涿州市双塔区大石桥团结路8号,朝阳校区：北京市朝阳区水碓子东路15号,东城校区：北京市东城区东四南大街礼士胡同41号",http://www.bjczy.edu.cn,北京财贸职院,,446,2,2
江西工业贸易职业技术学院,专科（高职）,公办,综合类,江西省,江西,南昌市,1964,江西省南昌市红角洲高校园区嘉言路699号,https://www.jxgmxy.com/,江西工贸学院,,534,2,2
郑州电力高等专科学校,专科（高职）,公办,理工类,河南省,河南,郑州市,1933,河南省郑州市郑东新区凤栖街296号,http://www.zepc.edu.cn,郑电高专,,441,2,2
江西现代职业技术学院,专科（高职）,公办,理工类,江西省,江西,南昌市,1978,江西省南昌市紫阳大道338号,http://www.jxxdxy.edu.cn/,江西现代学院,,1476,2,2
北京京北职业技术学院,专科（高职）,公办,理工类,北京市,北京,北京市,1984,北京市怀柔区小中富乐一区188号,http://www.jbzy.com.cn,北京京北职院,,186,2,2
宜春职业技术学院,专科（高职）,公办,综合类,江西省,江西,宜春市,1908,江西省宜春市锦绣大道996号,http://www.ycvc.jx.cn/,宜春职院,,1500,2,2
南昌职业大学,普通本科,民办,综合类,江西省教育厅,江西,南昌市,1993,江西省南昌市安义凤凰开发区前进东路8号,http://www.nvu.edu.cn,江西大宇职业技术学院,"江西大宇学院,南昌职业学院",1200,2,2
北京交通职业技术学院,专科（高职）,公办,理工类,北京市,北京,北京市,1984,北京市昌平区昌平镇北京交通职业技术学院,http://www.jtxy.com.cn/,北交院,,305,2,2
北京戏曲艺术职业学院,专科（高职）,公办,艺术类,北京市,北京,北京市,1952,北京市丰台区马家堡东里8号,http://www.bjxx.com.cn,北戏,,305,2,2
北京北大方正软件职业技术学院,专科（高职）,民办,综合类,北京市教委,北京,北京市,2002,北京市通州区东方大学城,http://www.pfc.edu.cn/,北大方正软件技术学院,"北京北大方正软件职业技术学院,北京北大方正软件技术学院",901,2,2
江西交通职业技术学院,专科（高职）,公办,综合类,江西省,江西,南昌市,1956,江西省南昌市经济技术开发区双港东大街644支路395号,https://www.jxjtxy.edu.cn/,江西交院,,850,2,2
抚州职业技术学院,专科（高职）,公办,综合类,江西省,江西,抚州市,2003,江西省抚州市东临路276号,http://www.fzjsxy.cn,抚职,,941,2,2
武汉民政职业学院,专科（高职）,公办,政法类,湖北省,湖北,武汉市,1986,湖北省武汉市洪山区卓刀泉路257号,http://www.whmzxy.cn,,,315,2,2
江西应用工程职业学院,专科（高职）,公办,理工类,江西省,江西,萍乡市,1922,江西省萍乡市安源区高坑镇周家坊,http://www.jxatei.net/,,,410,2,2
北京农业职业学院,专科（高职）,公办,农林类,北京市,北京,北京市,1958,"南校区：北京市房山区长阳镇稻田南里5号,北校区：北京市海淀区香山普安店29号",http://www.bvca.edu.cn/,北京农职院,,1218,2,2
山西中医药大学,普通本科,公办,医药类,山西省,山西,晋中市,1978,"校本部：山西省晋中市高校园区大学街121号,太原校区：山西省太原市晋祠路一段89号",http://www.sxtcm.edu.cn,,山西中医学院,979,2,2
运城学院,普通本科,公办,综合类,山西省,山西,运城市,1978,山西省运城市复旦西街1155号运城学院,http://www.ycu.edu.cn,,,3089,2,2
晋中学院,普通本科,公办,综合类,山西省,山西,晋中市,1958,山西省晋中市榆次区文华街199号,http://www.jzxy.edu.cn/cn/index.html,,,882,2,2
江西工程职业学院,专科（高职）,公办,综合类,江西省,江西,南昌市,1979,江西省南昌市西湖区安石路69号,http://www.jxrtvu.com/gczyxy/,江工职院,,145,2,2
江西科技职业学院,专科（高职）,民办,综合类,江西省教育厅,江西,南昌市,1983,江西省南昌市银三角316国道金山一号,http://www.jxkeda.com/,江科院,,1000,2,2
江西生物科技职业学院,专科（高职）,公办,农林类,江西省,江西,南昌市,2003,江西省南昌市莲塘北大道1636号,http://www.jxswkj.com/,江西生物职院,,1228,2,2
江西外语外贸职业学院,专科（高职）,公办,财经类,江西省,江西,南昌市,1964,江西省南昌市天祥大道291号,http://www.jxcfs.com/,江西外语外贸,,600,2,2
江西司法警官职业学院,专科（高职）,公办,政法类,江西省,江西,南昌市,1958,江西省南昌市昌北开发区长青路76号,http://www.jxsfjy.cn/,江司警院,,175,2,2
江西应用科技学院,普通本科,民办,综合类,江西省教育厅,江西,南昌市,1984,江西省南昌市新建区宏福大道2888号,http://www.jxcsedu.com/,,江西城市职业学院,173,2,2
西昌学院,普通本科,公办,综合类,四川省,四川,凉山彝族自治州,1939,四川省西昌市安宁镇学府路1号,https://www.xcc.edu.cn/,,,1900,2,2
江西电力职业技术学院,专科（高职）,公办,理工类,江西省,江西,南昌市,1958,江西省南昌市昌北经济开发区海棠南路268号,http://www.jxdlzy.com/,江西电力学院,,479,2,2
攀枝花学院,普通本科,公办,综合类,四川省,四川,攀枝花市,1983,四川省攀枝花市东区机场路10号,http://www.pzhu.edu.cn/,攀枝花大学,,1224,2,2
炎黄职业技术学院,专科（高职）,民办,理工类,江苏省教育厅,江苏,淮安市,1999,江苏省淮安市涟水炎黄大道东1号,http://www.yhjyjt.cn,炎黄学院,,309,2,2
西南大学,普通本科,公办,综合类,教育部,重庆,重庆市,1906,重庆市北碚区天生路2号,http://www.swu.edu.cn/,SWU,,8295,2,1
贵州大学,普通本科,公办,综合类,贵州省,贵州,贵阳市,1902,贵州省贵阳市花溪区贵州大学普通本科招生办公室,http://www.gzu.edu.cn,"gzu,贵大",,4638,2,1
