学校名称,属性,性质,类型,学校地址,联系电话,省级位置,地级位置,县级位置,官网
枣庄市齐村镇渴口中学,区重点,公办,中学,山东省枣庄市市中区北安西路201号,0632-3746576,山东省,枣庄市,市中区,
南康市麻双中学,普通,公办,中学,江西省赣州市南康市麻双乡麻双村,0797-7701129,江西省,赣州市,南康市,
杭州市丰潭中学,市重点,公办,中学,杭州市古荡小区西侧,0571-28879123,浙江省,杭州市,西湖区,
建宁一中,省重点,公办,中学,福建省三明市建宁县濉城镇青源巷1号,0598-3982010,福建省,三明市,建宁县,
陕西省石油化工学校,普通,公办,中学,西安市长安南路503号,029-88501156,陕西省,西安市,长安区,
横峰县第二中学,普通,公办,中学,横峰县果园新村1号,0793-5789288,江西省,上饶市,横峰县,
密云区第五中学,普通,公办,中学,北京市密云县滨阳北里东侧,010-69046077,北京市,北京市,密云区,
潼南县大佛中学,市重点,公办,中学,重庆市潼南县梓潼镇建设一路8号,023-44590163,重庆市,重庆市,潼南区,
南昌航空大学附属学校,市重点,公办,中学,江西省南昌市青山湖区上海路173号,0791-8224616 8212556,江西省,南昌市,,
深圳市北环中学,省重点,公办,中学,深圳市福田区莲花北村内,0755-83061271,广东省,深圳市,福田区,
常州市武进区寨桥初级中学,普通,私立,中学,江苏常州市寨桥初中,0519-86262240,江苏省,常州市,,
湖北省黄冈卫生学校,普通,私立,中学,湖北省黄冈市典州大道19号,,湖北省,黄冈市,,
大冶一中,省重点,公办,中学,黄石市大冶市金湖大道18号,,湖北省,黄石市,大冶市,
饶平县上善中学,普通,公办,中学,广东省潮州市饶平县上饶镇上善村双善街,,广东省,潮州市,饶平县,
九江县新塘高级中学,普通,私立,中学,江西省九江市九江县新塘镇双瑞路北侧,6961200,江西省,九江市,九江县,
浙江省泰顺中学,市重点,公办,中学,温州市泰顺县罗阳镇北外上庄洋,0577-67560012   67561234   67560003,浙江省,温州市,泰顺县,
枣庄市第二十六中学（高中部）,市重点,公办,中学,山东省枣庄市市中区税郭镇驻地,0632-3532187,山东省,枣庄市,市中区,
石景山九中,市重点,公办,中学,北京市石景山区模式口大街16号,010-88736036,北京市,北京市,石景山区,
天津市崇化中学,市重点,公办,中学,天津市南开区城厢中路北城街,022-27364734,天津市,天津市,南开区,
赤城县第三中学,普通,公办,中学,河北省张家口市赤城县龙关镇四街村?电话：0313-6495405,0313-6495405,河北省,张家口市,,
淄博市临淄区边河中学,普通,公办,中学,山东省淄博市临淄区金山镇边河村109号,0533-7450133,山东省,淄博市,临淄区,
北京161中学（南校区）,区重点,公办,中学,北京市西城区前门西大街43号,010-66055373,北京市,北京市,西城区,
北京161中学（中校区）,区重点,公办,中学,北京市西城区西长安街1号（中校区）,010-66055627,北京市,北京市,西城区,
南京鼓楼实验中学,普通,民办,中学,江苏省南京市鼓楼区北圩路129号,,江苏省,南京市,鼓楼区,
淄博市临淄区朱台镇高阳中学,省重点,公办,中学,山东省淄博市临淄区朱台镇北高村,0533-7750776,山东省,淄博市,临淄区,
兰州市第四中学,市重点,公办,中学,甘肃省兰州市七里河区敦煌路494号,0931-2318603,甘肃省,兰州市,七里河区,
南昌县三江中学,普通,公办,中学,南昌县三江镇三江中学,0791-5101116,江西省,南昌市,南昌县,
湖州市第四中学,市重点,公办,中学,湖州吴兴区白鱼潭路221号,0572-2386433,浙江省,湖州市,,http://www.hz4z.net
郑州市第五十一中学,省重点,公办,中学,河南省郑州市中原区协作路,0371-67642957,河南省,郑州市,,
宜丰三中,普通,公办,中学,江西省宜春市宜丰县潭山镇,0795-2922109,江西省,宜春市,宜丰县,
东莞市长安实验中学,省重点,公办,中学,东莞市长安镇长青北路336号,（0769）85389638,广东省,东莞市,,http://casz.dgjy.net
泰安市东平县第四中学,普通,公办,中学,山东省泰安市东平县银山镇,0538-2551695,山东省,泰安市,东平县,
绍兴市始兴县风度中学,省重点,公办,中学,广东韶关市始兴县,0751-3336354,广东省,韶关市,始兴县,
昆明市第三中学空港实验学校,市重点,私立,中学,昆明国际包装城（文博路890号）,0871-67187688,云南省,昆明市,官渡区,
四川省射洪中学,省重点,公办,中学,四川省射洪县太和镇红专路165号,0825-6680672,四川省,遂宁市,射洪县,
上海市奉贤区胡桥学校（中学部）,普通,公办,中学,上海市奉贤区柘林镇胡桥社区中心路101号,021-57456602 021-57456286,上海市,上海市,奉贤区,
潍坊市滨海第三初中,普通,公办,中学,,,山东省,潍坊市,,
长阳土家族自治县清江高级中学,普通,公办,中学,湖北省长阳土家族自治县津洋口小区一组,0717-5318347,湖北省,宜昌市,长阳土家族自治县,http://www.qjedu.com
佛山顺德区熹涌陈佐乾纪念学校,市重点,私立,中学,广东省佛山市顺德区伦教熹涌校前路1号,0765-27759921,广东省,佛山市,顺德区,
茂名市第十七中学,省重点,公办,中学,茂名市为民路69号,0668-3397500,广东省,茂名市,茂南区,
咸宁高中,省重点,公办,中学,湖北省咸宁市咸安区永安大道28号,,湖北省,咸宁市,咸安区,
湘潭市第十二中学,普通,公办,中学,湖南省湘潭市芙蓉中路20,（0731）58525695,湖南省,湘潭市,雨湖区,
合肥市第六十七中学,普通,公办,中学,望江西路102号,0551-5160421,安徽省,合肥市,蜀山区,
东营市利津县第一中学（利津一中）,市重点,公办,中学,山东省东营市利津县城滨港路243号,0546-5682966,山东省,东营市,利津县,
中山市神湾镇神湾中学,市重点,公办,中学,广东省中山市神湾镇敬业路,0760-86600303,广东省,中山市,,
内江市第五初级中学校,普通,公办,中学,四川省内江市东兴区椑木镇石桥西路（内江五中）,0832-2314499,四川省,内江市,,
邹城市第四中学,普通,私立,中学,邹城市文汇路339号,,山东省,济宁市,,
武汉市实验学校,市重点,公办,中学,武汉市江岸区胜利街265号,027-82850135  82833905,湖北省,武汉市,江岸区,
张家口市第二十中学,普通,公办,中学,河北省张家口市桥西区古宏庙街副55号甲1号,0313-8022167,河北省,张家口市,桥西区,
柘荣县第三中学,普通,公办,中学,福建省宁德市柘荣县,,福建省,宁德市,柘荣县,
奎文区南苑学校（中学部）,区重点,民办,中学,山东省潍坊市奎文区青年路南头刘东村,0536-8820167,山东省,潍坊市,奎文区,
昌邑一中,市重点,公办,中学,山东省潍坊市昌邑市潍河西路1号,0536-7212370,山东省,潍坊市,昌邑市,
商丘市第一高级中学（商丘一高）,省重点,公办,中学,商丘市归德南路与南京路交叉口南500米（从火车站乘16路公交车直达）,0370-3216068,河南省,商丘市,睢阳区,
江门市会城天禄中学,普通,公办,中学,江门会城镇天禄村&#8195;,0750-6301995,广东省,江门市,新会区,
白石渡镇中学,普通,公办,中学,白石渡镇青年路5号,0735-3652213,湖南省,郴州市,宜章县,
南京市第十二初级中学,区重点,公办,中学,南京市下关区姜家圩48号-2,025-58768252,江苏省,南京市,下关区,
济南齐鲁学校,市重点,民办,中学,山东省济南市历下区花园路东首路北,0531-66896102,山东省,济南市,历下区,
辽宁省阜新市实验中学,省重点,公办,中学,辽宁省阜新市中华路95号,0418-6519437  0418-6519467,辽宁省,阜新市,,
房山区北潞园学校,普通,公办,中学,北京市房山区小区北潞园内,,北京市,北京市,房山区,
长春市一0三中学（长春市第二外国语学校）,区重点,公办,中学,吉林省长春市南关区大经路77号,0431）8973527,吉林省,长春市,南关区,
上海尚德实验学校（国际部）,普通,民办,中学,上海市秀沿路1688号,021-68180191  68180192,上海市,上海市,浦东新区,
洪山一中,市重点,公办,中学,娄底市双峰县洪山殿镇,15873846856,湖南省,娄底市,双峰县,
哆啦A梦,市重点,私立,中学,湖南,654168465,湖南省,娄底市,,
广州市真光实验学校,省重点,民办,中学,广东省广州市荔湾区白鹤洞鹤翔路2号,020-81800134,广东省,广州市,荔湾区,
韶关市曲江区沙溪中学,区重点,公办,中学,韶关市曲江区沙溪镇长新路,0751-6611109,广东省,韶关市,曲江区,
宁波市惠贞书院中学部,省重点,公办,中学,育才校区：宁波市江北区育才路197号/天水校区：宁波市江北区丽江东路121号,0574- 87211127 83090202,浙江省,宁波市,江北区,
厦门国贸协和双语高级中学,普通,民办,中学,福建省厦门市思明区洪莲中二路1-11号,0592-5928700,福建省,厦门市,思明区,
厦门思明区协和双语学校,普通,民办,中学,思明区洪莲北路1055号,,福建省,厦门市,思明区,
长郡梅溪湖中学,省重点,公办,中学,湖南省长沙市梅溪湖枫林三路899号,0731-88398067,湖南省,长沙市,岳麓区,
宁波市万里国际学校（初中）,普通,民办,中学,科技园区腊梅路15l号,0574-87908890,浙江省,宁波市,江东区,
安徽省屯溪第一中学（屯溪一中）,省重点,公办,中学,安徽省黄山市屯溪区屯溪率水路27号,,安徽省,黄山市,屯溪区,
上海市继光高级中学,区重点,公办,中学,上海市虹口区高阳路690号,021-65462746,上海市,上海市,虹口区,jggj.hkedu.sh.cn/...
东莞市东坑中学,市重点,公办,中学,东莞市东坑镇东兴路231号,0769-3381208,广东省,东莞市,,
济宁市曲阜一中,市重点,公办,中学,山东省济宁市曲阜市春秋路101号,0537-4407008,山东省,济宁市,曲阜市,
辽宁师范大学第二附属中学（辽师附二中）,区重点,公办,中学,辽宁省大连市沙河口区宏业街59号,0411-82159405,辽宁省,大连市,沙河口区,
青岛第五十六中学,市重点,公办,中学,山东省青岛市四方区高安路14号,0532-84852728,山东省,青岛市,四方区,
厦门市金鸡亭中学,区重点,公办,中学,福建省厦门市西林东里1号,0592-5996021,福建省,厦门市,思明区,
青岛第四十七中学,市重点,公办,中学,山东省青岛市北区上清路10号,0532-83642307,山东省,青岛市,市北区,
东莞市大朗第一中学（大朗一中）,市重点,公办,中学,东莞市大朗镇富民中路467号,0769-83132090,广东省,东莞市,,
承德九中,市重点,公办,中学,河北省承德市桃李街1号,0314-2154115,河北省,承德市,,
重庆市武隆中学,市重点,公办,中学,重庆市武隆县冯家坡59号,023-77722005,重庆市,重庆市,武隆县,
新泰市实验中学,市重点,公办,中学,山东省泰安市新泰市杏山路335号,0538-7256856,山东省,泰安市,新泰市,
青岛第三十三中学,区重点,公办,中学,青岛四流中路387号,0532-82971987,山东省,青岛市,李沧区,
滕州市东郭镇党山中学,区重点,公办,中学,山东省枣庄市滕州市东郭镇大党山村,13793735788,山东省,枣庄市,滕州市,
内江六中,省重点,公办,中学,四川省内江市东兴区西林街道太白路79号,（0832）2272181,四川省,内江市,,
梅江区联合中学,普通,公办,中学,广东省梅州市梅江区西郊上黄塘,0753-2181869,广东省,梅州市,梅江区,
长沙市天心一中,区重点,公办,中学,湖南省长沙市书院南路686号,0731—８5212908,湖南省,长沙市,天心区,
平远县冬青实验学校,普通,公办,中学,广东省梅州市平远县石正镇樟田坳电话：0753－8396235,0753－8396235,广东省,梅州市,平远县,
温州市苍南县金乡高级中学,市重点,公办,中学,浙江省苍南县金乡镇西门文苑路,0577-64577301,浙江省,温州市,苍南县,
湘潭市第十六中学,市重点,公办,中学,湖南省湘潭市雨湖公园湖畔,0732 514300,湖南省,湘潭市,雨湖区,
漳州市天宝中学,普通,公办,中学,福建省漳州市芗城区天宝镇,（0596）2542518,福建省,漳州市,芗城区,
南昌市育英学校,普通,公办,中学,江西省南昌市青云谱区司马庙立交桥旁,0791-6412699,江西省,南昌市,青云谱区,
大同十三中,普通,私立,中学,大同城区东菜园街十四号,,山西省,大同市,,
杭州新世纪外国语学校初中部,区重点,民办,中学,浙江省杭州市上城区皇诰巷2号,0571—86593768,浙江省,杭州市,上城区,
韶关市南雄市乌迳中学,市重点,公办,中学,广东省韶关市南雄市342省道,0751—3752020。,广东省,韶关市,南雄市,
临朐县龙泉中学,市重点,公办,中学,山东省潍坊市临朐县黄龙路8号,0536-3166704,山东省,潍坊市,临朐县,
重庆市永川北山中学校,市重点,公办,中学,重庆市永川市北山路4号,（023）49802951,重庆市,重庆市,永川区,
平远县城南中学,普通,公办,中学,广东省梅州市平远县平城梅平路,8896975,广东省,梅州市,平远县,
深圳市翠园中学初中部,省重点,公办,中学,深圳市怡景路景贝北1006号,0755-25522384,广东省,深圳市,罗湖区,
康保县第一中学（康保一中）,市重点,公办,中学,河北省张家口市康保县西经路北23号,,河北省,张家口市,康保县,
厦门第五中学,市重点,公办,中学,厦门市思明区莲前西路203-205,0592-2022787,福建省,厦门市,思明区,http://xm5z.com:8001/index.jsp
苏州市张家港市三兴初级中学,普通,公办,中学,苏州市张家港市锦丰镇三兴街道育才路,0512-58570317,江苏省,苏州市,张家港市,
深圳福田新洲中学,普通,公办,中学,福田区新洲五街60号,0755-83301091 83417842,广东省,深圳市,福田区,
潼南县古溪镇中学,普通,公办,中学,潼南县古溪镇河边街89号,023-44210134,重庆市,重庆市,潼南区,
永泰梧桐中学,普通,公办,中学,梧桐镇坂东街,0591-24861286,福建省,福州市,永泰县,
上海市市东中学（初中部）,区重点,公办,中学,上海市杨浦区霍山路420号,021-65419737 021-65416558,上海市,上海市,杨浦区,
永新县芦溪中学,普通,公办,中学,江西省吉安市永新县芦溪乡古竹村,0796-7950577,江西省,吉安市,永新县,
新乡市第一中学（新乡一中）,市重点,公办,中学,新乡市丰华路南段,0373-3552588,河南省,新乡市,,
济宁市任城区第二中学（济宁二中）,市重点,公办,中学,山东省济宁市任城区接庄镇,0537-2631182,山东省,济宁市,任城区,
上海教科实验中学,区重点,民办,中学,上海市闵行区万源路55号,021-54933272  021-64807218,上海市,上海市,闵行区,http://www.jksz.com
广州市番禺区香江育才实验学校,市重点,民办,中学,广州市二沙岛烟雨南路一号育才实验学校,020-87352279,广东省,广州市,番禺区,
大目湾实验学校,普通,民办,中学,宁波市象山县大目湾新城智慧路555号,0574-65787761,浙江省,宁波市,宁海县,
常州市北环中学,普通,私立,中学,常州市竹林南路10号,0519-85310900,江苏省,常州市,,
滁州天长中学,市重点,公办,中学,滁州市天长市天康东路588号,,安徽省,滁州市,天长市,
云衢中学,市重点,公办,中学,广东省中山市市辖区,0760-85218787,广东省,中山市,,
武汉市七一中学,市重点,公办,中学,湖北省武汉市中山大道1433号,027-82722649,湖北省,武汉市,江岸区,
容城县贾光中学,普通,公办,中学,河北省保定市容城县贾光乡贾光村,0312-5988904 5688292,河北省,保定市,容城县,
枣庄市第四十中学,省重点,公办,中学,山东省枣庄市山亭区 府前东路30号,（0632）8811488,山东省,枣庄市,山亭区,
广州市绿翠中学,市重点,公办,中学,广东省海珠区滨江东路荷花街2号,020-84208420,广东省,广州市,海珠区,
荣成市第二十七中学,普通,私立,中学,温州俚岛镇驻地,,山东省,威海市,荣成市,
中山市板芙镇板芙中学,市重点,公办,中学,板芙镇五围村,0760-86501465,广东省,中山市,,
郑州四十四中,市重点,公办,中学,河南省郑州市庆丰街12号,0371-68727450,河南省,郑州市,,
顺德区南江初级中学,市重点,公办,中学,顺德区大良街道南江居委南中路16号,"0757-22321068,22321078",广东省,佛山市,顺德区,
曾都一中,市重点,公办,中学,湖北省随州市曾都区青年西路101号,,湖北省,随州市,曾都区,
泰安市东岳中学,区重点,公办,中学,山东省泰安市泰山区岱宗大街378号,0538-8519062    	      0538-6368106,山东省,泰安市,泰山区,
上海市复旦实验中学,区重点,公办,中学,上海市杨浦区安波路151号,021-65512418,上海市,上海市,杨浦区,
青岛第四十四中学,市重点,公办,中学,山东省青岛市四方区瑞昌路108号,0532-83759890,山东省,青岛市,市北区,
厦门湖滨中学初中部,市重点,公办,中学,福建省厦门市思明区长青北里1号,,福建省,厦门市,思明区,
江西省乐平中学,省重点,公办,中学,乐平市长寿路321号,0798-6227446,江西省,景德镇市,,
沈阳市法库县孟家九年一贯制学校,普通,公办,中学,辽宁省沈阳市法库县孟家乡孟家村,024-87138553,辽宁省,沈阳市,法库县,
佛山市九江中学九江分校,市重点,公办,中学,广东省佛山市南海区南新四路7号,（0757）86558513,广东省,佛山市,南海区,
枣庄市台儿庄区特教中心初中部,普通,民办,中学,山东省枣庄市台儿庄区林运路,0632-6653136,山东省,枣庄市,台儿庄区,
中山市东升初级中学,市重点,公办,中学,广东省中山市东升镇,0760-2225971,广东省,中山市,,
杭州市余杭区第二高级中学,市重点,公办,中学,浙江省杭州市余杭区临平南苑街501号,0571-89177002 86224451,浙江省,杭州市,余杭区,
顺义区沙岭学校,普通,公办,中学,北京市顺义区杨镇沙岭青年路5号电话：010-61443968,010-61443968,北京市,北京市,顺义区,
烟台市黄务中学,市重点,公办,中学,烟台市芝罘区黄务街道位于青年南路东,0535-6733896,山东省,烟台市,芝罘区,
广平县第三中学,普通,公办,中学,河北省邯郸市广平县长春大道南段445号,0310-2521961,河北省,邯郸市,广平县,
深圳市新湖中学,市重点,公办,中学,深圳市宝安区N16区玉林路,0755-29021122,广东省,深圳市,宝安区,
绵阳市南山双语学校,省重点,公办,中学,四川省绵阳市科教创业园区九洲大道200号,网站管理：Ranking    联系电话：,四川省,绵阳市,,
濮阳市第一高级中学（濮阳一中）（原濮阳三中）,省重点,公办,中学,河南省濮阳市益民路西段,0393-8996706,河南省,濮阳市,华龙区,
常州市电子技工学校,普通,私立,中学,常州市中凉亭夏凉路101号,,江苏省,常州市,,
上海市陆行中学（北校）,普通,公办,中学,上海市浦东区陆行北校利津路53号,021-50349778,上海市,上海市,浦东新区,
广州市英东中学,市重点,民办,中学,广州市南沙区港前大道南180号,020-84686968 34683132,广东省,广州市,南沙区,
中大附属外国语实验中学,区重点,民办,中学,广东省广州市近郊丰乐南路438号（黄埔花园旁）,020-62987890,广东省,广州市,黄埔区,
莱芜市凤城高中,市重点,公办,中学,山东省莱芜市莱城区嬴牟西大街  赢牟西大街1号,0634-6271223,山东省,莱芜市,莱城区,
宁波市东恩中学,区重点,公办,中学,浙江省宁波市海曙区灵桥路164号,0574-87293642,浙江省,宁波市,海曙区,
郑州四十五中,普通,公办,中学,管城回族区城南路176号,,河南省,郑州市,管城回族区,
中山市古镇高级中学,市重点,公办,中学,广东省中山市古镇镇西岸北路,0760-22318342,广东省,中山市,,
龙岩实验中学,市重点,民办,中学,福建省龙岩市龙腾路（漳龙高速路入口右侧）,0597-2260333,福建省,龙岩市,,www.lysyzx.net
上海市位育中学,市重点,公办,中学,上海市徐汇区位育路1号（高中和国际部）；复兴中路1261号（初中）,021-64312973,上海市,上海市,徐汇区,
南京市第五初级中学冶城校区（南京市第二十八中学）,市重点,公办,中学,南京市建邺区安品街58号,025-86625392,江苏省,南京市,建邺区,
成都市西北中学,普通,公办,中学,成都市人民西路107号（初中部）武侯祠大街建国巷1号（高中部）,（028）86133459　（028）86133473,四川省,成都市,青羊区,
莱阳市第二实验中学,市重点,公办,中学,山东省烟台市莱阳市金山路5号,0535-7295563,山东省,烟台市,莱阳市,
广州市第二十一中学,市重点,公办,中学,广东省广州市越秀区环市东路天胜村16号,（020）83500650,广东省,广州市,越秀区,
深圳滨海高级中学,普通,民办,中学,广东省深圳市宝安区福海街道和平社区永和路18号百港城·和平中心F1,,广东省,深圳市,宝安区,
中山市中山市东区中学,省重点,公办,中学,广东省中山市孙文东路东区中学,0760-88324446,广东省,中山市,,
宁海县深圳镇初级中学,普通,公办,中学,宁海县深圳镇凤山北路,0574-65285294,浙江省,宁波市,宁海县,
菏泽市巨野一中,市重点,公办,中学,山东省菏泽市巨野县254省道,0530-8169065,山东省,荷泽市,巨野县,
全南县大吉山中学,普通,公办,中学,江西省赣州市全南县大吉山镇八里半,,江西省,赣州市,全南县,
温州市苍南县龙港高级中学,市重点,公办,中学,浙江省苍南县龙港镇龙港大道151号,0577-64199519,浙江省,温州市,苍南县,
山东省华侨中学,省重点,公办,中学,山东省青岛市平度市新安路31号,0532-86223270,山东省,青岛市,平度市,
南山实验学校麒麟中学部,市重点,公办,中学,广东省深圳市南山区义学路9号,0755-26959441,广东省,深圳市,南山区,
宁德北大培文学校中学部,普通,民办,中学,福建省宁德市蕉城区七都镇西林村南侧,0593-5066518,福建省,宁德市,蕉城区,
北京市房山区张坊中学,区重点,公办,中学,北京市房山区张坊镇张坊村,010-61339840,北京市,北京市,房山区,
北京市海淀北部新区实验中学,区重点,公办,中学,北京市海淀区温阳路,010-62407841,北京市,北京市,海淀区,
永修县九合中学,普通,公办,中学,江西省九江市永修县城北郊,,江西省,九江市,永修县,
上海市十五中学,普通,公办,中学,上海市杨浦区怀德路110号,021-65899539,上海市,上海市,杨浦区,
淄博市第七中学,省重点,公办,中学,山东省淄博市临淄区南二路80号,0533-7113171,山东省,淄博市,临淄区,
广州市祈福英语实验学校中学部,市重点,民办,中学,广东省广州市番禺区学院路,020-84711694,广东省,广州市,番禺区,
广州市第四中学初中部（原32中）,省重点,公办,中学,广东省广州市荔湾区中山七路326号,020-81814517,广东省,广州市,荔湾区,
合肥梦园学校,普通,公办,中学,高新区天柱路梦园小区,0551-5325956,安徽省,合肥市,瑶海区,
佛山顺德区陈惠南纪念中学,普通,私立,中学,佛山市顺德区陈村镇,,广东省,佛山市,顺德区,
深圳市第二外国语学校,市重点,公办,中学,深圳市龙华新区（原宝安区）观澜街道大水坑社区,0755-85260022,广东省,深圳市,,
深圳罗湖笋岗中学,普通,公办,中学,深圳市罗湖区红岗路1008号,0755-82425941,广东省,深圳市,罗湖区,
柳泉镇中心中学,普通,公办,中学,铜山县柳泉镇驻地,,江苏省,徐州市,铜山县,
深圳市龙城初级中学,市重点,公办,中学,深圳市龙岗区中心城公园路9号,0755-28916659,广东省,深圳市,龙岗区,
建瓯三中,普通,公办,中学,南平市建瓯市水洋巷49,3833339,福建省,南平市,建瓯市,
北京市密云区东邵渠中学,普通,公办,中学,北京市密云县东邵渠镇东邵渠村,010-61062485,北京市,北京市,密云区,
那坡县民族初级中学,普通,公办,中学,那坡县新街,0776-6822311,广西,百色市,那坡县,
洛阳市回民中学,市重点,公办,中学,瀍河回族区熙春西路7号,0379-63558876,河南省,洛阳市,,
广州市西关外国语学校,市重点,公办,中学,荔湾区中山八路石路基20号,（020）81702319,广东省,广州市,荔湾区,
河北南宫中学,省重点,公办,中学,河北省南宫市育才路北段,0319--5222592,河北省,邢台市,,
沈阳市拔萃私立中学,市重点,民办,中学,辽宁省沈阳市新城子区道义镇正义五路二号,024-86518488,辽宁省,沈阳市,新城子区,
武宁县船滩中学,普通,公办,中学,江西省九江市武宁县船滩镇辽埠大道16号,,江西省,九江市,武宁县,
华商科院附属高中（松江校区）,市重点,私立,中学,上海市松江区中山中路706弄-10号,021-60530495,上海市,上海市,松江区,
柳州地区民族高级中学,市重点,公办,中学,广西柳州市柳邕路（民族高级中学）,0772--3250407,广西,柳州市,,http://www.lzdigao.net
上海市民办立达中学（东部校区）,普通,民办,中学,上海市黄浦区车站支路90号,021-63083169 63137445,上海市,上海市,黄浦区,
淮北梅苑学校,普通,公办,中学,淮北市梅苑路36号,,安徽省,淮北市,相山区,
宁波市第十九中学,区重点,公办,中学,浙江省宁波市江东区广福街18号,0574-87332794,浙江省,宁波市,江东区,
江西省莲花中学,省重点,公办,中学,江西省萍乡市莲花县金城大道1号,0799-7221325,江西省,萍乡市,莲花县,
