学校名称,属性,性质,类型,学校地址,联系电话,省级位置,地级位置,县级位置,官网
乌鲁木齐市第二十九中学,普通,公办,中学,北京南路21号附7号,09913838304,新疆,乌鲁木齐市,天山区,
邢台市第八中学,普通,公办,中学,河北省邢台市桥西区育才路178号,0319-2028378  0319-2050223,河北省,邢台市,桥西区,
于都县银坑中学,普通,公办,中学,江西省赣州市于都县银坑镇,,江西省,赣州市,于都县,
江门市新会区第二中学（新会二中）,普通,公办,中学,新会区双水镇天亭圩,（0750）6421250,广东省,江门市,新会区,
赤城县第二中学（赤城二中）,普通,民办,中学,河北省张家口市赤城县赤城镇宪民南街８７号,0313-6312231,河北省,张家口市,赤城县,
河北省石家庄市第十三中学,普通,公办,中学,石家庄市长安区南高营　,0311-87252099,河北省,石家庄市,长安区,
青岛市第五中学（青岛大学实验中学）,普通,公办,中学,山东省青岛市 上杭路5号,13210110519,山东省,青岛市,市南区,
仙游第一中学（仙游一中）,普通,公办,中学,仙游县鲤城社区城内街道一中街239号电话:0594-8298282,,福建省,莆田市,仙游县,
揭阳市岐山学校（中学部）,普通,私立,中学,东山区建阳路晓翠路交汇处,0663-8228629,广东省,揭阳市,榕城区,
太原市尖草坪第一中学（尖草坪一中）,,公办,中学,太原市尖草坪区柴村镇希望西街8号,0531-6030647,山西省,太原市,尖草坪区,
阳春市合水中学,普通,公办,中学,广东省阳江市阳春市合水镇建设南路31号,0662-7211251,广东省,阳江市,阳春市,
温州泰顺县新城学校,普通,公办,中学,温州市泰顺县城北路257号,0577-67592068,浙江省,温州市,泰顺县,
浠水县兰溪高级中学,普通,私立,中学,湖北省浠水县兰溪镇西街,0713-4655134,湖北省,黄冈市,浠水县,
重庆万盛田家炳中学（原四十九中学）,普通,公办,中学,重庆市万盛区万东北路58号,023-48295501 18996005678,重庆市,重庆市,万盛区,
高碑店八中,普通,公办,中学,河北省保定市高碑店市文化路,,河北省,保定市,高碑店市,
苏州市张家港乐余高级中学,普通,公办,中学,苏州市张家港市乐红路146号,0512-58966250  0512-58966251,江苏省,苏州市,张家港市,
南平市建阳外国语学校,普通,民办,中学,福建省南平市建阳黄花山路33号,0599-5846666,福建省,南平市,建阳市,
晋江市子江中学,普通,私立,中学,福建省晋江市安海镇兴安路　,0595-85705852,福建省,泉州市,晋江市,
合肥市六十一中学,,公办,中学,合肥市金寨南路1100号,0551-3633177,安徽省,合肥市,包河区,
南宁市第四十七中学,普通,公办,中学,广西南宁市青秀区凤翔路12号,0771-2869128,广西,南宁市,青秀区,
西安陕西师范大学凤凰城初级中学,普通,民办,中学,西安市未央区灞浦二路,029—61161157,陕西省,西安市,未央区,
淄博市沂源县石桥中学,普通,公办,中学,山东省淄博市沂源县石桥乡镇政府驻地,0533-3461413,山东省,淄博市,沂源县,
上海市嘉定区黄渡中学,普通,公办,中学,上海市嘉定区黄渡镇绿苑路385号,021-59595416,上海市,上海市,嘉定区,
东莞市石碣新民学校,普通,民办,中学,东莞市石碣镇崇焕东路,0769-86363999,广东省,东莞市,,
佛山顺德区三洲学校,普通,私立,中学,佛山市顺德区伦教三洲牌坊口,,广东省,佛山市,顺德区,
苏州市浦庄中学（临湖第二中学）,普通,公办,中学,江苏省苏州市吴中区浦庄镇育才路5号,0512-66532447  0512-66536043,江苏省,苏州市,吴中区,
江北嘴实验学校,普通,公办,中学,重庆市江北区北滨二路紫御江山南侧,,重庆市,重庆市,江北区,
正定县第五中学,普通,公办,中学,河北省正定县曲阳桥村,0311-88291047,河北省,石家庄市,正定县,
莆田十七中,普通,公办,中学,福建莆田市涵江区涵江苍林小区,0594-3597326,福建省,莆田市,涵江区,
成都三十八中,普通,公办,中学,成华区龙潭寺隆兴路,028-84200038 、84203838,四川省,成都市,成华区,
天津市北门东中学（天津市红桥区泰达实验中学）,普通,公办,中学,天津市红桥区西马路欢庆里胡同20号,022-87322337/27563758,天津市,天津市,红桥区,
天津市太平村第二中学（太平村二中）,普通,公办,中学,天津市大港区太平镇北环路,022-63148107,天津市,天津市,大港区,
渝水区珠珊中学,普通,公办,中学,江西省新余市渝水区,,江西省,新余市,渝水区,
晋江市丰光中学,普通,公办,中学,福建省泉州市晋江内坑镇葛州村,,福建省,泉州市,晋江市,
太原市第三十六中学（太原三十六中）,普通,公办,中学,山西省太原市迎泽区南内环街161号,0351-7235114,山西省,太原市,迎泽区,
上海市真北中学,普通,公办,中学,上海市普陀区真北支路263弄10号,021-52850387,上海市,上海市,普陀区,
大同市口泉中学,普通,公办,中学,大同市南郊区五一路,,山西省,大同市,南郊区,
天津市西青区辛口镇当城中学,普通,公办,中学,天津市西青区辛口镇当城村东,87990856,天津市,天津市,西青区,
宁波市鄞州区高桥镇中心校,普通,公办,中学,宁波市鄞州区高桥镇高峰村马浦,0574―88014280 88446703,浙江省,宁波市,鄞州区,
大同十一中,普通,私立,中学,府南街1号,5030797,山西省,大同市,南郊区,
玉溪一中,普通,公办,中学,云南省玉溪市红塔区,,云南省,玉溪市,红塔区,
无锡市安镇中学,普通,公办,中学,无锡市锡山区安镇镇中学路1号,0510-88785880,江苏省,无锡市,锡山区,
彭泽县天红中学,普通,公办,中学,江西省九江市彭泽县龙宫洞旁,5840215,江西省,九江市,彭泽县,
修水县第一中学（修水一中）,普通,公办,中学,江西省九江市修水县凤凰山路67号,,江西省,九江市,修水县,
上海市浦东教育学院实验中学,普通,公办,中学,上海市浦东区新浦路61号,021-61343227,上海市,上海市,浦东新区,
红安县八里湾镇第一初级中学,普通,公办,中学,湖北省 黄冈市 红安县 八里湾镇桥头,,湖北省,黄冈市,红安县,
红安县实验中学,普通,私立,中学,红安县城关镇北门岗东村62号,,湖北省,黄冈市,红安县,
上海市松江区佘山学校,普通,公办,中学,上海市松江区佘山镇桃源路325号,021-57658823,上海市,上海市,松江区,
蔡甸区第五高级中学,普通,公办,中学,蔡甸区蔡甸街汉马路77号,027-84942870,湖北省,武汉市,蔡甸区,
博罗县罗阳第一中学（罗阳一中）,普通,公办,中学,广东省惠州市博罗县罗阳镇东北路４号,6622564,广东省,惠州市,博罗县,
湖北浠水县第一中学（浠水一中）,普通,公办,中学,湖北省浠水县第一中学镇南城开发区百家街,,湖北省,黄冈市,浠水县,
上海交大南洋附属(昆山)学校,普通,公办,中学,江苏省昆山市陆家镇312国道侧,0512-57871858,江苏省,苏州市,昆山市,
济南第三十四中学,普通,公办,中学,山东省济南市历城区桑园路15号,0531-88962020,山东省,济南市,历城区,
丰城市丰矿第一中学（丰矿一中）,普通,公办,中学,江西省宜春市丰城市矿务局中心,,江西省,宜春市,丰城市,
揭阳市普宁市民德中学,普通,公办,中学,广东省揭阳市普宁市南径镇区东侧浮山南麓,0663-2567488,广东省,揭阳市,普宁市,
大名县第一中学（大名一中）,普通,公办,中学,河北省邯郸市大名县天雄路西段　电话：0310-6579002　,0310-6579002　,河北省,邯郸市,大名县,
徐悲鸿中学,普通,公办,中学,北京市宣武区永安路寿长街1号,010）63047408,北京市,北京市,西城区,
邢台市第二十中学（邢台市第一高级职业中学）,普通,公办,中学,河北省邢台市桥东区南羊市道,0319-3181656,河北省,邢台市,桥东区,
济南高新区实验学校,普通,公办,中学,济南高新区孙村街道办事处1002号,0531-88752588,山东省,济南市,历城区,
栾城县窦妪镇第一中学（窦妪镇一中）,普通,公办,中学,河北省石家庄市栾城县窦妪镇,0311-5462956,河北省,石家庄市,栾城县,
佛山顺德区龙江中学,普通,私立,中学,广东省佛山市顺德区龙江镇,,广东省,佛山市,顺德区,
新余五中（原长林子第学校）,普通,公办,中学,江西省新余市赣新西路45号,0790-6362717,江西省,新余市,,
伊川一高,普通,公办,中学,洛阳市伊川县八一路235号,0379-69511901,河南省,洛阳市,伊川县,
昆明三十中,普通,公办,中学,云南省昆明市五华区北门街108号,,云南省,昆明市,五华区,
武汉海淀外国语实验学校,普通,民办,中学,武汉市江夏区江夏大道58号（美院coast正对面）,027-81777828,湖北省,武汉市,江夏区,
天津市程林中学,普通,公办,中学,天津市东丽区北程林村北,022- 24710497,天津市,天津市,东丽区,
崂山实验初中,普通,公办,中学,山东省青岛市崂山区劲松八路117号,,山东省,青岛市,崂山区,
上海市肖塘中学,普通,公办,中学,上海市奉贤区肖塘南虹路115号,021-57434309,上海市,上海市,奉贤区,
成都市金花中学,普通,公办,中学,成都市武侯区金航路1号,028-66373800,四川省,成都市,武侯区,
宣化区第二中学,普通,公办,中学,河北省张家口市宣化县洋河南安平西街7号,0313-6087584,河北省,张家口市,宣化区,
石家庄市赵县石塔中学,普通,公办,中学,河北省石家庄市赵县石塔东路86号,0311-84948156,河北省,石家庄市,赵　县,
厦门南山实验学校,普通,公办,中学,福建省厦门市湖里区南山路青翔花园,,福建省,厦门市,湖里区,
武汉金银湖中学,普通,公办,中学,湖北省武汉市东西湖区马池北路1号,,湖北省,武汉市,东西湖区,
江科大附中,普通,公办,中学,镇江市学府路76号,84425960,江苏省,镇江市,京口区,
天津市武清区徐官屯乡初级中学,普通,公办,中学,天津市武清区徐官屯工贸大街徐官屯街工委对过,022- 29337626,天津市,天津市,武清区,
镇安中学,普通,公办,中学,陕西省镇安县后街40号,0914-5339618,陕西省,商洛市,镇安县,
萍乡矿务局第一中学（萍矿一中）,普通,公办,中学,安源区后埠街前村巷,0799-6216390,江西省,萍乡市,,
港上中心中学,普通,私立,中学,邳州市港上镇,0516-86450806,江苏省,徐州市,邳州市,
天津市宝坻区第五中学,普通,公办,中学,天津市宝坻区进京路31号,022-82622966,天津市,天津市,宝坻区,
宣化区第四中学,普通,公办,中学,河北省张家口市宣化区和平街30号,3033574,河北省,张家口市,宣化区,
萍乡市第七中学,普通,公办,中学,安源经济开放区光丰320国道旁,0799-6855949,江西省,萍乡市,,
乐安县第二中学,普通,公办,中学,江西省抚州市乐安县电话：0794-6572388,0794-6572388,江西省,抚州市,乐安县,
厦门外国语学校集美分校中学部,普通,公办,中学,厦门市集美区杏林街道西亭社区,,福建省,厦门市,集美区,
温州第十九中学,普通,公办,中学,温州市上陡门11组团南首,0577-88177777,浙江省,温州市,鹿城区,
广州增城区派潭镇第二中学（派潭二中）,普通,公办,中学,广东省广州市增城市派潭镇,020-82822321,广东省,广州市,增城区,
金川中学,普通,公办,中学,上海市浦东区利津路376号,021-58462360,上海市,上海市,浦东新区,
江阴市长山中学,普通,公办,中学,江阴经济开发区新城东办事处长山渡江路57号,0510-86191108,江苏省,无锡市,江阴市,
瓦屋头镇第二初级中学,普通,公办,中学,清丰县瓦屋头镇大街村南500米,0393-7762951 7766364,河南省,濮阳市,清丰县,
河源中学实验学校,普通,民办,中学,广东省河源市东环路北（大学城）,0762-3803223,广东省,河源市,,http://www.hzsyxx.cn
涉县西达镇关防中学,普通,私立,中学,邯郸市涉县关防村,0310-3766576,河北省,邯郸市,,
九江市第二中学（九江二中）,普通,公办,中学,江西省九江市浔阳区南湖路44号电话：0792-8551972,0792-8551972,江西省,九江市,浔阳区,
杭州市萧山第十一高级中学,普通,公办,中学,杭州市萧山区高桥南路889号,0571-82665253,浙江省,杭州市,萧山区,
南宁市秀灵学校（初中）,普通,公办,中学,广西壮族自治区南宁市西乡塘区明秀路北二巷,0771—3132485,广西,南宁市,西乡塘区,
洛龙区第二初级中学,普通,私立,中学,河南省洛阳市关林洛钢路,0379-65971002,河南省,洛阳市,洛龙区,
重庆彭水民族中学,普通,公办,中学,重庆市彭水苗族土家族自治县蟠龙路,023-78842723,重庆市,重庆市,彭水苗族土家族自治县,
梁平县礼让初级中学,普通,公办,中学,重庆市梁平县礼让镇川西村红星路35号,023 53572715,重庆市,重庆市,梁平县,
秦皇岛市第十五中学,普通,公办,中学,河北省秦皇岛市海港区西港路北段,0335-3076802,河北省,秦皇岛市,,
重庆龙水湖育才中学,普通,公办,中学,重庆市大足区龙水镇高坡5组,,重庆市,重庆市,大足区,
漳浦道周中学,普通,公办,中学,福建省漳州市漳浦县绥安镇,,福建省,漳州市,漳浦县,http://zpdz.30edu.com
惠安亮亮中学,普通,民办,中学,泉州市惠安县高铁连接线北侧,,福建省,泉州市,惠安县,
北京市顺义区赵全营中学,普通,公办,中学,北京市顺义区赵全营镇政府西北侧,010-60431128,北京市,北京市,顺义区,
青岛创新学校,普通,民办,中学,青岛市即墨区三环路即墨区第二职业中专,0532-85722857,山东省,青岛市,即墨区,
温岭中学,普通,公办,中学,浙江省台州市温岭市万泉东路1号,0576-86026999,浙江省,台州市,温岭市,
连山高级中学,普通,公办,中学,广东省清远市连山壮族瑶族自治县吉田镇古县坪,0763-8735220,广东省,清远市,连山壮族瑶族自治县,
石家庄市第二十一中学,普通,公办,中学,河北省石家庄市长安区胜利北街265号,0311-86851524 86824065,河北省,石家庄市,长安区,
张北县第一中学（张北一中）,普通,公办,中学,河北省张家口市张北县,0313-5222534,河北省,张家口市,张北县,
万载县阳乐中学,普通,公办,中学,万载县康乐镇阳乐大道63号,0795-8902122,江西省,宜春市,万载县,
大兴区朱庄中学,普通,公办,中学,北京市大兴区长子营镇朱庄村,010-80210450,北京市,北京市,大兴区,
陆河县河田中学,普通,公办,中学,广东省汕尾市陆河县,0660-5523745,广东省,汕尾市,陆河县,
诏安一中,普通,公办,中学,福建省漳州市诏安县,,福建省,漳州市,诏安县,
呼和浩特市土默特学校,普通,公办,中学,玉泉区文庙街1号,0471-6320021,内蒙古,呼和浩特市,玉泉区,
沈阳市铁西区春晖学校,普通,公办,中学,沈阳市铁西区富工四街11号,024-25754754,辽宁省,沈阳市,铁西区,
上海市浦江第三中学,普通,公办,中学,上海市闵行区闸航路2689号,64911029 64911033-806,上海市,上海市,闵行区,
双十中学漳州校区,普通,公办,中学,福建省漳州市龙海区滨湖路1号,,福建省,漳州市,龙海市,
广州市花都区花城初级中学,普通,公办,中学,广州市花都区花山镇花城圩花城大街1号,020-86955424,广东省,广州市,花都区,
郑州市二十六中学,普通,公办,中学,郑州市金水区红旗路28号,0371-63847764,河南省,郑州市,金水区,
焦作市第十二中学,普通,公办,中学,河南省焦作市山阳区焦东北路10号,0391--3682826,河南省,焦作市,山阳区,
苏州太湖国家旅游度假区香山中学,普通,公办,中学,苏州太湖国家旅游度假区梅舍路8号,0512-66382509,江苏省,苏州市,吴中区,
涿州市实验中学,普通,公办,中学,河北省保定市涿州市电话：0312-3623650,0312-3623650,河北省,保定市,涿州市,
吴江市桃源中学,普通,公办,中学,江苏省苏州市吴江市桃源镇桃源路,0512-63851463,江苏省,苏州市,吴江区,
常州有光实验学校,普通,民办,中学,常州市钟楼区岳杨路（邹区中心公园东侧约200米）,0519-86037003,江苏省,常州市,钟楼区,
上高中学,普通,公办,中学,江西省宜春市上高县沿江西路,,江西省,宜春市,上高县,
新理想高复学校,普通,公办,中学,艮山西路66-2号,0571 86855718,浙江省,杭州市,余杭区,
郑东新区实验学校,普通,公办,中学,郑州市管城回族区普惠路109号附近,,河南省,郑州市,郑东新区,
广州市增城区荔景中学,普通,公办,中学,增城市荔城街汽配城北7幢,020-82623392,广东省,广州市,增城区,
云大附属会展学校,普通,公办,中学,昆明市官渡区海田路龙湖听蓝半岛西南侧约50米,,云南省,昆明市,官渡区,
上海市求真中学,普通,公办,中学,上海市宝山区通河一村5号,021-56995122,上海市,上海市,宝山区,
佛山第六中学,普通,私立,中学,佛山市上沙中街9号,,广东省,佛山市,,
复旦实验中学,普通,公办,中学,上海市杨浦区安波路151号,021-65512410  65512411,上海市,上海市,杨浦区,
遂川二中,市重点,公办,中学,江西省吉安市遂川县泉江镇,,江西省,吉安市,遂川县,
厦门华兴实验学校,普通,民办,中学,福建省厦门市同安区凤南路888号南区,0592-7053333,福建省,厦门市,同安区,
西北农林科技大学附属中学,普通,公办,中学,陕西杨凌县城,029-87083158　,陕西省,西安市,未央区,
暨南大学附属实验学校,普通,民办,中学,广州市天河区黄埔大道西601号暨南大学校内,,广东省,广州市,天河区,
青岛市城阳区第十中学,普通,公办,中学,青岛市城阳区正阳东路58号,0532-87872844,山东省,青岛市,城阳区,
广宁第一中学（广宁一中）,普通,公办,中学,广东省肇庆市广宁县南街镇教育大道江布,8829250,广东省,肇庆市,广宁县,
西安高新逸翠园中学,普通,民办,中学,西安高新区唐延南路以东，锦业二路、三路之间交通辅道76号,029-81878793,陕西省,西安市,高新区,
武汉经开外国语学校,普通,民办,中学,武汉经济技术开发区万家湖路230号,（027）84736636,湖北省,武汉市,经开区,
江阴市桐岐中学,普通,公办,中学,江阴市桐岐镇桐前路13号,0510-86551208,江苏省,无锡市,江阴市,
台山市冲蒌中学,普通,公办,中学,广东省江门市台山市竹湖村委会龙头岭,0750-5234254,广东省,江门市,台山市,
广州市增城区派潭中学,普通,公办,中学,增城市派潭镇榕林路67号,020-82822200,广东省,广州市,增城区,
清远市华侨中学,普通,公办,中学,广东省清远市新城区,0763-3505015,广东省,清远市,,
济南高新区东城逸家初级中学,普通,公办,中学,济南市舜信路以西，龙奥北路以南，东城逸家小区内,0531-88988060,山东省,济南市,高新区,
台山市端芬中学,普通,公办,中学,广东省江门市台山市端芬镇育才路1号,0750-5356580,广东省,江门市,台山市,
萧山区回澜中学,普通,公办,中学,杭州市萧山区城厢街道文化路308号,0571-82721174,浙江省,杭州市,萧山区,
成都市龙泉驿区西河中学,普通,公办,中学,中国四川省成都市龙泉驿区广场路,028-84890945,四川省,成都市,龙泉驿区,
顺昌县元坑中学,普通,公办,中学,福建省南平市顺昌县,7583017,福建省,南平市,顺昌县,
从化市民乐中学,普通,公办,中学,广东省广州市从化市鳌头镇民乐墟,020-87871296,广东省,广州市,从化区,
修水县全丰镇中学,普通,公办,中学,江西省九江市修水县全丰镇塘城街中街,,江西省,九江市,修水县,
广州海印实验学校,普通,民办,中学,广州市越秀区回龙路6号,,广东省,广州市,越秀区,
新余市第九中学,普通,公办,中学,新余市劳动路立交桥桥北青年路东路口,0790-7022719,江西省,新余市,,
武夷山市第二中学（武夷山二中）,普通,公办,中学,福建省南平市武夷山市文化路1号,0599-5302280,福建省,南平市,武夷山市,
武汉第十九中学,普通,公办,中学,湖北省武汉市江汉区自治街244号,027-82834734,湖北省,武汉市,江汉区,
江门市会城都会初中,普通,公办,中学,会城都会村,0750-6166276,广东省,江门市,新会区,
枣庄市龙子心中学,普通,公办,中学,山东省枣庄市市中区永安乡政府驻地,0632-3755159,山东省,枣庄市,市中区,
郑州三十七中,普通,公办,中学,郑州高新技术产业开发区宏兴街中段,,河南省,郑州市,高新区,
复旦附中青浦分校,普通,公办,中学,上海市青浦区盘龙浦路500号,021-51855500,上海市,上海市,青浦区,
广州花都区智海学校,普通,民办,中学,广州市花都区赤坭镇沿江路16号,020-86841369,广东省,广州市,花都区,
黄冈体育中学,普通,私立,中学,湖北省黄冈市黄州区七一路1号,,湖北省,黄冈市,黄州区,
佛山市顺德区启智学校,普通,公办,中学,广东省佛山市顺德区 大良甲子桥侧,,广东省,佛山市,顺德区,
重庆师范大学附属中学,普通,公办,中学,重庆市沙坪坝区至德路10号,023-65912333,重庆市,重庆市,沙坪坝区,
上海大团镇初级中学,普通,公办,中学,大团镇永定南路304弄20号,021-58081005,上海市,上海市,浦东新区,
乐清虹桥镇第七中学,普通,私立,中学,浙江省温州市乐清市虹桥镇瑶南村,,浙江省,温州市,乐清市,
天津市西影演艺高级中学,普通,公办,中学,天津市南开区旧津保路2号,022-27362049,天津市,天津市,南开区,
贵溪市四中,普通,公办,中学,贵溪市西街沙井头,0701-3771514,江西省,鹰潭市,贵溪市,
福清东张中学,普通,公办,中学,福清,电&nbsp;&nbsp;&nbsp;&nbsp;&nbsp;&nbsp;&nbsp;&nbsp;话,福建省,福州市,福清市,http://www.fqdzzx.com
昆山柏庐高级中学,普通,公办,中学,江苏省昆山市西塘街26号,0512-36921000,江苏省,苏州市,昆山市,
南昌市第十八中学,普通,公办,中学,江西省南昌市西湖区东书院街8号,0791-6224956,江西省,南昌市,西湖区,
高东中学,普通,公办,中学,上海市浦东区光明路476号,021-58480820 58480918,上海市,上海市,浦东新区,
深中南山创新学校,普通,公办,中学,广东省深圳市南山区打石一路221号,0755-26656272,广东省,深圳市,南山区,
枣庄市张范一中,普通,公办,中学,山东省枣庄市薛城区张范镇,0632-4617618,山东省,枣庄市,薛城区,
邢台市第十中学,普通,公办,中学,河北省邢台市南园街18号,（0319）3178044,河北省,邢台市,,
阳西县第一中学（阳西一中）,普通,公办,中学,广东省阳江市阳西县城宋康路200号,,广东省,阳江市,阳西区,
莆田砺成中学,普通,民办,中学,福建省莆田市城厢区荔城北大道1399号,,福建省,莆田市,城厢区,
南京市第二十九中学天润城分校,普通,公办,中学,南京市天润城第十四街区,,江苏省,南京市,浦口区,
杭州市长河中学,普通,公办,中学,杭州市时代大道高架与滨文路十字,（0571）86624011,浙江省,杭州市,滨江区,
浙江东阳中学,普通,公办,中学,浙江省金华市东阳市学士北路1号,0579-86660006,浙江省,金华市,东阳市,
东莞市粤华学校,普通,民办,中学,东莞市同沙社区粤华路1号,0769-22201688,广东省,东莞市,,
石家庄市第八十一中学,普通,公办,中学,河北省石家庄市育才街25号,（0311）86698677  86698663,河北省,石家庄市,长安区,
潍坊文昌中学,普通,民办,中学,潍坊市寒亭区亚星路3831号,0536-7266999,山东省,潍坊市,寒亭区,
广州市新穗学校,普通,公办,中学,广州市海珠区石榴岗15号,020-34046617,广东省,广州市,海珠区,
唐山第二十中学,普通,私立,中学,唐山市马各庄,0315-32641545,河北省,唐山市,开平区,
郑州五十八中,普通,公办,中学,郑州高新技术产业开发区科学大道与西四环交会处向北400米路西,0371-67833225,河南省,郑州市,高新区,
什邡中学,普通,私立,中学,四川省什邡市雍城东路93号,0838-8202661,四川省,德阳市,什邡市,
重庆两江云创初级中学,普通,公办,中学,两江新区翠云街道中央公园,,重庆市,重庆市,两江新区,
广州市天河区南国学校 （中学部）,普通,公办,中学,广州市天河区平月路202,020）38298215,广东省,广州市,天河区,
华渝实验学校,普通,公办,中学,重庆市江北区盘溪五支路26号,023-67660706,重庆市,重庆市,江北区,
天津市武清区南蔡村中学,普通,公办,中学,天津市武清区南蔡村镇南蔡村,022-29411637,天津市,天津市,武清区,
平和县国强三五初级中学,普通,公办,中学,福建省漳州市和县国强乡三五村,0596-5358516,福建省,漳州市,平和县,
上海市清华中学,普通,公办,中学,上海市茂名南路144号,021-64737329,上海市,上海市,黄浦区,
珠海市田家炳中学,普通,公办,中学,广东省珠海市斗门区白蕉路2863号,5507157,广东省,珠海市,斗门区,
揭东县实验中学,普通,私立,中学,广东省揭阳市揭东县城城西二路尾,0663-3274198,广东省,揭阳市,揭东县,
中山市小榄花城中学,普通,公办,中学,小榄镇永华路,0760-22282807,广东省,中山市,,
北京亦庄实验中学（十一亦庄）,普通,公办,中学,北京市大兴区博兴十路与泰河三街交汇处,010-53582380,北京市,北京市,大兴区,
安徵合肥市第四十七中学,普通,公办,中学,五河路227号,0551-5536606,安徽省,合肥市,,
