学校名称,属性,性质,类型,学校地址,联系电话,省级位置,地级位置,县级位置,官网
常州国际学校,普通,民办,中学,,,江苏省,常州市,,
黄陂区第五中学,普通,公办,中学,黄陂区滠口街崇文里1号,02761867148,湖北省,武汉市,江岸区,
沈阳市康平县张强中心校,普通,公办,中学,康平县张强镇张强村,024-87240164,辽宁省,沈阳市,康平县,
郑州市第三中学,普通,公办,中学,管城区西大街233号,0371-2547845,河南省,,,
长沙市宁乡县道林镇龙塘学校,普通,公办,中学,道林镇龙塘村,0731-7785617,湖南省,长沙市,长沙县,
上海市张江中学,普通,公办,中学,张江镇田园路88号,021-58555462,上海市,,,
八里湾镇第一初级中学,普通,公办,中学,开封县八里湾镇南一公里,0378—9655067,河南省,开封市,开封县,
安徽省合肥市第二十四中学,普通,公办,中学,郊区大兴镇兴集二十四中,0551-4532375,安徽省,合肥市,,
上海市徐汇中学西校区,普通,公办,中学,上海市徐汇区番禺路1138号,021-64476871,上海市,上海市,徐汇区,
宁海县一市中学,普通,公办,中学,浙江省宁海县一市镇一市村,0574-65365081,浙江省,宁波市,宁海县,
北京市第一四零中学,普通,公办,中学,北京市西城区大川淀24号,010-63522635-8029,北京市,北京市,西城区,
郑州市第八中学,普通,公办,中学,,,河南省,郑州市,,
枣庄市第三十三中学,区重点,公办,中学,山东省枣庄市山亭区水泉镇驻地,（0632）8761139,山东省,枣庄市,山亭区,
天津市第七十一中学,普通,公办,中学,天津市红桥区营门西马路107号,,天津市,天津市,南开区,
深圳市深南中学,普通,公办,中学,广东省深圳市福田区香蜜湖街道办事处,0755-837013426,广东省,深圳市,福田区,
顺义区大孙各庄中学,普通,公办,中学,北京市顺义区大孙各庄镇府前东街8号,,北京市,北京市,顺义区,
三水中学,普通,公办,中学,广东省佛山市三水区,,广东省,佛山市,三水区,
张家口市尚义县八道沟中学,普通,公办,中学,河北省张家口市尚义县坝上地区电话：03134522033,03134522033,河北省,张家口市,尚义县,
乳山市夏村镇石头圈区小,普通,私立,中学,乳山市夏村镇石头圈村西,,山东省,威海市,乳山市,
长沙市浏阳市枨冲镇枨冲初级中学,普通,公办,中学,浏阳市枨冲镇橙冲社区新华路,0731-3729651,湖南省,长沙市,浏阳市,
石笋中学,普通,公办,中学,上海市浦东区新场镇奉新路153号,58171260 58170002 58172308,上海市,上海市,浦东新区,
沈阳市康平县北四家子中心校,普通,公办,中学,康平县北四家子乡,024-87350107,辽宁省,沈阳市,康平县,
莱西市店埠镇后寨中学,普通,公办,中学,青岛市莱西市莱西市店埠镇后寨村,0532-82489317,山东省,青岛市,莱西市,
长沙市第二十二中学,普通,公办,中学,湖南省长沙市天心区芙容南路253,0731-- 8521 5267,湖南省,长沙市,天心区,
开封高中,普通,公办,中学,河南省开封铁路北沿街223号,0378-5951776  邮编：475003 传真：0378-5978155 地址：河南省开封铁路,河南省,开封市,,
温州泰顺新浦中学,普通,私立,中学,浙江省泰顺县新浦乡,,浙江省,温州市,泰顺县,
唐山市南堡区第二中学（南堡二中）,区重点,公办,中学,河北省唐山市南堡滨海镇,0315-8509805,河北省,唐山市,,
宁波第十一中学,普通,公办,中学,浙江省宁波市海曙区云石街２９号,0574-87295358,浙江省,宁波市,海曙区,
徐州市三十四中学,普通,私立,中学,徐州市中山南路142号,,江苏省,徐州市,云龙区,
沈阳市大潘中心校,普通,公办,中学,沈阳市于洪区大潘镇大潘村,024-89892242,辽宁省,沈阳市,于洪区,
大田谢洋初级中学,普通,公办,中学,福建省三明市大田谢洋文兴路14号,0598-7338158,福建省,三明市,大田县,
牟平区高陵镇第二初级中学,区重点,公办,中学,山东省牟平区高陵镇院格庄村,0535-4551021,山东省,烟台市,牟平区,
烟台清泉学校,普通,公办,中学,莱山区清泉路79号,0535-6705641,山东省,烟台市,,
温州桥头镇朱涂中学,普通,公办,中学,温州市永嘉县朱中街20号,,浙江省,温州市,永嘉县,
杭州国际学校,普通,民办,中学,杭州市东信大道78号,（0571）86690045,浙江省,杭州市,,
上海市第六十七中学,普通,公办,中学,贵州路189号,021-63221831,上海市,上海市,黄浦区,
邯郸县第三中学,县重点,公办,中学,河北省邯郸市邯郸县户村镇户村,0310-4166210,河北省,邯郸市,,
承德县双峰寺东坎中学,普通,私立,中学,河北省 承德市 承德县 双峰寺镇东坎村,0314-3048179,河北省,承德市,承德县,
淄博市沂源县悦庄第二中学（悦庄二中）,县重点,公办,中学,山东省淄博市沂源县悦庄镇政府驻地,0533-3449005,山东省,淄博市,沂源县,
深圳盐田元平特殊教育学校,区重点,公办,中学,深圳市龙岗区布吉西环路 138 号,0755-89468000  0755-89468807,广东省,深圳市,龙岗区,
温州市乐清商校,普通,民办,中学,浙江省乐清市湖上岙中阳北路42弄12号,,浙江省,温州市,乐清市,
合肥市第二十中学,普通,公办,中学,望江西路野生动物园南,0551-5320720,安徽省,合肥市,蜀山区,
沈阳市康平县方家中心校,普通,公办,中学,沈阳市康平县方家镇镇西村,024-87200026,辽宁省,沈阳市,康平县,
湘东中学,普通,公办,中学,湘东区湘东老街（湘东区人民政府驻地西侧）,0799-3449624,江西省,萍乡市,,
北京市第二一四中学,普通,公办,中学,北京市西城区月坛北街18号&#8206;,010-68522558,北京市,北京市,西城区,
深圳福田石厦中学,普通,公办,中学,深圳市福田区福民路96号,0755-83810617,广东省,深圳市,福田区,
北京161中学（北校区）,区重点,公办,中学,北京市西城区北长街113号,010-66025591,北京市,北京市,西城区,
龙口市南关中学,区重点,公办,中学,山东省烟台市龙口市东莱街266号,0535-8517467,山东省,烟台市,龙口市,
上海真如中学,普通,公办,中学,上海市铜川路1189号,021-62655984,上海市,上海市,普陀区,www.hszr.pte.sh.c...
深圳市竹林中学,区重点,公办,中学,深圳市福田区竹林三路,0755-83159930,广东省,深圳市,福田区,
进才实验中学,普通,公办,中学,上海市浦东区金松路191号,021-68545988,上海市,上海市,浦东新区,
淄博市博山区第九中学,普通,公办,中学,山东省淄博市博山区城东街道办事处后峪社区顺河街262号,0533-4201339,山东省,淄博市,博山区,
东营区史口镇中学,区重点,公办,中学,山东省东营市东营区史口镇府林路8号,0546-8281005,山东省,东营市,东营区,
北京市私立正则中学,普通,私立,中学,金盏乡楼梓庄东高路中段,010-84318444,北京市,北京市,朝阳区,
梅河口市第四中学,普通,公办,中学,梅河口市第四中学,0435-4715327,吉林省,通化市,梅河口市,
诸城二中,区重点,公办,中学,山东省潍坊市相州镇相三路18号,0536-2168001,山东省,潍坊市,诸城市,
文登市侯家中学,普通,私立,中学,温州侯家镇驻地,,山东省,威海市,文登市,
天津市天慈中学,普通,私立,中学,天津市河北区电话：（022）26361706,（022）26361706,天津市,天津市,河北区,
昌河中学,普通,公办,中学,市区东郊昌河教育园区,0798-8462512,江西省,景德镇市,,
深圳市宝安区新湖中学,普通,公办,中学,广东省深圳市宝安区中心区N16区玉林路,,广东省,深圳市,宝安区,
北京市温榆河双语实验学校,普通,公办,中学,京市朝阳区和平里南口砖角楼5号,010-64354193,北京市,北京市,朝阳区,
安徽合肥市第二十六中学,普通,公办,中学,亳州路280号,0551-5526669 王克扬,安徽省,合肥市,,
长沙市望城县星城镇黄田学校,普通,公办,中学,望城县星城镇黄田村,0731-13707496805,湖南省,长沙市,望城区,
上海市玉华中学,普通,公办,中学,上海市普陀区交通路4276号,021-52842495 021-52842482,上海市,上海市,普陀区,
湖北省黄石市第四中学,普通,公办,中学,西塞山区黄石大道218号,0714-6453156,湖北省,黄石市,,
赣县储潭中学,普通,公办,中学,江西省赣州市赣县赣江之畔,,江西省,赣州市,,
韶关市新丰县黄磜中学,普通,公办,中学,广东省韶关市新丰县,,广东省,韶关市,新丰县,
北京市顺义区大孙各庄中学,普通,公办,中学,北京市顺义区大孙各庄镇府前东街8号,010-61432045,北京市,北京市,顺义区,
西安市七十三中学,普通,公办,中学,尚爱路81号,029 87428846,陕西省,西安市,莲湖区,
安徽省凤台县武集初级中学,普通,公办,中学,大兴乡武集,0554-8569017 武保康,安徽省,淮南市,,
新竹县仰德高级中学,普通,公办,中学,新竹縣新豐鄉員山村133號,886-(03)5592158地址：新竹縣新豐鄉員山村133號,台湾省,,,
深圳南山中加学校,普通,民办,中学,深圳市南山区南光路166号,0755-26568886 0755-26568889,广东省,深圳市,南山区,
安徽省凤台县张集中学,普通,公办,中学,岳张集镇,0554-8111313 付学森,安徽省,淮南市,,
景德镇第十五中学,区重点,公办,中学,黎明路6号,0798-8331342,江西省,景德镇市,,
广州市萝岗区萝岗中学,区重点,公办,中学,广东省广州市白云区萝岗镇萝岗区萝平路69电话：020-82267408,020-82267408,广东省,广州市,黄埔区,
苏州工业园区二中,普通,公办,中学,苏州工业园区唯亭镇金埂路1号,0512-65078656 65072531,江苏省,苏州市,平江区,
山东省日照市五莲县户部初中,普通,公办,中学,山东省日照市五莲县户部乡驻地,0633-5401011,山东省,日照市,,
安合肥市第四十二中学,普通,公办,中学,长江西路76号,0551-2657992,安徽省,合肥市,,
南平市第五中学,普通,公办,中学,福建省南平市梅山岭电话:0599-8865056,,福建省,南平市,,
江苏省常州市金坛市薛埠中学,普通,私立,中学,常州市金坛市,,江苏省,常州市,,
北京市顺义区李各庄学校,普通,公办,中学,北京市顺义区木林镇李各庄村西,010-60492697,北京市,北京市,顺义区,
北京市顺义区俸伯中学,普通,公办,中学,北京市顺义区南彩镇政府东200米路南,010-89477257,北京市,北京市,顺义区,
宁波市鄞州区高桥镇望春初级中学,普通,公办,中学,宁波市鄞州区高桥镇宋家漕村,0574-88012752,浙江省,宁波市,鄞州区,
唐山市汇英中学,普通,民办,中学,河北省唐山市路北区机场路7号,0315-2016429,河北省,唐山市,路北区,
辽中县乌伯牛九年一贯制学校,普通,公办,中学,蒲水之滨、辽沈公路北侧,024-87862271,辽宁省,沈阳市,辽中县,
北京市第一五四中学,普通,公办,中学,北京市西城区百万庄南街14号,010-68320823,北京市,北京市,西城区,
上海徐汇教院附中,普通,公办,中学,徐汇区上中路50号,,上海市,上海市,徐汇区,
新晖中学,普通,公办,中学,上海市卢湾区瑞金南路385号,021-63034053,上海市,上海市,黄浦区,
东莞市常平京九学校,普通,民办,中学,东莞市常平镇麦元村,0769-0769-837581,广东省,东莞市,,
新民市罗家房学校,普通,公办,中学,新民市罗家房乡,024-87480328,辽宁省,沈阳市,新民市,
上海美国学校,普通,民办,中学,上海市黄埔区诸翟镇金丰路258号,021-62211445,上海市,上海市,黄浦区,
金汇高级中学,普通,公办,中学,上海市闵行区紫藤路125弄58号,021-34313471 34313475,上海市,上海市,闵行区,
大通中学,普通,公办,中学,上海市静安区大田路351号,,上海市,上海市,静安区,
饶平县联饶中学,普通,公办,中学,广东省潮州市饶平县联饶镇政光路35号电话：0768-8391065,0768-8391065,广东省,潮州市,饶平县,
韶关市翁源县连新中学,县重点,公办,中学,广东韶关市翁源县,0751-2681880,广东省,韶关市,翁源县,
贵州经贸学校,普通,公办,中学,贵阳市都拉营汇通大道教育路1号,0851-5667343,贵州省,贵阳市,,
北京新亚学校小学部,普通,民办,中学,十八里店886号,010-67473875,北京市,北京市,朝阳区,
韶关市乳源县红云中学,普通,公办,中学,广东省乳源瑶族自治县红云镇,0751-5210206,广东省,韶关市,,
漳州一中分校,普通,公办,中学,,,福建省,漳州市,,
北京市劲松第三中学,普通,公办,中学,北京市朝阳区劲松四区406楼,010-87715742,北京市,北京市,朝阳区,
威海经技区皇冠中学,普通,公办,中学,威海经区渤海路12号,,山东省,威海市,,
上海市闸北第五中学,普通,公办,中学,虬江路723号,021-66600428,上海市,上海市,静安区,
上海市闸北教育学院实验中学,普通,公办,中学,上海市闸北区共和路710弄32号,021-56972244,上海市,上海市,静安区,
上海市闸北第二中学（闸北二中）,普通,公办,中学,天目中路100号,021-88888888,上海市,上海市,静安区,
怀集县塘岗中学,普通,公办,中学,广东省肇庆市怀集县马宁镇塘岗村,0758-5723376,广东省,肇庆市,怀集县,
长沙市第二十中学,区重点,公办,中学,湖南省长沙市岳麓区岳麓大道45号,0731-88800910,湖南省,长沙市,岳麓区,
嵊州市甘霖镇博济中学,普通,公办,中学,绍兴市嵊州市甘霖镇博济片西,,浙江省,绍兴市,嵊州市,
江苏省徐州财经高等职业技术学校,普通,私立,中学,ww.xzcx.net.cn,,江苏省,徐州市,云龙区,
上海市华东模范中学初中部,普通,公办,中学,上海市静安区富民路50号,021-62471181,上海市,上海市,静安区,
温州临江中学,普通,私立,中学,温州市鹿城区临江西街28号,,浙江省,温州市,鹿城区,
北京市同仁中学,普通,公办,中学,北京市朝阳区甘露园南里10号,010-85771449,北京市,北京市,朝阳区,
安徽省铁四局三处淮南中学,普通,公办,中学,田家庵区泉山西路(淮中),0554-6412743 方春,安徽省,淮南市,,
蔡公庄镇惠丰学校,普通,公办,中学,天津市静海县蔡公庄镇惠丰中村,022-68519144,天津市,天津市,静海区,
上海市宛平中学,区重点,公办,中学,上海市徐汇区宛南六村46号,021-64387948,上海市,上海市,徐汇区,
上海市汇知学校,普通,公办,中学,上海市徐汇区漕东支路115号,021-64087110 021-64758075,上海市,上海市,徐汇区,
乳山市大孤山镇初级中学,普通,私立,中学,乳山市大孤山镇驻地,,山东省,威海市,乳山市,
江门市新会体育学校（中学部）,普通,公办,中学,广东省江门市新会区,0750-3270848,广东省,江门市,新会区,
宜兴市张泽中学,普通,公办,中学,江苏省无锡市宜兴市丁蜀镇,0510-87445060,江苏省,无锡市,宜兴市,
上海永兴高级中学,普通,公办,中学,鲁班路407弄2号,021-63043730,上海市,上海市,黄浦区,
东莞望牛墩文英学校,普通,民办,中学,东莞市望牛墩下漕管理区,0769—86568718,广东省,东莞市,,
上海宜川中学,普通,公办,中学,上海市普陀区华阴路101号,021-56091823 黄敏华,上海市,上海市,普陀区,
北京市东方培新学校,普通,公办,中学,北京市朝阳区朝外大街慈云里1号,010-65066786,北京市,北京市,朝阳区,
北京大峪中学,普通,公办,中学,北京市门头沟区滨河德露苑18号,010-61864113,北京市,北京市,门头沟区,
上海市振华外经职业技术学校(商城路校区),普通,公办,中学,上海市浦东区商城路1088号,021-68753499 50819488,上海市,上海市,浦东新区,
深圳市城市绿洲学校,区重点,民办,中学,深圳市深南中路4030,0755- 82861164,广东省,深圳市,罗湖区,
东莞市莞城业余体育学校,普通,公办,中学,步步高住宅区竹苑25座1号,0769-22506795,广东省,东莞市,莞城区,
湖北省宜昌市第九中学,普通,公办,中学,西陵区西坝路34号,0717-6271796,湖北省,宜昌市,西陵区,
佛山市禅城区第九小学,,公办,中学,卫国路9号,0757-3393144,广东省,佛山市,,
崇明县三乐中学,普通,公办,中学,上海市崇明县合作镇猛将庙,021-59382089,上海市,,崇明区,http://61.172.177.225
广东省湛江市遂溪县第四中学,普通,公办,中学,广东省遂溪县遂城遂海路190号,020-38913288,广东省,湛江市,遂溪县,
北京市第一一五中学,普通,公办,中学,北京市崇文区天坛东路13号,010-67011604,北京市,北京市,东城区,
湖北省当阳市第三中学,普通,公办,中学,当阳市玉阳长坂路224号,0717-3222274,湖北省,宜昌市,宜都市,
成都市百花潭中学,普通,公办,中学,成都 青羊区 锦绣桥滨河路附近,,四川省,成都市,青羊区,
潮州市职业技术学校,普通,公办,中学,广东省潮州市湘桥区中山路,0768-2256167,广东省,潮州市,,
广州市黄埔区文冲中学,普通,公办,中学,黄埔区广东省石化一街120号,020-82389690,广东省,广州市,黄埔区,
无锡市宜兴市屺亭中学,区重点,公办,中学,江苏省无锡市宜兴市屺亭街道,0510-87861029,江苏省,无锡市,宜兴市,
凯文学校,普通,私立,中学,凯里市环城东路501号,0855-8503126,贵州省,,,
青州第八中学,区重点,公办,中学,山东省潍坊市青州市驼山南路4398号,0536-3221704,山东省,潍坊市,青州市,
安徽省淮南第三中学,普通,公办,中学,田家庵区公园路(三中),0554-3625273 张学江,安徽省,淮南市,,
北京二十五中,普通,公办,中学,北京市东城区灯市口大街55号,010-85775750,北京市,北京市,东城区,
上海市北郊高级中学,普通,公办,中学,上海市虹口区大连西路250号、曲阳路497号,021-65222018,上海市,上海市,虹口区,http://www.beijiaoedu.com
长沙市望城县雷锋镇推山学校,普通,公办,中学,望城县雷锋镇牌楼坝村,0731- 7300555,湖南省,长沙市,望城区,
上海市梅川中学,普通,公办,中学,上海市普陀区中江路1280号,021-62650633 62650644,上海市,上海市,普陀区,
长沙市宁乡县双凫铺镇双凫初级中学,普通,公办,中学,宁乡县双凫铺镇合轩村,0731-7490252,湖南省,长沙市,宁乡县,
新余市第十中学,普通,公办,中学,江西省新余市团结西路电话：0790-6293998,0790-6293998,江西省,新余市,,
南海区罗村高级中学,普通,公办,中学,广东省佛山市南海区罗村街道中心城区,,广东省,佛山市,南海区,
闵行区梅陇中学,普通,公办,中学,上海市闵行区梅陇镇镇西路299号,021-64102427 021-54291508,上海市,上海市,闵行区,
湄洲二中,普通,公办,中学,,,福建省,莆田市,,
厦门市槟榔中学,市重点,公办,中学,福建省厦门市槟榔西里199号,0592-5055489,福建省,厦门市,思明区,
紫阳中学,普通,公办,中学,上海市徐汇区龙吴路2621号,54823030 54822020,上海市,上海市,徐汇区,
延河中学,普通,公办,中学,上海市普陀区新村路99号,021-56072622 56611483,上海市,上海市,普陀区,
清河县城关中学,普通,公办,中学,河北省邢台市清河县邢清公路北侧电话：0319-8050013,0319-8050013 　,河北省,邢台市,清河县,
枣庄市兰城中学,普通,公办,中学,山东省枣庄市台儿庄区泥沟镇兰城村,0632-6562286,山东省,枣庄市,台儿庄区,
中山市四沙中学,普通,公办,中学,横栏镇四沙裕祥村,0760-87766518,广东省,中山市,,
北京市第三十三中学,普通,公办,中学,北京市西城区复兴门外大街乙20号,010-63464129,北京市,北京市,西城区,
深圳南山北师大南山附中,普通,公办,中学,深圳市南山区后海大道蔚蓝海岸小区内,0755-26061864,广东省,深圳市,南山区,
徐水县综合高级中学,普通,公办,中学,河北省保定市徐水县,0312-8670067,上海市,,,
梁山县黑虎庙乡初级中学,普通,私立,中学,山东省梁山县黑虎庙商业街5号,,山东省,济宁市,,
曲阜市王庄乡中学,普通,私立,中学,济宁曲阜市王庄乡中王村,,山东省,济宁市,,
北京市龙潭中学,区重点,公办,中学,北京市东城区板厂南里3号,010-67148924,北京市,北京市,东城区,
铜鼓中学,普通,公办,中学,江西省宜春市铜鼓县县城定江西路41号,0795-8722315,江西省,宜春市,铜鼓县,
邯郸市第八中学,普通,公办,中学,河北省邯郸市陵园路173号,,河北省,邯郸市,,
潍坊市寒亭区双杨店镇中心初级中学,普通,私立,中学,潍坊双杨店镇庞家村,,山东省,潍坊市,,
河口区六合中学,区重点,公办,中学,山东省东营市河口区六合乡政府驻地,0546-3381259,山东省,东营市,河口区,
紫金县育新中学,普通,公办,中学,广东省河源市紫金县新市区朝阳街1号,0762-3386208,广东省,河源市,紫金县,
新民市胡台镇初级中学,普通,公办,中学,新民市胡台镇,024-87723518,辽宁省,沈阳市,新民市,
顺昌县岚下中学,普通,公办,中学,福建省南平市顺昌县,,福建省,南平市,顺昌县,
清流中学历城校区,普通,公办,中学,上海市浦东区历城路10号,021-58836815,上海市,上海市,浦东新区,
上海市辛灵中学,普通,公办,中学,上海市杨浦区海州路268号,021-65690462,上海市,上海市,杨浦区,
汕头市汕樟中学,区重点,公办,中学,汕樟路81号,0754-8625452,广东省,汕头市,,
长沙市浏阳河中学,普通,公办,中学,湖南省浏阳市翠园路 　,0731---3673201,湖南省,长沙市,宁乡县,
光泽县华桥中学,普通,公办,中学,福建省南平市光泽县华桥乡文明街28号　电话：0599－7791997,0599－7791997,福建省,南平市,光泽县,
张家港市妙桥中学,普通,公办,中学,江苏省张家港市妙桥镇妙桥街,0512-58460240,江苏省,苏州市,张家港市,
福田区上沙中学,普通,公办,中学,广东省深圳市福田区福荣路52号,0755-82551575,广东省,深圳市,福田区,
西安市第九十一中学,普通,公办,中学,西安市东梆子市街3号,（029）87625970,陕西省,西安市,莲湖区,
嘉祥县第一中学（嘉祥一中）,县重点,公办,中学,嘉祥县城文化路1号,,山东省,济宁市,,
长春市十六中学,区重点,公办,中学,吉林省长春市南关区,0431-84845354,吉林省,长春市,南关区,
上海市天马山中学,普通,公办,中学,上海市松江区天马山镇花园弄5号,021-57661135 董禹田,上海市,上海市,松江区,
枣庄市育才中学（高中部）,区重点,公办,中学,山东省枣庄市山亭区育才路,（0632）8821596,山东省,枣庄市,山亭区,
青岛第二十二中学,普通,公办,中学,青岛市李沧区四流中路113号,0532-84632434,山东省,青岛市,李沧区,
北京市体育场路中学,普通,公办,中学,北京市朝阳区工体南路1号,010-65525113,北京市,北京市,朝阳区,
上海市杨浦区教育学院附属学校,普通,公办,中学,上海市杨浦区靖宇南路11号,021-65433283 021-65709692,上海市,上海市,杨浦区,
安徽省凤台县刘集中学,普通,公办,中学,刘集乡,0554-8981844 胡宗磊,安徽省,淮南市,,
江门市沙堆镇梅阁学校（中学部）,区重点,公办,中学,沙堆镇梅阁村,0750-6231033,广东省,江门市,新会区,
上海虹口区教育学院实验中学,普通,公办,中学,上海市虹口区四川北路1838号,021-56662772,上海市,上海市,虹口区,
广州市中山大学附属中学,普通,私立,中学,广东省广州市海珠区新港西路135号？,020-84037714 020-84111628 020-84111622 020-8411302,广东省,广州市,海珠区,
重庆一中,普通,公办,中学,重庆市沙坪坝区沙南街2号,023-65303495  65307121,重庆市,重庆市,沙坪坝区,
重庆市北碚区实验中学（龙溪路）,区重点,公办,中学,重庆市北碚区望月村43号,023-68282044,重庆市,重庆市,北碚区,
荣成市第九中学,普通,公办,中学,石岛区宁津镇驻地,0631 7341027,山东省,威海市,荣成市,
东格致中学,普通,公办,中学,上海市浦东区浦东南路1548号,58208793,上海市,上海市,浦东新区,
从化市流溪河林场学校,普通,公办,中学,广东省广州市从化市流溪河林场黄竹塱电话：（020）87843575,（020）87843575,广东省,广州市,从化区,
深圳宝安区海滨中学,普通,公办,中学,广东省深圳市宝安41区兴华一路106号,,广东省,深圳市,宝安区,
上海头桥中学,普通,公办,中学,上海市奉贤区奉城镇头桥社区振兴路18号,021-57551281,上海市,上海市,奉贤区,
兴屏中学,普通,私立,中学,,,福建省,宁德市,屏南县,
怀来县沙城第三中学,,公办,中学,河北省张家口市怀来县,,上海市,,,
北京中加学校,普通,民办,中学,北京市通州区丛林庄园,010-89591234,北京市,北京市,通州区,
北京市丰盛中学,普通,公办,中学,丰盛胡同69号,010-66171365,北京市,北京市,东城区,
六灶中学,普通,公办,中学,上海市浦东区六灶镇鹿溪路43号,58162965,上海市,上海市,浦东新区,
上海市王港中学,区重点,公办,中学,上海市浦东区龙东大道5237号,021-58582384,上海市,上海市,浦东新区,
乳山市崖子镇初级中学,普通,私立,中学,乳山市崖子镇崖子村,,山东省,威海市,乳山市,
上海市怒江中学,普通,公办,中学,上海市普陀区金沙江路200号,021-62605619,上海市,上海市,普陀区,
宜兴市升溪中学（实验中学北校区）,普通,公办,中学,无锡市宜兴区宜城街道,0510-87988778,江苏省,无锡市,宜兴市,
威海经技区西苑学校,普通,公办,中学,威海经技区徐家疃村东,,山东省,威海市,,
上海长宁国际学校（浦东中学部）,区重点,民办,中学,上海市浦东新区康桥横桥路198号,021-58129888,上海市,上海市,浦东新区,
