学校名称,属性,性质,类型,学校地址,联系电话,省级位置,地级位置,县级位置,官网
中国人民大学附属中学,全国重点,公办,中学,北京市海淀区中关村大街37号,010-62512094  62515003,北京市,北京市,海淀区,http://www.rdfz.cn
河北衡水中学,全国重点,公办,中学,河北省衡水市英才路228号/南门口街128号  （东校区）程富路6号  　,0318-2126903,河北省,衡水市,桃城区,http://www.hbhz.net
上海中学,全国重点,公办,中学,上海市百色路989号（南大门：上中路400号）,021-64100430 64554819,上海市,上海市,闵行区,http://www.shs.sh.cn
北京第四中学,市重点,公办,中学,京市西城区西黄城根北街甲2号（近北大医院）,010-66175566,北京市,北京市,西城区,http://mysz.miyunedu.net
长沙市长郡中学,省重点,公办,中学,长沙市黄兴南路309号,0731-5815387  邮编：410002　地址：长沙市黄兴南路309号,湖南省,长沙市,,
华中师范大学第一附属中学,全国重点,公办,中学,湖北省武汉市东湖高新技术开发区汤逊湖北路特1号,027—87920883,湖北省,武汉市,东西湖区,http://www.hzsdyfz.com.cn/
华中师范大学第二附属中学,,,,卓刀泉路２８１号,(027)87803709,湖北省武汉市,武汉市,,
北京师范大学附属实验中学,市重点,公办,中学,北京市西城区二龙路甲14号,010-66036431,北京市,北京市,西城区,https://www.sdsz.com.cn/
北京大学附属中学,全国重点,公办,中学,北京市海淀区黄庄北大附中,010-62555594,北京市,北京市,海淀区,http://www.pkuschool.edu.cn
东北师范大学附属中学,省重点,公办,中学,吉林省长春市自由大路506号,0431-85608927 85677272,吉林省,长春市,朝阳区,http://www.msannu.cn/
北京市十一学校,市重点,公办,中学,北京市海淀区玉泉路66号,010-68272381,北京市,北京市,海淀区,http://www.bjshiyi.org.cn
长沙市雅礼中学,省重点,公办,中学,湖南省长沙市雨花区劳动西路428号,0731-5532038,湖南省,长沙市,雨花区,http://www.yali.hn.cn/yalinew
石家庄第二中学,省重点,公办,中学,河北省石家庄市兴凯路187号,0311--7022964 7022492,河北省,石家庄市,新华区,http://www.sjzez.com
清华大学附属中学,全国重点,公办,中学,北京市海淀区圆明园东路,010-62789541,北京市,北京市,海淀区,https://www.qhfz.edu.cn/
北京师范大学附属第二中学,市重点,公办,中学,北京市西城区新街口外大街12号,010-62354504,北京市,北京市,西城区,http://www.shsbnu.net/cms/832/sdmh/index.shtml
中央民族大学附属中学,市重点,公办,中学,北京市海淀区法华寺甲5号,010-68938228,北京市,北京市,海淀区,http://www.mdfz.com.cn
西北工业大学附属中学,省重点,公办,中学,陕西省西安市碑林区友谊西路127号,029 - 88492401 029 - 88494872,陕西省,西安市,碑林区,http://www.xgdfz.com/
成都市第七中学,省重点,公办,中学,四川省高新区剑南大道中段盛安街（高新校区）/林荫中街1号（林荫校区）,028-85483869  028-69152577,四川省,成都市,高新区,http://www.cdqz.net/
郑州外国语学校,省重点,公办,中学,河南省郑州市高新技术开发区枫杨街与银屏路交叉口,0371-7987877 0371-67998111,河南省,郑州市,高新区,http://www.zzfls.com.cn/websites/index.jsp
湖南师范大学附属中学,省重点,公办,中学,湖南长沙岳麓区桃子湖路48号,0731-88885855、88886669、88882315,湖南省,长沙市,岳麓区,https://www.hnsdfz.org/
西安高新第一中学,省重点,民办,中学,陕西省西安市高新区唐延路23号（西安海关南侧）,029-88323755,陕西省,西安市,高新区,
浙江省镇海中学,省重点,公办,中学,浙江省宁波市镇海区鼓楼东路32号,0574-86272378,浙江省,宁波市,镇海区,http://www.zhzx.net.cn
山西大学附属中学,省重点,公办,中学,山西省太原市小店区坞城西街9号,0351-7073436,山西省,太原市,小店区,http://www.sxdxfz.cn
重庆巴蜀中学,全国重点,公办,中学,重庆市渝中区北区路51号,023-63002371,重庆市,重庆市,渝中区,http://www.bashu.com.cn
浙江省杭州市第二中学,省重点,公办,中学,杭州市建国中路36号,0571-87072869,浙江省,杭州市,上城区,http://www.hz2hs.cn/
重庆南开中学,全国重点,公办,中学,重庆市沙坪坝区沙南街一号,023-65312786,重庆市,重庆市,沙坪坝区,http://www.nks.edu.cn/page1.html
四川绵阳中学,省重点,公办,中学,四川省绵阳市剑门路西段26号,0816-2366440,四川省,绵阳市,涪城区,
武汉市第二中学,省重点,公办,中学,武汉市中山大道1469号,027-83801823,湖北省,武汉市,江岸区,http://www.whez.com.cn/
大连市第二十四中学,省重点,公办,中学,辽宁省大连市中山区解放路217号,0411-39912434 0411-82307507,辽宁省,大连市,中山区,https://www.dlhs24.com.cn/
北京市第五中学,市重点,公办,中学,北京市东城区细管胡同13号,010-64042971/64040729,北京市,北京市,东城区,
西安市铁一中学,省重点,公办,中学,陕西省西安市友谊东路120号,029-82327079  029-82328008,陕西省,西安市,碑林区,http://www.xatyz.com/
杭州学军中学,省重点,公办,中学,浙江省杭州市文三路188号,0571-88088529  0571-88052280,浙江省,杭州市,西湖区,http://www.hzxjhs.com
复旦大学附属中学,市重点,公办,中学,上海市杨浦区国权路383号,021-65640560,上海市,上海市,杨浦区,www.fdfz.cn/index.aspx
北京市第八中学,市重点,公办,中学,北京市西城区学院小街2号,010-66034661,北京市,北京市,西城区,https://www.no8ms.bj.cn/
北京市第二中学,市重点,公办,中学,北京市东城区内务部街15号,010-65274375,北京市,北京市,东城区,http://www.bjn2ms.net
首都师范大学附属中学,市重点,公办,中学,北京市海淀区北洼路33号,（010）68454176,北京市,北京市,海淀区,https://www.cnuhs.cn/
北京一零一中学,普通,公办,中学,北京市海淀区颐和园路11号,62566753,北京市,北京市,海淀区,http://www.beijing101.com
东北育才中学,省重点,公办,中学,辽宁省沈阳市和平区南一马路100号,024-23783945,辽宁省,沈阳市,和平区,
天津市第一中学,市重点,公办,中学,天津市和平区西安道117号,022-23391126,天津市,天津市,和平区,http://tjyz.tj.edu.cn/
天津市耀华中学,全国重点,公办,中学,天津市和平区南京路106号,022-23394521,天津市,天津市,和平区,http://www.yaohua.org
本溪市高级中学,省重点,公办,中学,辽宁省本溪市平山区东明路91号,0414-3286000,辽宁省,本溪市,平山区,https://jyj.benxi.gov.cn/bxsgjzx/
襄阳市第五中学,省重点,公办,中学,湖北省襄阳市高新区邓城大道66号,0710-3530727,湖北省,襄阳市,襄州区,http://www.xf5z.com
天津市南开中学,全国重点,公办,中学,天津市南开区南开四马路22号,022—27483391,天津市,天津市,南开区,http://www.nkzx.cn/
华南师范大学附属中学,全国重点,民办,中学,广东省广州市天河区中山大道西1号,020-38630561 38630511,广东省,广州市,天河区,http://www.hsfz.net.cn/homepage/index.jsp
湖南长沙市第一中学,省重点,公办,中学,湖南省长沙市开福区清水塘路53号,（0731）82774885,湖南省,长沙市,开福区,
天津市杨村第一中学,市重点,公办,中学,天津市武清新城南东路282号,022－59689168  82171242,天津市,天津市,武清区,
衡水市第二中学,省重点,公办,中学,河北省衡水市问津北街98号/衡水市新华西路256号,0318-2135271 2817707,河北省,衡水市,,http://www.hsez.net/
大连育明高级中学,省重点,公办,中学,辽宁省大连市沙河口区杨树街70号,0411-84759193  0411-84759866 0411-8475,辽宁省,大连市,沙河口区,http://www.dlymgz.com/in...
天津新华中学,全国重点,公办,中学,天津市河西区马场道99号,022-23288278,天津市,天津市,河西区,http://www.xinhuaedu.cn
北京市第一七一中学,普通,公办,中学,北京市东城区和平里北街8号,010-64279121,北京市,北京市,东城区,http://www.171sch.com/
浙江省温州中学,省重点,公办,中学,浙江省温州市瓯海区梧田大道2号,0577-86760802　,浙江省,温州市,瓯海区,http://www.wzms.com/
北京市第八十中学,区重点,公办,中学,北京市朝阳区望京北路甲16号,010-58047000-7009（校长）010-58047000-7023（教学处）,北京市,北京市,朝阳区,http://www.bj80.com/
北京市第十二中学,普通,公办,中学,北京市丰台区益泽路15号,（010）63807904,北京市,北京市,丰台区,http://www.bj12hs.com.cn/
西北师范大学附属中学,省重点,公办,中学,甘肃省兰州市安宁区十里店南街21号,（0931）7752517,甘肃省,兰州市,安宁区,http://www.nwnusch.cn/
上海市七宝中学,市重点,公办,中学,上海市徐汇区农南路22号,021-64592100,上海市,上海市,闵行区,www.qbhs.icampus.cn
北京市第十三中学,市重点,公办,中学,北京市第十三中学坐落在西城区柳荫街27号,010 - 6185970,北京市,北京市,西城区,http://www.bj13zhx.com/
天津实验中学,全国重点,公办,中学,天津市河西区平山道1号,022-23358689,天津市,天津市,河西区,http://www.tjsyzx.cn/cn/index.asp
景山学校,市重点,公办,中学,北京市东城区灯市口大街53号,010-65252555,北京市,北京市,东城区,http://jscy.bjchyedu.cn/
襄阳市第四中学,省重点,公办,中学,湖北省襄阳市襄城东街26号,0710-3511057（校办） 0710-3553666（招办）,湖北省,襄阳市,襄州区,www.xf4hs.com
北京市八一中学,市重点,公办,中学,北京市海淀区苏州街29号,010-62566896,北京市,北京市,海淀区,https://byxx.bjhdedu.cn/
汇文中学,市重点,公办,中学,北京市东城区培新街6号,010-67117375,北京市,北京市,东城区,http://www.huiwen.edu.cn/
北京师范大学附属中学,省重点,公办,中学,北京市西城区南新华街18号,010-63014680-207,北京市,北京市,西城区,https://www.bjsdfz.com/
吉林大学附属中学,省重点,公办,中学,吉林省长春市南关区解放大路3059号,0431-88499352,吉林省,长春市,,http://fszx.jlu.edu.cn/
交通大学附属中学,普通,公办,中学,上海市宝山区殷高路42号,021-65911010,上海市,上海市,宝山区,https://fz.sjtu.edu.cn/
哈尔滨市第三中学,省重点,公办,中学,黑龙江省哈尔滨市南岗区果戈里大街415号,0451-53636578,黑龙江,哈尔滨市,南岗区,
上海交通大学附属中学,市重点,公办,中学,上海殷高路42号,021- 65911010,上海市,上海市,宝山区,www.jdfz.sh.cn
福州第一中学,省重点,公办,中学,福建省福州市东街附近,0591-87551426,福建省,福州市,鼓楼区,
北京市一六一中学,市重点,公办,中学,北京市西城区西长安街1号,010-66054717,北京市,北京市,西城区,http://www.bj161zhx.cn/
乐成公立寄宿学校,市重点,公办,中学,浙江省温州市乐清市城南街道朋岙村,0577-27882222 27886111 27886101,浙江省,温州市,乐清市,
深圳中学,省重点,公办,中学,广东省深圳市罗湖区人民北路深中街18号,0755-82222572,广东省,深圳市,罗湖区,http://www.shenzhong.net
云南师范大学附属中学,省重点,公办,中学,云南省昆明市高新开发区洪源路36号,0871-68312226  0871-68313609,云南省,昆明市,,https://www.ynsdfz.net/
南京师范大学附属中学,省重点,公办,中学,南京市鼓楼区察哈尔路37号（校本部）,0527-82898588,江苏省,南京市,鼓楼区,http://www.nsfzxc.cn
合肥市第一中学,省重点,公办,中学,安徽省合肥市滨湖新区西藏路2356号,0551-2911006 180-9663-1182,安徽省,合肥市,包河区,http://www.hfyz.net/
辽宁省实验中学,省重点,公办,中学,辽宁省沈阳市皇姑区黄河南大街 89 号/于洪区西江北街117号（北校）,024-86233600  024-89293107,辽宁省,沈阳市,皇姑区,http://www.lnsyzx.com/Index.html
牛栏山一中,市重点,公办,中学,北京市顺义区顺安路99号,010 - 81480932,北京市,北京市,顺义区,http://www.nlsyz.com.cn/
武汉外国语学校,全国重点,公办,中学,武汉市经济技术开发区龙阳大道太子湖1号,027 - 84897315 85764750,湖北省,武汉市,江汉区,
上海市格致中学,市重点,公办,中学,上海市黄浦区广西北路66号,021-63615180 021-63510228,上海市,上海市,黄浦区,www.gezhi.sh.cn
宁夏银川一中,省重点,公办,中学,宁夏银川市兴庆区民族南街656号,0951－4102908  0951-4104858,宁夏,银川市,兴庆区,
福建省厦门双十中学,省重点,公办,中学,福建省厦门市镇海路33号/厦门市湖里区枋湖路789,0592-2117888,福建省,厦门市,思明区,http://www.sszx.cn/
乌鲁木齐市第一中学,省重点,公办,中学,新疆乌鲁木齐市健康路一巷9号,9912826965,新疆,乌鲁木齐市,天山区,
南京外国语学校,省重点,民办,中学,江苏省南京市玄武区北京东路30号,025-84555412,江苏省,南京市,玄武区,http://www.nfls.com.cn
成都外国语学校,省重点,民办,中学,成都市高新西区百草路东段35号,028-87820768、87822188,四川省,成都市,高新区,
上海市建平中学,市重点,公办,中学,上海市浦东新区崮山路517号,021-58851542,上海市,上海市,浦东新区,www.jianping.com.cn/jpweb/index.php
福建省厦门第一中学,省重点,公办,中学,福建省厦门市思明区文园路93号,0592-2021908,福建省,厦门市,思明区,https://xmyz.xmedu.cn/index.html
北京市第十五中学,市重点,公办,中学,北京市西城区育新街2号,010-63520235,北京市,北京市,西城区,
广渠门中学,区重点,公办,中学,北京市白桥大街甲1号,010-67183773,北京市,北京市,东城区,
延安中学,市重点,公办,中学,上海市长宁区茅台路1111号,021-62901188,上海市,上海市,长宁区,http://shyahs.chneic.sh.cn/WebSite.Net/
大庆实验中学,省重点,公办,中学,大庆市高新技术产业开发园区秀水路6号,0459—8156179,黑龙江,大庆市,,
上海市实验学校,区重点,公办,中学,上海市浦东区东明路300号,021-50866695,上海市,上海市,浦东新区,www.ses.sh.edu.cn...
宝坻区第一中学,市重点,公办,中学,天津市宝坻区海滨街北城路东段1号,022-29228996,天津市,天津市,宝坻区,
杭州外国语学校,省重点,公办,中学,浙江省杭州市小和山高教园299号,0571-85289110,浙江省,杭州市,西湖区,http://www.chinahw.net/html
贵阳市第一中学,省重点,公办,中学,贵州省贵阳市金阳新区兴筑东路1号,0851-7986565,贵州省,贵阳市,乌当区,https://www.gyyz.com.cn/
天津市静海县第一中学,市重点,公办,中学,天津市静海县地纬路中段,022-68600800,天津市,天津市,静海区,
上海市曹杨第二中学,市重点,公办,中学,上海市普陀区梅川路160号,021-62548322  62853210 62548645,上海市,上海市,普陀区,www.hscyez.pte.sh...
新疆生产建设兵团第二中学,省重点,公办,中学,新疆乌鲁木齐市五星南路376号,0991-2633933  0991-2630704,新疆,乌鲁木齐市,,
海南中学,普通,公办,中学,上海市虹口区百官街1号,63242016,上海市,上海市,虹口区,https://www.haizhong.edu.cn/web/pages/page/index.jsp
上海外国语大学附属外国语学校,市重点,公办,中学,上海市虹口区中山北一路295号,021-65423105,上海市,上海市,虹口区,http://www.sfls.cn
上海外国语大学附属浦东外国语学校,市重点,公办,中学,上海市浦东区达尔文路91号,021-58550028,上海市,上海市,浦东新区,http://www.msshw.pudong-edu.sh.cn/SiteFiles/Inner/page.aspx?s=3
曲靖第一中学,省重点,公办,中学,云南省曲靖市麒麟区内环东路86号,0874-3122416,云南省,曲靖市,麒麟区,
呼和浩特市第二中学,省重点,公办,中学,内蒙古呼和浩特市呼伦南路1号,0471-6920044,内蒙古,呼和浩特市,,
广东实验中学,省重点,公办,中学,广州市越秀区中山四路51号　,（020）83810947、83818022,广东省,广州市,越秀区,http://www.gdsyzx.edu.cn
汕头市金山中学,省重点,公办,中学,广东省汕头市石海关顶,0754-87374368,广东省,汕头市,濠江区,https://www.stjszx.net/
广东广雅中学,省重点,公办,中学,广东省广州市荔湾区西湾路1号,020-81261232,广东省,广州市,荔湾区,http://www.gyzx.edu.cn/
广州市执信中学,省重点,公办,中学,广州市越秀区执信南路152号,020-87778382,广东省,广州市,越秀区,http://www.zhxhs.net/
中山纪念中学,省重点,公办,中学,广东省中山市南朗镇翠亨村正街,0760-85501869,广东省,中山市,,http://www.zsjz.com
深圳外国语学校,省重点,公办,中学,广东省深圳市福田区红荔路2005号,0755-83354153  0755-25282036,广东省,深圳市,福田区,https://www.sfls.net.cn/
汕头市潮阳实验学校,省重点,民办,中学,广东省汕头市潮阳区棉北街道城北四路东段,0754-88726528 88722222,广东省,汕头市,潮阳区,
深圳实验学校,省重点,公办,中学,广东省深圳市南山区西丽街道同发路99号,0755-83361223,广东省,深圳市,南山区,http://www.szsy.cn
郑州市第一中学,省重点,公办,中学,郑州市中原西路182号,0371-67882208,河南省,郑州市,中原区,http://www.zzyz.com.cn/
河南省实验中学,省重点,公办,中学,河南省郑州市金水区农业路10号（河南博物院西200米）,0371-63943667,河南省,郑州市,金水区,http://syzx.haedu.gov.cn/
邯郸县第一高级中学,市重点,公办,中学,河北省邯郸市邯郸县雪驰路96号,0310-8015396,河北省,邯郸市,邯郸县,
南阳市第一中学,省重点,公办,中学,河南省南阳市建设东路1366号,0377-63035139,河南省,南阳市,,http://www.nyyz.ha.cn/
河南省开封高级中学,省重点,公办,中学,河南省开封铁路北沿街223号,0378-5951776,河南省,开封市,,http://www.kaigao.com/?S=uu6kpbsvnaq
安阳市第一中学,省重点,公办,中学,河南省安阳市文明大道327号,0372-2988976,河南省,安阳市,,http://www.ayyz.cn/
林州市第一中学,省重点,公办,中学,河南省安阳市林州市龙山路中路35号,0372-6811510,河南省,安阳市,林州市,http://www.lzsdyzx.cn/
河南师范大学附属中学,省重点,公办,中学,河南省新乡市建设路164号,0373-3383049,河南省,新乡市,,http://www.hnsdfz.cn/main.htm
河南省信阳高级中学,省重点,公办,中学,河南省信阳市浉河区文化街6号,0376-6682186,河南省,信阳市,狮河区,http://www.xygz.com.cn/
天津市杨村一中,市重点,公办,中学,天津市武清新城南东路282号,022－59689168  82171242,天津市,天津市,武清区,
天津市新华中学,全国重点,公办,中学,天津市河西区马场道99号,022-23288278,天津市,天津市,河西区,http://xhzx.tj.edu.cn/
天津市第四中学,市重点,公办,中学,天津市河西区隆昌路11号,022-28323157,天津市,天津市,河西区,
天津市第十二中学,,,,常德道58号,,天津市,天津市,,
天津市宝坻区第一中学,市重点,公办,中学,天津市宝坻区海滨街北城路东段1号,022-29228996,天津市,天津市,宝坻区,
天津市静海区第一中学,市重点,公办,中学,天津市静海县地纬路中段,022-68600800,天津市,天津市,静海区,
曲靖市第一中学,省重点,公办,中学,云南省曲靖市麒麟区内环东路86号,0874-3122416,云南省,曲靖市,麒麟区,
昆明市第一中学,省重点,公办,中学,云南省昆明市五华区西昌路233号,0871-5325970 15887078301,云南省,昆明市,五华区,
玉溪市第一中学,省重点,公办,中学,云南省玉溪市太极路21号,0877-2024003  0877-8882095,云南省,玉溪市,,
昆明市第三中学,省重点,公办,中学,云南昆明市书林街131号,（0871）3103131,云南省,昆明市,,https://www.kmsz.net/#/
大理市下关第一中学,省重点,公办,中学,云南省大理市下关龙溪路69号,0872—2121847,云南省,大理,大理市,
昭通市第一中学,省重点,公办,中学,云南省昭通市昭阳区学生路181号,0870-2168019,云南省,昭通市,昭阳区,
腾冲市第一中学,省重点,公办,中学,云南省腾冲县腾越镇山源社区沙家巷小区1号,0875-5131137,云南省,保山市,腾冲县,
云天化中学,省重点,民办,中学,云南省昭通市水富县,0870-8667010,云南省,昭通市,水富县,
临沧市第一中学,省重点,公办,中学,云南省临沧市灵山路1号,0883-2123988,云南省,临沧市,,http://www.lcyzh.com/
重庆第一中学,市重点,公办,中学,重庆市沙坪坝区沙南街2号,023-65303495  65307121,重庆市,重庆市,沙坪坝区,http://www.cqyz.cn
重庆市第八中学,市重点,公办,中学,重庆市沙坪坝区小龙坎正街96号,023-61703000,重庆市,重庆市,沙坪坝区,
西南大学附属中学,市重点,公办,中学,重庆市北碚区杜家街43号,023-68356002,重庆市,重庆市,北碚区,
重庆巴川中学,市重点,民办,中学,重庆市铜梁县东城街道办事处塔山东街666号,023-45670333,重庆市,重庆市,铜梁区,www.bcschool.cn
重庆市育才中学校,市重点,公办,中学,重庆市九龙坡区谢家湾正街92号,023-68822468 023-86051188,重庆市,重庆市,九龙坡区,
重庆外国语学校,市重点,公办,中学,重庆市高新区石桥铺红育坡1号（A区）重庆市九龙园区华龙大道10号（B区）,023-68612896,重庆市,重庆市,九龙坡区,http://www.cqfls.cn
重庆求精中学,市重点,公办,中学,重庆市渝中区中山四路69号,023-63866652,重庆市,重庆市,渝中区,http://www.qjzx.cn
重庆市第十一中学校,市重点,公办,中学,重庆市南岸区弹子石,023-62511889,重庆市,重庆市,南岸区,http://www.cqsyz.com/
江苏省天一中学,省重点,公办,中学,江苏省无锡锡山区东亭二泉中路18号,0510-88223001,江苏省,无锡市,锡山区,http://www.tyzx.com.cn/
江苏省常州高级中学,省重点,公办,中学,江苏省常州市罗汉路8号,0519-88111202,江苏省,常州市,,http://www.scz.czedu.cn/
江苏省海门中学,省重点,公办,中学,江苏省海门市海门镇育才路1号,0513-82212218,江苏省,南通市,海门市,http://www.jsshmzx.com/
无锡市大桥实验学校,市重点,民办,中学,江苏省无锡市学前街38号/江苏无锡菱湖大道和具区路交界口,0510-82758311,江苏省,无锡市,滨湖区,https://www.daqiao.org.cn/
南京市金陵中学,省重点,公办,中学,江苏省南京市鼓楼区中山路169号,025-84786227  025-84786296,江苏省,南京市,鼓楼区,http://www.jlhs.net/index2.jsp
苏州中学,省重点,公办,中学,江苏省苏州市人民路699号,0512-65194261  0512-65195262,江苏省,苏州市,沧浪区,http://www.szzx1000.com
江苏省淮阴中学,省重点,公办,中学,江苏省淮安市解放东路99号,0517-83518888,江苏省,淮安市,淮阴区,http://www.huaizhong.com.cn/
江苏省海安高级中学,省重点,公办,中学,江苏海安市新华东路1号,0513-88826048,江苏省,南通市,海安县,http://www.hazx.org.cn/
江西师范大学附属中学,省重点,公办,中学,江西省南昌市青山湖区北京西路194号,0791-8507088,江西省,南昌市,青山湖区,http://www.jxsdfz.com/
临川市第一中学,省重点,公办,中学,江西省抚州市临川区上顿渡镇建设路205号,0794-8441447   0794-8430071,江西省,抚州市,临川区,http://www.lcyz.net/
南昌市第二中学,普通,公办,中学,南昌市苏圃路1号,,江西省,南昌市,南昌县,http://2z.nceduc.cn/
临川第二中学,省重点,公办,中学,江西省抚州临川区上顿渡镇龙津路67号,0794-8441448,江西省,抚州市,临川区,http://www.lcez.com.cn/
九江市第一中学,省重点,公办,中学,江西省九江市滨湖路1号,0792-8238623,江西省,九江市,九江县,http://www.jjyz.cn/
南昌县莲塘一中,省重点,公办,中学,江西省南昌县莲塘镇澄湖西路1566号,0791-5715981,江西省,南昌市,南昌县,
吉安市第一中学,省重点,公办,中学,江西省吉安市吉州区沿江路97-1号,0796---8263254,江西省,吉安市,吉州区,
江西省鹰潭市第一中学,省重点,公办,中学,江西省鹰潭市胜利西路8号,0701-6221343  0701—6289277,江西省,鹰潭市,,https://www.ytsyz.com.cn/
余江区第一中学,省重点,私立,中学,江西省鹰潭市余江县白塔路,0701-5885968,江西省,鹰潭市,余江县,http://www.jxyjyz.com/
新余市第一中学,普通,公办,中学,江西省新余市沿江路358号,0790-6660011/0790-6660039,江西省,新余市,,
成都市石室中学,省重点,公办,中学,四川省成都市青羊区文庙前街93号,028-86119108 028-86139976,四川省,成都市,青羊区,https://www.cdshishi.net/
四川省绵阳中学,省重点,公办,中学,四川省绵阳市剑门路西段26号,0816-2366440,四川省,绵阳市,涪城区,http://www.scmyzx.com.cn/pcweb/index.htm
成都市树德中学,省重点,公办,中学,成都市宁夏街树德里４号,028-86697520,四川省,成都市,青羊区,http://www.sdzx.net/
成都市外国语学校,省重点,民办,中学,成都市高新西区百草路东段35号,028-87820768、87822188,四川省,成都市,高新区,http://www.cfls.net.cn/
四川省绵阳南山中学,省重点,公办,中学,四川省绵阳市南塔路3号,0816-2862314,四川省,绵阳市,,http://www.scmyns.com/
绵阳东辰国际学校,市重点,民办,中学,四川省绵阳市科创园区,0816-2324410,四川省,绵阳市,,http://www.mydcis.net/
成都实验外国语学校,市重点,民办,中学,成都市羊犀线高新西区百草路,028-87855781  028-87857591,四川省,成都市,温江区,http://www.cefls.cn/
四川省南充高级中学,省重点,公办,中学,四川省南充市涪江路27号,0817-2224270,四川省,南充市,,http://www.scncgz.net/
