成员名称,成员类型,成员级别
吉林财经学校,职业院校,首批联合发起单位
安徽国际商务职业教育集团,职业教育集团,首批联合发起单位
吉林电子信息职业技术学院,职业院校,首批联合发起单位
北京市现代服务业职业教育集团,职业教育集团,首批联合发起单位
陕西现代服务职业教育集团,职业教育集团,首批联合发起单位
济南工程职业技术学院,职业院校,首批联合发起单位
江苏财会职业学院,职业院校,首批联合发起单位
江苏财经职业技术学院,职业院校,首批联合发起单位
江苏财经职业教育集团,职业教育集团,首批联合发起单位
浙江商业职业教育集团,职业教育集团,首批联合发起单位
北京智欣联创科技有限公司,企业,首批联合发起单位
上海名聚网络技术有限公司,企业,首批联合发起单位
上海慧泉管理顾问有限公司,企业,首批联合发起单位
上海敏学信息技术有限公司,企业,首批联合发起单位
北京信达嘉鼎科技有限公司,企业,首批联合发起单位
彼威达管理咨询（北京）有限公司,企业,首批联合发起单位
江苏经贸职业技术学院,职业院校,首批联合发起单位
新道科技股份有限公司,企业,首批联合发起单位
天津中道博雅企业管理顾问有限公司,企业,首批联合发起单位
江苏农牧科技职业学院,职业院校,首批联合发起单位
江苏商贸职业教育集团,职业教育集团,首批联合发起单位
杭州哲达教育咨询有限公司,企业,首批联合发起单位
北京中商汇才教育管理咨询有限公司,企业,首批联合发起单位
北京杰威品牌营销顾问有限公司,企业,首批联合发起单位
南京杰伊汉服饰有限公司,企业,首批联合发起单位
江苏商贸职业学院,职业院校,首批联合发起单位
苏果超市有限公司,企业,首批联合发起单位
中教畅享（北京）科技有限公司,企业,首批联合发起单位
江苏百瑞赢证券咨询有限公司,企业,首批联合发起单位
中国人寿南京市银保理财中心,企业,首批联合发起单位
江苏标昂体育文化传播有限公司,企业,首批联合发起单位
方山体育中心小球训练基地,企业,首批联合发起单位
南京市保安服务总公司雨花台分公司,企业,首批联合发起单位
江苏省丹阳中等专业学校,职业院校,首批联合发起单位
百色学院,职业院校,首批联合发起单位
无锡商业职业技术学院,职业院校,首批联合发起单位
江苏食品药品职业技术学院,职业院校,首批联合发起单位
陕西工商职业学院,职业院校,首批联合发起单位
安徽城市管理职业学院,职业院校,首批联合发起单位
湖南商务职业技术学院,职业院校,首批联合发起单位
江苏现代服务业职业教育集团,职业教育集团,首批联合发起单位
江西陶瓷工艺美术职业技术学院,职业院校,首批联合发起单位
长春职业技术学院,职业院校,首批联合发起单位
甘肃钢铁职业技术学院,职业院校,首批联合发起单位
湖南现代物流职业技术学院,职业院校,首批联合发起单位
苏州经贸职业技术学院,职业院校,首批联合发起单位
黑龙江农业经济职业学院,职业院校,首批联合发起单位
四川财经职业学院,职业院校,首批联合发起单位
潍坊工程职业学院,职业院校,首批联合发起单位
滁州职业技术学院,职业院校,首批联合发起单位
桂林旅游学院旅游休闲与管理学院,职业院校,首批联合发起单位
经济科学出版社,媒体,首批联合发起单位
河北建材职业技术学院,职业院校,首批联合发起单位
酒泉职业技术学院,职业院校,首批联合发起单位
鄄城县职业中等专业学校,职业院校,首批联合发起单位
日照职业技术学院（商学院）,职业院校,首批联合发起单位
长江职业学院,职业院校,首批联合发起单位
辽宁农业职业技术学院,职业院校,首批联合发起单位
广州大学华软软件学院,职业院校,首批联合发起单位
黑龙江煤炭职业技术学院,职业院校,首批联合发起单位
自贡职业技术学校,职业院校,首批联合发起单位
武汉软件工程职业学院,职业院校,首批联合发起单位
广西经贸职业技术学院,职业院校,首批联合发起单位
长春国际经济贸易职业学校,职业院校,首批联合发起单位
包头服务管理职业学校,职业院校,首批联合发起单位
广西职业技术学院,职业院校,首批联合发起单位
辽宁轻工职业学院,职业院校,首批联合发起单位
辽宁现代服务业职业教育集团,职业教育集团,首批联合发起单位
新疆应用职业技术学院,职业院校,首批联合发起单位
安徽国际商务职业学院,职业院校,首批联合发起单位
辽宁现代服务职业技术学院,职业院校,首批联合发起单位
美国管理会计师协会中国教育分会,社会团体,首批联合发起单位
南京城市职业学院,职业院校,首批联合发起单位
枣庄科技职业学院,职业院校,首批联合发起单位
南京江宁中等专业学校,职业院校,首批联合发起单位
黑龙江信息技术职业学院,职业院校,首批联合发起单位
上海市商贸旅游学校,职业院校,首批联合发起单位
河北政法职业学院,职业院校,首批联合发起单位
苏州工业园区服务外包职业学院,职业院校,首批联合发起单位
南京市莫愁中等专业学校,职业院校,首批联合发起单位
武汉船舶职业技术学院,职业院校,首批联合发起单位
广东轻工职业技术学院,职业院校,首批联合发起单位
西安外事学院,职业院校,首批联合发起单位
南京玄武中等专业学校,职业院校,首批联合发起单位
南京一银一幕影视传媒有限公司,企业,首批联合发起单位
宁波城市职业技术学院,职业院校,首批联合发起单位
北京市商业学校,职业院校,首批联合发起单位
浙江金融职业学院国际商学院,职业院校,首批联合发起单位
宁波拓智企业管理服务有限公司,企业,首批联合发起单位
品牌研究,媒体,首批联合发起单位
黔东南民族职业技术学院,职业院校,首批联合发起单位
青海卫生职业技术学院,职业院校,首批联合发起单位
广西科技职业学院,职业院校,首批联合发起单位
西安翻译学院,职业院校,首批联合发起单位
湖北交通职业技术学院,职业院校,首批联合发起单位
河北女子职业技术学院,职业院校,首批联合发起单位
广东邮电职业技术学院,职业院校,首批联合发起单位
广东农工商职业技术学院,职业院校,首批联合发起单位
重庆市商务职业学院,职业院校,首批联合发起单位
江苏海事职业技术学院 人文艺术学院,职业院校,首批联合发起单位
广州科技贸易职业学院,职业院校,首批联合发起单位
广东省湛江财贸中等专业学校,职业院校,首批联合发起单位
青田县职业技术学校,职业院校,首批联合发起单位
清华大学出版社有限公司,企业,首批联合发起单位
全球品牌研究智库联盟,科研机构,首批联合发起单位
山东畜牧兽医职业学院,职业院校,首批联合发起单位
南京金陵中等专业学校,职业院校,首批联合发起单位
山东电子职业技术学院,职业院校,首批联合发起单位
山东经贸职业学院,职业院校,首批联合发起单位
山东商业职业技术学院,职业院校,首批联合发起单位
山东省畜牧职业教育集团,职业教育集团,首批联合发起单位
浙江商业职业技术学院,职业院校,首批联合发起单位
中国肉类协会,社会团体,首批联合发起单位
山东省济宁卫生学校,职业院校,首批联合发起单位
中国仓储与配送协会,社会团体,首批联合发起单位
中国商业文化研究会,社会团体,首批联合发起单位
中国流通行业管理与思想政治工作研究会,社会团体,首批联合发起单位
中国饭店协会,社会团体,首批联合发起单位
中国商业会计学会,社会团体,首批联合发起单位
中国会展经济研究会,社会团体,首批联合发起单位
中国商业统计学会,社会团体,首批联合发起单位
PMI中国,社会团体,首批联合发起单位
中国国际商会商业行业商会,社会团体,首批联合发起单位
中国标准化协会,社会团体,首批联合发起单位
中国商贸杂志社,媒体,首批联合发起单位
山东省现代服务业职业教育集团,职业教育集团,首批联合发起单位
山东外国语职业学院,职业院校,首批联合发起单位
职业经理研究中心,事业单位,首批联合发起单位
中国国际贸易促进委员会商业行业分会,事业单位,首批联合发起单位
（国资委）商业国际交流合作培训中心,事业单位,首批联合发起单位
中国国际贸易促进委员会苏州市委员会,事业单位,首批联合发起单位
陕西自贸区研究院,科研机构,首批联合发起单位
广东省时尚服装研究院,科研机构,首批联合发起单位
深圳国泰安教育技术股份有限公司,企业,首批联合发起单位
安徽工商职业学院,院校,
澳门市务学会,社会团体,
北京安亚中泰教育科技有限公司,企业,
北京恒盛鑫源管理咨询有限公司,企业,
北京华财会计股份有限公司,企业,
北京华晟经世信息技术有限公司,企业,
北京华唐中科科技集团有限公司,企业,
北京汇易仁合教育咨询有限公司,企业,
北京经济管理职业学院,院校,
北京欧华远景教育投资顾问有限公司,企业,
北京企业管理咨询协会,社会团体,
北京三快在线科技有限公司,企业,
北京云泽科技有限公司,企业,
北京正成科技有限公司,企业,
北京中科致远科技责任有限公司,企业,
北京卓途教育科技发展有限公司,企业,
毕节职业技术学院,院校,
常州机电职业技术学院,院校,
成都市均衡营养保健技能培训学校,企业,
成都市轻语职业技能培训学院,企业,
达州市达川区银河职业技术学院,院校,
大连市现代服务职业教育集团,职教集团,
德州职业技术学院,院校,
东营市东营区职业中等专业学校,院校,
敦煌网,企业,
方圆标志认证集团有限公司,企业,
佛山职业技术学院,院校,
福州墨尔本理工职业学院,院校,
赣南师范大学,院校,
广东工贸职业技术学院,院校,
广东科贸职业学院,院校,
广东科学技术职业学院,院校,
广东生态工程职业学院,院校,
广西工商职业技术学院,院校,
广西软实力文化传播有限公司,企业,
广西商业学校,院校,
广州三易品牌管理咨询有限公司,企业,
贵州省毕节市同创职业培训学校有限责任公司,企业,
贵州盛华职业学院,院校,
桂林旅游学院,院校,
哈尔滨商业大学,院校,
海南蔚之蓝文化传播有限公司,企业,
合肥财经职业学院,院校,
黑龙江能源职业学院,院校,
湖北久协教育科技有限公司,企业,
湖南汽车工程职业学院,院校,
华鲁航空学院,院校,
华夏双创（北京）产业信息技术研究院有限公司,企业,
慧科教育科技集团有限公司,企业,
济南诚美信息咨询有限公司,企业,
济南人力资本产业研究院,企业,
济南职业学院,院校,
江苏海事职业技术学院,院校,
江苏农林职业技术学院,院校,
江苏省射阳中等专业学校,院校,
江苏省兴化中等专业学校,院校,
江西工业职业技术学院,院校,
京东物流集团,企业,
辽宁经济职业技术学院,院校,
柳州市第一职业技术学校,院校,
柳州市交通学校,院校,
泸州市胜蓝职业学校,院校,
洛阳科技职业学院,院校,
南京江宁高等职业技术学校,院校,
南京金陵高等职业技术学校,院校,
南京科技职业学院,院校,
南京蓝天教育集团有限公司,企业,
南京商业学校,院校,
南宁市东方睿智职业培训学校,企业,
宁波阶梯教育科技有限公司,企业,
日照职业技术学院,院校,
厦门市湖里区智源职业培训学校,院校,
厦门颜值立方信息科技有限公司,企业,
厦门铸远教育科技有限公司,企业,
山东金元致信教育科技有限公司,企业,
山东科技职业学院,院校,
山东蓝海酒店集团,企业,
山东理工职业学院,院校,
山东省养老产业职业教育集团,职教集团,
山东协和学院,院校,
山东信息职业技术学院,院校,
山东英才学院,院校,
陕西国际商贸学院,院校,
商业国际交流合作培训中心,事业单位,
上海思博职业技术学院,院校,
上海外国语大学贤达经济人文学院,院校,
深圳公共管理教育培训学院,企业,
深圳航天信息有限公司,企业,
深圳市鹏飞亚健康咨询服务中心,民非,
深圳市中孚恒升科技有限公司,企业,
沈阳城市学院,院校,
沈阳市助力生活职业技能培训学校,企业,
石家庄信息工程职业学院,院校,
天津艾诺利思教育信息咨询有限公司,企业,
天津美津会议服务有限公司,企业,
天津市职业大学,院校,
武汉职业技术学院,院校,
沿河土家族自治县博业职业培训学校,企业,
应天职业技术学院,院校,
云南坤尚科技有限公司,企业,
张掖市甘州区雪绒花职业培训学校,企业,
长垣烹饪职业技术学院,院校,
浙江金融职业学院,院校,
浙江精创教育科技有限公司,企业,
致理科技大学,院校,
中国国际贸易促进委员会商业行业委员会,事业单位,
中国商务出版社,企业,
中科智库物联网技术研究院,企业,
中山职业技术学院,院校,
重庆商务职业学院,院校,
7-11天津公司,企业,
北京奥派公司,企业,
北京百果园公司,企业,
北京环球网校,企业,
北京镭嘉商务服务有限公司,企业,
北京商鲲教育集团,企业,
博洛尼家具（北京）公司,企业,
渤海人力资源公司,企业,
诚通人力天津公司,企业,
高顿财务集团,企业,
浩物机电,企业,
河北故城瑞诚人才公司,企业,
华润集团ole,企业,
慧聪网天津公司,企业,
津轻人才有限公司,企业,
京东（北京）科技公司,企业,
林肯留学,企业,
梅江会展中心,企业,
南开大学接待服务中心,企业,
全国会展业产学合作联盟,企业,
瑞龙科技公司,企业,
斯普林恩投资公司,企业,
唐拉雅秀人力资源总监,企业,
天辰物流公司,企业,
天津傲翔航空科技咨询有限公司,企业,
天津百练会计公司,企业,
天津宝成集团,企业,
天津滨海金地投资公司,企业,
天津滨海人才,企业,
天津博维教育咨询公司,企业,
天津常战胜文化传播有限公司,企业,
天津崇德企业管理公司,企业,
天津大云电子商务有限公司,企业,
天津电子商务协会,企业,
天津方正国旅,企业,
天津光华教育公司,企业,
天津国能瀚威天然气投资有限公司,企业,
天津国腾创展商贸公司,企业,
天津海实伟业公司,企业,
天津好利来公司,企业,
天津恒佳企业管理服务公司,企业,
天津华住公司,企业,
天津欢乐谷,企业,
天津嘉里粮油集团,企业,
天津嘉信国旅,企业,
天津金沃斯教育公司,企业,
天津瑾信教育公司,企业,
天津科技投资公司,企业,
天津利民调料公司,企业,
天津利源精典环境工程有限公司,企业,
天津链家公司,企业,
天津猎聘网,企业,
天津旅游百事通公司,企业,
天津平安保险公司,企业,
天津巧美滋公司,企业,
天津庆应教育公司,企业,
天津瑞友教育科技公司,企业,
天津睿英教育咨询公司,企业,
天津胜景旅游公司,企业,
天津市饭店业协会,社会团体,
天津市文韬广告有限公司,企业,
天津涛涛国际贸易公司,企业,
天津卫鼎轩公司,企业,
天津鑫方盛五金交电公司,企业,
天津一汽夏利公司,企业,
天津永辉超市公司,企业,
天津优品生活有限公司,企业,
天津钰慧星辰科技有限公司,企业,
天津越美文化公司,企业,
天津智慧树公司,企业,
天津中富国旅,企业,
天津中天教育科技公司,企业,
天津中智商科技公司,企业,
万丽天津宾馆,企业,
中纽国际教育公司,企业,
中石化管道储运公司,企业,
中天睿智（天津）教育科技有限公司,企业,
中铁互联,企业,
北京华夏基石人力资源管理服务有限公司济南分公司,企业,
北京全聘致远科技有限公司,企业,
北京问学教育咨询有限责任公司,企业,
核电（山东）人力资源服务有限责任公司,企业,
济南博赛网络技术有限公司,企业,
济南高层次人才发展促进会,企业,
济南和光新能源投资合伙企业（有限合伙）,企业,
济南恒泰企业管理咨询有限公司,企业,
济南玖悦投资有限公司,企业,
济南泉链海沃数字科技有限公司,企业,
济南人力资本产业开发有限公司,企业,
济南三立企业管理咨询有限公司,企业,
济南胜悦投资管理有限公司,企业,
金兴教育科技（山东）集团有限公司,企业,
楷行天下（济南）教育咨询有限公司,企业,
人才有价（山东）有限公司,企业,
山东八月瓜大数据服务有限公司,企业,
山东百库教育,企业,
山东博冉企业管理咨询有限公司,企业,
山东博赛人力资本管理有限公司,企业,
山东博杏霖健康咨询服务公司,企业,
山东富翔源财税咨询集团有限公司,企业,
山东韩都动力电子商务有限公司,企业,
山东合聘信息技术有限公司,企业,
山东菏铁商业保理有限公司,企业,
山东军科教育科技有限公司,企业,
山东课后教育科技有限公司,企业,
山东桥海教育科技集团有限公司,企业,
山东青年政治学院,院校,
山东三生医药有限公司,企业,
山东闪亮教育科技集团有限公司,企业,
山东上扬教育咨询有限公司,企业,
山东省和君恒成管理咨询有限公司,企业,
山东省济南市高新公证处,企业,
山东省菁英信誉投资管理有限公司,企业,
山东省人才在线有限公司,企业,
山东桃智商业管理有限公司,企业,
山东调怡下健康科技有限公司,企业,
山东问学教育咨询有限公司,企业,
山东新愚公大数据科技有限公司,企业,
山东一站式企业服务有限公司,企业,
山东誉方健康咨询有限公司,企业,
山东原雅教育信息咨询有限公司,企业,
山东正立创业服务有限公司,企业,
山东致公法律服务有限公司,企业,
神州顶联科技有限公司,企业,
政商教育发展（山东）集团有限公司,企业,
中科云数字新媒体（山东）有限公司,企业,
中唐产业技术研究院（山东）有限公司,企业,
安康德隆公司,企业,
安康职业技术学院,院校,
宝鸡职业技术学院,院校,
北京奥鹏远程教育中心有限公司,企业,
比亚迪汽车有限公司,企业,
彬州市职业教育中心,事业单位,
昌吉职业技术学院,院校,
甘肃财贸职业学院,院校,
甘肃金味餐饮有限公司,企业,
甘肃林业职业技术学院,院校,
甘肃农业职业技术学院,院校,
广东粤境高速公路集团,企业,
海程邦达国际物流有限公司,企业,
汉中职业技术学院,院校,
河南中财嘉业集团,企业,
京东物流西北区域分公司,企业,
兰州龙企盟信息技术咨询服务有限责任公司,企业,
兰州石化职业技术学院,院校,
兰州现代职业技术学院,院校,
兰州职业技术学院,院校,
兰州资源环境职业技术学院,院校,
宁夏财经职业技术学院,院校,
宁夏民族职业技术学院,院校,
宁夏职业技术学院,院校,
青海柴达木职业技术学院,院校,
青海建筑职业技术学院,院校,
曲江芙蓉阁酒店,企业,
厦门网中网软件有限公司,企业,
陕西财经职业技术学院,院校,
陕西诚悦物业管理有限责任公司,企业,
陕西工业职业技术学院,院校,
陕西国防工业职业技术学院,院校,
陕西海外旅游有限责任公司,企业,
陕西华荣万盛食品有限公司,企业,
陕西华润万家生活超市有限公司,企业,
陕西机电职业技术学院,院校,
陕西交通职业技术学院,院校,
陕西境商集团,企业,
陕西爵乐府酒店管理有限公司,企业,
陕西能源职业技术学院,院校,
陕西曲江国际饭店有限公司,企业,
陕西赛彼得人力资源管理有限公司,企业,
陕西省第二商贸学校,院校,
陕西省电子信息学校,院校,
陕西省建筑材料工业学校,院校,
陕西省建筑职工大学,院校,
陕西省米脂职教中心,事业单位,
陕西省商贸学校,院校,
陕西省商业学校,院校,
陕西省镇安职教中心,事业单位,
陕西苏宁易购销售有限公司,企业,
陕西铁路工程职业技术学院,院校,
陕西万隆金剑工程管理咨询有限公司,企业,
陕西艺术职业学院,院校,
陕西易通人力资源开发有限责任公司,企业,
陕西银雁金融外包服务有限公司,企业,
陕西映秦文化传媒有限公司,企业,
陕西邮电职业技术学院,院校,
陕西职业技术学院,院校,
陕西众森网络科技有限公司,企业,
陕西自强中等专业学校,院校,
商洛国际医学中心医院,企业,
商洛职业技术学院,院校,
上海电气自动化研究所,企业,
上海外服（陕西）人力资源服务有限公司,企业,
天津滨海迅腾科技集团有限公司,企业,
铜川职业技术学院,院校,
渭南职业技术学院,院校,
乌鲁木齐职业大学,院校,
西安北方汽车技工学校,企业,
西安诚捷财务咨询有限公司,企业,
西安城市建设职业学院,院校,
西安创业物业发展有限公司,企业,
西安大唐西市酒店,企业,
西安大天瑞斯丽酒店,企业,
西安大雁塔假日酒店,企业,
西安海汇万家实业有限责任公司,企业,
西安航空职业技术学院,院校,
西安豪享来温德姆至尊酒店,企业,
西安昊威体育用品有限公司,企业,
西安华航唯实机器人科技有限公司,企业,
西安华荣魏家便利连锁有限公司,企业,
西安吉利汽车有限公司,企业,
西安金拱门食品有限公司,企业,
西安君唐教育科技有限公司,企业,
西安链家宝业房地产经纪有限公司,企业,
西安绿地酒店管理有限公司,企业,
西安米旗食品有限公司,企业,
西安盛美利亚酒店,企业,
西安世联投资咨询有限公司,企业,
西安市高陵区康宁老年公寓,事业单位,
西安市人人乐超市有限公司,企业,
西安市雁塔区小寨路街道红专路社区,企业,
西安思备居安企业管理有限公司,企业,
西安天朗物业管理有限公司,企业,
西安天天好利来食品有限公司,企业,
西安天域凯莱大饭店,企业,
西安铁路职业技术学院,院校,
西安医科高等专科学校,院校,
西安职业技术学院,院校,
西安中城卫安全防范有限公司,企业,
西安紫薇物业管理有限公司,企业,
西北工业学校,院校,
西宁城市职业技术学院,院校,
咸阳职业技术学院,院校,
新疆农业技术职业学院,院校,
新疆商业人才培训服务中心,企业,
延安职业技术学院,院校,
杨凌职业技术学院,院校,
伊犁职业技术学院,院校,
榆林职业技术学院,院校,
知含国际工程咨询有限公司,企业,
中国大地财产保险股份有限公司西安东开发区支公司,企业,
中华财险华北(西安)电销中心,企业,
中铁建物业管理有限公司西安分公司,企业,
中咨工程建设监理有限公司西安分公司,企业,
阿里巴巴宁波分公司,企业,
慈溪杭州湾酒店集团,企业,
慈溪市杭州湾职业高级中学,院校,
慈溪职业高级中学,院校,
奉化市职业教育中心,企业,
公牛集团有限公司,企业,
广博控股集团有限公司,企业,
广汇汽车股份有限公司,企业,
海宁市职业高级中学,院校,
杭州市富阳区职业教育中心,院校,
杭州市萧山区第二中等职业学校,院校,
杭州市萧山区第四中等职业学校,院校,
虹越花卉股份有限公司,企业,
汇绿园林建设发展有限公司,企业,
金华市第一中等职业学校,院校,
金华职业技术学院,院校,
锦堂高级职业中学,院校,
丽水职业技术学院,院校,
罗蒙集团股份有限公司,企业,
漫步宁波文化创意有限公司,企业,
宁波(国际)电子商务产业园,企业,
宁波艾斐堡箱柜制造有限公司,企业,
宁波薄利聚汽车销售服务有限公司,企业,
宁波北仑职业高级中学,院校,
宁波博洋服饰集团有限公司,企业,
宁波慈星股份有限公司,企业,
宁波大学科学技术学院,院校,
宁波电子行业协会,社会团体,
宁波东钱湖旅游学校,院校,
宁波高盛展览有限公司,企业,
宁波高新区杰米克服饰有限公司,企业,
宁波工程学院,院校,
宁波国际贸易投资有限公司展览分公司,企业,
宁波华博展览有限公司,企业,
宁波华和服装有限公司,企业,
宁波华侨豪生大酒店,企业,
宁波华数广电网络有限公司,企业,
宁波惠众财务服务有限公司,企业,
宁波简达国际货运代理股份有限公司,企业,
