成员名称,成员类型,成员级别
宁波建工工程集团有限公司,企业,
宁波建设工程学校,院校,
宁波轿辰集团股份有限公司,企业,
宁波金融研究院,院校,
宁波经贸学校,院校,
宁波经易数字视觉有限公司,企业,
宁波矩阵酒店设计有限公司,企业,
宁波聚元财富投资管理有限公司,企业,
宁波凯越国际贸易有限公司,企业,
宁波龙星物流有限公司,企业,
宁波旅游投资发展有限公司,企业,
宁波欧楠电子商务有限公司,企业,
宁波市保险行业协会,社会团体,
宁波市饭店业协会,社会团体,
宁波市非物质遗产办,事业单位,
宁波市风景园林协会,社会团体,
宁波市奉化天竺园艺有限公司,企业,
宁波市服装协会,社会团体,
宁波市建设集团股份有限公司,企业,
宁波市建筑装饰行业协会,社会团体,
宁波市旅游协会,社会团体,
宁波市南天房地产经纪有限公司,企业,
宁波市农业科学研究院,科研机构,
宁波市软件行业协会,社会团体,
宁波市鄞州职业教育中心学校,院校,
宁波市甬江职业高级中学,院校,
宁波市镇海区职业教育中心学校,院校,
宁波市职教中心学校,院校,
宁波市智慧城市规划标准发展研究院,科研机构,
宁波水墨江南文化传播有限公司,企业,
宁波四明职业高级中学,院校,
宁波腾峰企业管理集团有限公司,企业,
宁波同泽国际物流有限公司,企业,
宁波外运国际集装箱货运有限公司,企业,
宁波夏恩外国语培训学校,院校,
宁波雅戈尔服装控股有限公司,企业,
宁波银行四明支行,企业,
宁波优可美电子商务有限公司,企业,
宁波攸品邻里商业管理股份有限公司,企业,
宁波云朵网络科技股份有限公司,企业,
宁波职业技术学院,院校,
宁波中国科学院信息技术应用研究院,科研机构,
宁波中国青年旅行社有限公司,企业,
宁波中瑞税务师事务所,企业,
宁波注册税务师协会,社会团体,
宁海县高级职业技术中心学校,院校,
乔达国际货运(中国)有限公司宁波分公司,企业,
衢州职业技术学院,院校,
全球贸易通,企业,
绍兴越秀外国语学校,院校,
宋城演艺发展股份有限公司,企业,
桐乡技师学院,院校,
温岭市职业技术学校,院校,
温州科技职业技术学院,院校,
仙居县职业中等专业学校,院校,
象山县技工学校,院校,
鄞州职业高级中学(宁波交通工程学校),院校,
余姚第二职业技术学校,院校,
余姚市第四职业技术学校,院校,
余姚市第五职业技术学校,院校,
余姚市职成教中心学校,院校,
余姚市职业技术学校,院校,
长兴县职业技术教育中心学校,院校,
招离证券股份有限公司宁波营业部,企业,
浙江达人旅业股份有限公司,企业,
浙江纺织服装职业技术学院,院校,
浙江工商职业技术学院,院校,
浙江金网信息产业股份有限公司,企业,
浙江经贸职业技术学院,院校,
浙江开元酒店管理有限公司,企业,
浙江蓝海绿业集团,企业,
浙江迈新股份有限公司,企业,
浙江省创意设计协会,社会团体,
浙江省机电技师学院,院校,
浙江天略投资管理有限公,企业,
浙江天元十杰装饰工程有限公司,企业,
浙江万里学院,院校,
浙江中聘(集团)科技股份有限公司,企业,
中国国旅(宁波)国际旅行社有限公司,企业,
中基宁波集团股份有限公司,企业,
舟山市普陀职业技术教育中心,事业单位,
